    1   0.000000 192.168.206.134 → 192.168.14.3 TCP 68 8087 → 57658 [ACK] Seq=1 Ack=1 Win=501 Len=0 TSval=1643684675 TSecr=3439921143
    2   0.000009 192.168.206.134 → 10.109.16.113 TCP 68 55466 → 11211 [ACK] Seq=1 Ack=1 Win=507 Len=0 TSval=142709618 TSecr=2614894910
    3   0.000122 10.109.16.113 → 192.168.206.134 TCP 68 [TCP ACKed unseen segment] 11211 → 55466 [ACK] Seq=1 Ack=2 Win=502 Len=0 TSval=2614910014 TSecr=141758131
    4   0.000343 192.168.14.3 → 192.168.206.134 TCP 68 [TCP ACKed unseen segment] 57658 → 8087 [ACK] Seq=1 Ack=2 Win=507 Len=0 TSval=3439936247 TSecr=1643669724
    5   0.152214 192.168.14.3 → 192.168.206.134 TCP 68 [TCP Keep-Alive] [TCP ACKed unseen segment] 57658 → 8087 [ACK] Seq=0 Ack=2 Win=507 Len=0 TSval=3439936399 TSecr=1643669724
    6   0.152249 192.168.206.134 → 192.168.14.3 TCP 68 [TCP Previous segment not captured] 8087 → 57658 [ACK] Seq=2 Ack=1 Win=501 Len=0 TSval=1643684828 TSecr=3439936247
    7   1.024008 192.168.206.134 → 10.109.36.155 TCP 68 49568 → 27017 [ACK] Seq=1 Ack=1 Win=504 Len=0 TSval=285897994 TSecr=1655770581
    8   1.024460 10.109.36.155 → 192.168.206.134 TCP 68 [TCP ACKed unseen segment] 27017 → 49568 [ACK] Seq=1 Ack=2 Win=501 Len=0 TSval=1655785685 TSecr=285751203
    9   6.640169 192.168.206.134 → 10.109.36.155 SSL 122 Continuation Data
   10   6.640906 10.109.36.155 → 192.168.206.134 SSL 121 Continuation Data
   11   6.640936 192.168.206.134 → 10.109.36.155 TCP 68 49596 → 27017 [ACK] Seq=55 Ack=54 Win=501 Len=0 TSval=285903611 TSecr=1655791301
   12  14.686305 192.168.206.134 → 10.96.0.10   DNS 107 Standard query 0xb3ed AAAA mongodb-reservation.default.svc.cluster.local
   13  14.686380 192.168.206.134 → 10.96.0.10   DNS 107 Standard query 0xf616 A mongodb-reservation.default.svc.cluster.local
   14  14.687356   10.96.0.10 → 192.168.206.134 DNS 168 Standard query response 0xf616 A mongodb-reservation.default.svc.cluster.local A 10.109.36.155
   15  14.687415   10.96.0.10 → 192.168.206.134 DNS 200 Standard query response 0xb3ed AAAA mongodb-reservation.default.svc.cluster.local SOA ns.dns.cluster.local
   16  14.687741 192.168.206.134 → 10.96.0.10   DNS 99 Standard query 0xb40f AAAA mongodb-reservation.svc.cluster.local
   17  14.687861 192.168.206.134 → 10.109.36.155 SSL 126 Continuation Data
   18  14.688467   10.96.0.10 → 192.168.206.134 DNS 192 Standard query response 0xb40f No such name AAAA mongodb-reservation.svc.cluster.local SOA ns.dns.cluster.local
   19  14.688609 10.109.36.155 → 192.168.206.134 SSL 387 Continuation Data
   20  14.688641 192.168.206.134 → 10.109.36.155 TCP 68 49596 → 27017 [ACK] Seq=113 Ack=373 Win=501 Len=0 TSval=285911659 TSecr=1655799349
   21  14.688735 192.168.206.134 → 10.96.0.10   DNS 95 Standard query 0xa087 AAAA mongodb-reservation.cluster.local
   22  14.689482   10.96.0.10 → 192.168.206.134 DNS 188 Standard query response 0xa087 No such name AAAA mongodb-reservation.cluster.local SOA ns.dns.cluster.local
   23  14.689812 192.168.206.134 → 10.96.0.10   DNS 98 Standard query 0x6c13 AAAA mongodb-reservation.wisc.cloudlab.us
   24  14.691891   10.96.0.10 → 192.168.206.134 DNS 204 Standard query response 0x6c13 No such name AAAA mongodb-reservation.wisc.cloudlab.us SOA boss.wisc.cloudlab.us
   25  14.692245 192.168.206.134 → 10.96.0.10   DNS 81 Standard query 0xfcb0 AAAA mongodb-reservation
   26  14.694180   10.96.0.10 → 192.168.206.134 DNS 156 Standard query response 0xfcb0 No such name AAAA mongodb-reservation SOA a.root-servers.net
   27  15.104008 192.168.206.134 → 10.109.16.113 TCP 68 [TCP Dup ACK 2#1] 55466 → 11211 [ACK] Seq=1 Ack=1 Win=507 Len=0 TSval=142724722 TSecr=2614910014
   28  15.104015 192.168.206.134 → 192.168.14.3 TCP 68 [TCP Keep-Alive] 8087 → 57658 [ACK] Seq=1 Ack=1 Win=501 Len=0 TSval=1643699779 TSecr=3439936247
   29  15.104100 10.109.16.113 → 192.168.206.134 TCP 68 [TCP Dup ACK 3#1] [TCP ACKed unseen segment] 11211 → 55466 [ACK] Seq=1 Ack=2 Win=502 Len=0 TSval=2614925118 TSecr=141758131
   30  15.104351 192.168.14.3 → 192.168.206.134 TCP 68 [TCP Keep-Alive ACK] 57658 → 8087 [ACK] Seq=1 Ack=2 Win=507 Len=0 TSval=3439951351 TSecr=1643684828
   31  15.256237 192.168.14.3 → 192.168.206.134 TCP 68 [TCP Keep-Alive] 57658 → 8087 [ACK] Seq=0 Ack=2 Win=507 Len=0 TSval=3439951503 TSecr=1643684828
   32  15.256260 192.168.206.134 → 192.168.14.3 TCP 68 [TCP Keep-Alive ACK] 8087 → 57658 [ACK] Seq=2 Ack=1 Win=501 Len=0 TSval=1643699932 TSecr=3439951351
   33  16.127997 192.168.206.134 → 10.109.36.155 TCP 68 [TCP Dup ACK 7#1] 49568 → 27017 [ACK] Seq=1 Ack=1 Win=504 Len=0 TSval=285913098 TSecr=1655785685
   34  16.128452 10.109.36.155 → 192.168.206.134 TCP 68 [TCP Dup ACK 8#1] [TCP ACKed unseen segment] 27017 → 49568 [ACK] Seq=1 Ack=2 Win=501 Len=0 TSval=1655800789 TSecr=285751203
   35  21.641588 192.168.206.134 → 10.109.36.155 SSL 122 Continuation Data
   36  21.642286 10.109.36.155 → 192.168.206.134 SSL 121 Continuation Data
   37  21.642316 192.168.206.134 → 10.109.36.155 TCP 68 49596 → 27017 [ACK] Seq=167 Ack=426 Win=501 Len=0 TSval=285918613 TSecr=1655806303
   38  30.208012 192.168.206.134 → 10.109.16.113 TCP 68 [TCP Dup ACK 2#2] 55466 → 11211 [ACK] Seq=1 Ack=1 Win=507 Len=0 TSval=142739826 TSecr=2614925118
   39  30.208014 192.168.206.134 → 192.168.14.3 TCP 68 [TCP Keep-Alive] 8087 → 57658 [ACK] Seq=1 Ack=1 Win=501 Len=0 TSval=1643714883 TSecr=3439951351
   40  30.208130 10.109.16.113 → 192.168.206.134 TCP 68 [TCP Dup ACK 3#2] [TCP ACKed unseen segment] 11211 → 55466 [ACK] Seq=1 Ack=2 Win=502 Len=0 TSval=2614940222 TSecr=141758131
   41  30.208406 192.168.14.3 → 192.168.206.134 TCP 68 [TCP Keep-Alive ACK] 57658 → 8087 [ACK] Seq=1 Ack=2 Win=507 Len=0 TSval=3439966455 TSecr=1643699932
   42  30.360286 192.168.14.3 → 192.168.206.134 TCP 68 [TCP Keep-Alive] 57658 → 8087 [ACK] Seq=0 Ack=2 Win=507 Len=0 TSval=3439966607 TSecr=1643699932
   43  30.360310 192.168.206.134 → 192.168.14.3 TCP 68 [TCP Keep-Alive ACK] 8087 → 57658 [ACK] Seq=2 Ack=1 Win=501 Len=0 TSval=1643715036 TSecr=3439966455
   44  31.232012 192.168.206.134 → 10.109.36.155 TCP 68 [TCP Dup ACK 7#2] 49568 → 27017 [ACK] Seq=1 Ack=1 Win=504 Len=0 TSval=285928202 TSecr=1655800789
   45  31.232482 10.109.36.155 → 192.168.206.134 TCP 68 [TCP Dup ACK 8#2] [TCP ACKed unseen segment] 27017 → 49568 [ACK] Seq=1 Ack=2 Win=501 Len=0 TSval=1655815893 TSecr=285751203
   46  35.327965 ee:ee:ee:ee:ee:ee →              ARP 44 Who has 192.168.206.134? Tell 10.10.1.4
   47  35.328036 7e:ad:45:4d:8b:9d →              ARP 44 192.168.206.134 is at 7e:ad:45:4d:8b:9d
   48  36.642884 192.168.206.134 → 10.109.36.155 SSL 122 Continuation Data
   49  36.643613 10.109.36.155 → 192.168.206.134 SSL 121 Continuation Data
   50  36.643643 192.168.206.134 → 10.109.36.155 TCP 68 49596 → 27017 [ACK] Seq=221 Ack=479 Win=501 Len=0 TSval=285933614 TSecr=1655821304
   51  45.190501 192.168.206.134 → 10.96.0.10   DNS 107 Standard query 0xd164 AAAA mongodb-reservation.default.svc.cluster.local
   52  45.190564 192.168.206.134 → 10.96.0.10   DNS 107 Standard query 0x7513 A mongodb-reservation.default.svc.cluster.local
   53  45.191533   10.96.0.10 → 192.168.206.134 DNS 168 Standard query response 0x7513 A mongodb-reservation.default.svc.cluster.local A 10.109.36.155
   54  45.191539   10.96.0.10 → 192.168.206.134 DNS 200 Standard query response 0xd164 AAAA mongodb-reservation.default.svc.cluster.local SOA ns.dns.cluster.local
   55  45.191899 192.168.206.134 → 10.96.0.10   DNS 99 Standard query 0xda8b AAAA mongodb-reservation.svc.cluster.local
   56  45.192070 192.168.206.134 → 10.109.36.155 SSL 126 Continuation Data
   57  45.192766 10.109.36.155 → 192.168.206.134 SSL 387 Continuation Data
   58  45.192796 192.168.206.134 → 10.109.36.155 TCP 68 49596 → 27017 [ACK] Seq=279 Ack=798 Win=501 Len=0 TSval=285942163 TSecr=1655829853
   59  45.192807   10.96.0.10 → 192.168.206.134 DNS 192 Standard query response 0xda8b No such name AAAA mongodb-reservation.svc.cluster.local SOA ns.dns.cluster.local
   60  45.193141 192.168.206.134 → 10.96.0.10   DNS 95 Standard query 0xce3e AAAA mongodb-reservation.cluster.local
   61  45.193969   10.96.0.10 → 192.168.206.134 DNS 188 Standard query response 0xce3e No such name AAAA mongodb-reservation.cluster.local SOA ns.dns.cluster.local
   62  45.194306 192.168.206.134 → 10.96.0.10   DNS 98 Standard query 0xeec6 AAAA mongodb-reservation.wisc.cloudlab.us
   63  45.196296   10.96.0.10 → 192.168.206.134 DNS 204 Standard query response 0xeec6 No such name AAAA mongodb-reservation.wisc.cloudlab.us SOA boss.wisc.cloudlab.us
   64  45.196585 192.168.206.134 → 10.96.0.10   DNS 81 Standard query 0xd53d AAAA mongodb-reservation
   65  45.198519   10.96.0.10 → 192.168.206.134 DNS 156 Standard query response 0xd53d No such name AAAA mongodb-reservation SOA a.root-servers.net
   66  45.311953 192.168.206.134 → 10.109.16.113 TCP 68 [TCP Dup ACK 2#3] 55466 → 11211 [ACK] Seq=1 Ack=1 Win=507 Len=0 TSval=142754930 TSecr=2614940222
   67  45.312018 192.168.206.134 → 192.168.14.3 TCP 68 [TCP Keep-Alive] 8087 → 57658 [ACK] Seq=1 Ack=1 Win=501 Len=0 TSval=1643729987 TSecr=3439966455
   68  45.312048 10.109.16.113 → 192.168.206.134 TCP 68 [TCP Dup ACK 3#3] [TCP ACKed unseen segment] 11211 → 55466 [ACK] Seq=1 Ack=2 Win=502 Len=0 TSval=2614955326 TSecr=141758131
   69  45.312394 192.168.14.3 → 192.168.206.134 TCP 68 [TCP Keep-Alive ACK] 57658 → 8087 [ACK] Seq=1 Ack=2 Win=507 Len=0 TSval=3439981559 TSecr=1643715036
   70  45.464264 192.168.14.3 → 192.168.206.134 TCP 68 [TCP Keep-Alive] 57658 → 8087 [ACK] Seq=0 Ack=2 Win=507 Len=0 TSval=3439981711 TSecr=1643715036
   71  45.464288 192.168.206.134 → 192.168.14.3 TCP 68 [TCP Keep-Alive ACK] 8087 → 57658 [ACK] Seq=2 Ack=1 Win=501 Len=0 TSval=1643730140 TSecr=3439981559
   72  46.336002 192.168.206.134 → 10.109.36.155 TCP 68 [TCP Dup ACK 7#3] 49568 → 27017 [ACK] Seq=1 Ack=1 Win=504 Len=0 TSval=285943306 TSecr=1655815893
   73  46.336440 10.109.36.155 → 192.168.206.134 TCP 68 [TCP Dup ACK 8#3] [TCP ACKed unseen segment] 27017 → 49568 [ACK] Seq=1 Ack=2 Win=501 Len=0 TSval=1655830997 TSecr=285751203
