    1   0.000000 192.168.163.24 → 192.168.206.154 TCP 66 8500 → 47646 [ACK] Seq=1 Ack=1 Win=501 Len=0 TSval=3621369319 TSecr=3188544212
    2   0.000002 192.168.163.24 → 192.168.14.13 TCP 66 8500 → 36482 [ACK] Seq=1 Ack=1 Win=501 Len=0 TSval=1435537041 TSecr=672747246
    3   0.000475 192.168.206.154 → 192.168.163.24 TCP 66 [TCP ACKed unseen segment] 47646 → 8500 [ACK] Seq=1 Ack=2 Win=501 Len=0 TSval=3188574932 TSecr=3621339067
    4   0.000476 192.168.14.13 → 192.168.163.24 TCP 66 [TCP ACKed unseen segment] 36482 → 8500 [ACK] Seq=1 Ack=2 Win=750 Len=0 TSval=672777966 TSecr=1435506427
    5   0.106219 192.168.14.13 → 192.168.163.24 TCP 66 [TCP Keep-Alive] [TCP ACKed unseen segment] 36482 → 8500 [ACK] Seq=0 Ack=2 Win=750 Len=0 TSval=672778072 TSecr=1435506427
    6   0.106238 192.168.163.24 → 192.168.14.13 TCP 66 [TCP Previous segment not captured] 8500 → 36482 [ACK] Seq=2 Ack=1 Win=501 Len=0 TSval=1435537147 TSecr=672777966
    7   0.468056 192.168.206.154 → 192.168.163.24 TCP 66 [TCP Keep-Alive] [TCP ACKed unseen segment] 47646 → 8500 [ACK] Seq=0 Ack=2 Win=501 Len=0 TSval=3188575399 TSecr=3621339067
    8   0.468074 192.168.163.24 → 192.168.206.154 TCP 66 [TCP Previous segment not captured] 8500 → 47646 [ACK] Seq=2 Ack=1 Win=501 Len=0 TSval=3621369787 TSecr=3188574932
    9   4.095998 192.168.163.24 → 192.168.14.13 TCP 66 8500 → 36438 [ACK] Seq=1 Ack=1 Win=501 Len=0 TSval=1435541137 TSecr=672751342
   10   4.096452 192.168.14.13 → 192.168.163.24 TCP 66 [TCP ACKed unseen segment] 36438 → 8500 [ACK] Seq=1 Ack=2 Win=501 Len=0 TSval=672782062 TSecr=1435510523
   11   4.202213 192.168.14.13 → 192.168.163.24 TCP 66 [TCP Keep-Alive] [TCP ACKed unseen segment] 36438 → 8500 [ACK] Seq=0 Ack=2 Win=501 Len=0 TSval=672782168 TSecr=1435510523
   12   4.202232 192.168.163.24 → 192.168.14.13 TCP 66 [TCP Previous segment not captured] 8500 → 36438 [ACK] Seq=2 Ack=1 Win=501 Len=0 TSval=1435541243 TSecr=672782062
   13  14.335958 192.168.163.24 → 192.168.14.13 TCP 66 8500 → 36484 [ACK] Seq=1 Ack=1 Win=501 Len=0 TSval=1435551376 TSecr=672761582
   14  14.336370 192.168.14.13 → 192.168.163.24 TCP 66 [TCP ACKed unseen segment] 36484 → 8500 [ACK] Seq=1 Ack=2 Win=698 Len=0 TSval=672792302 TSecr=1435520763
   15  14.442223 192.168.14.13 → 192.168.163.24 TCP 66 [TCP Keep-Alive] [TCP ACKed unseen segment] 36484 → 8500 [ACK] Seq=0 Ack=2 Win=698 Len=0 TSval=672792408 TSecr=1435520763
   16  14.442241 192.168.163.24 → 192.168.14.13 TCP 66 [TCP Previous segment not captured] 8500 → 36484 [ACK] Seq=2 Ack=1 Win=501 Len=0 TSval=1435551483 TSecr=672792302
   17  14.804069 192.168.206.154 → 192.168.163.24 TCP 66 47644 → 8500 [ACK] Seq=1 Ack=1 Win=501 Len=0 TSval=3188589735 TSecr=3621353403
   18  14.804087 192.168.163.24 → 192.168.206.154 TCP 66 [TCP ACKed unseen segment] 8500 → 47644 [ACK] Seq=1 Ack=2 Win=501 Len=0 TSval=3621384123 TSecr=3188560596
   19  16.384003 192.168.163.24 → 192.168.14.13 TCP 66 8500 → 36480 [ACK] Seq=1 Ack=1 Win=501 Len=0 TSval=1435553425 TSecr=672763630
   20  16.384008 192.168.163.24 → 192.168.14.13 TCP 66 8500 → 36440 [ACK] Seq=1 Ack=1 Win=501 Len=0 TSval=1435553425 TSecr=672763630
   21  16.384010 192.168.163.24 → 192.168.206.154 TCP 66 [TCP Keep-Alive] [TCP ACKed unseen segment] 8500 → 47644 [ACK] Seq=0 Ack=2 Win=501 Len=0 TSval=3621385703 TSecr=3188560596
   22  16.384473 192.168.206.154 → 192.168.163.24 TCP 66 [TCP Previous segment not captured] 47644 → 8500 [ACK] Seq=2 Ack=1 Win=501 Len=0 TSval=3188591316 TSecr=3621384123
   23  16.384501 192.168.14.13 → 192.168.163.24 TCP 66 [TCP ACKed unseen segment] 36440 → 8500 [ACK] Seq=1 Ack=2 Win=604 Len=0 TSval=672794350 TSecr=1435522811
   24  16.384507 192.168.14.13 → 192.168.163.24 TCP 66 [TCP ACKed unseen segment] 36480 → 8500 [ACK] Seq=1 Ack=2 Win=501 Len=0 TSval=672794350 TSecr=1435522811
   25  16.490222 192.168.14.13 → 192.168.163.24 TCP 66 [TCP Keep-Alive] [TCP ACKed unseen segment] 36480 → 8500 [ACK] Seq=0 Ack=2 Win=501 Len=0 TSval=672794456 TSecr=1435522811
   26  16.490245 192.168.163.24 → 192.168.14.13 TCP 66 [TCP Previous segment not captured] 8500 → 36480 [ACK] Seq=2 Ack=1 Win=501 Len=0 TSval=1435553531 TSecr=672794350
   27  16.490227 192.168.14.13 → 192.168.163.24 TCP 66 [TCP Keep-Alive] [TCP ACKed unseen segment] 36440 → 8500 [ACK] Seq=0 Ack=2 Win=604 Len=0 TSval=672794456 TSecr=1435522811
   28  16.490256 192.168.163.24 → 192.168.14.13 TCP 66 [TCP Previous segment not captured] 8500 → 36440 [ACK] Seq=2 Ack=1 Win=501 Len=0 TSval=1435553531 TSecr=672794350
   29  30.720004 192.168.163.24 → 192.168.14.13 TCP 66 [TCP Keep-Alive] 8500 → 36482 [ACK] Seq=1 Ack=1 Win=501 Len=0 TSval=1435567761 TSecr=672777966
   30  30.720006 192.168.163.24 → 192.168.206.154 TCP 66 [TCP Keep-Alive] 8500 → 47646 [ACK] Seq=1 Ack=1 Win=501 Len=0 TSval=3621400039 TSecr=3188574932
   31  30.720332 192.168.206.154 → 192.168.163.24 TCP 66 [TCP Keep-Alive ACK] 47646 → 8500 [ACK] Seq=1 Ack=2 Win=501 Len=0 TSval=3188605652 TSecr=3621369787
   32  30.720390 192.168.14.13 → 192.168.163.24 TCP 66 [TCP Keep-Alive ACK] 36482 → 8500 [ACK] Seq=1 Ack=2 Win=750 Len=0 TSval=672808686 TSecr=1435537147
   33  30.826161 192.168.14.13 → 192.168.163.24 TCP 66 [TCP Keep-Alive] 36482 → 8500 [ACK] Seq=0 Ack=2 Win=750 Len=0 TSval=672808792 TSecr=1435537147
   34  30.826179 192.168.163.24 → 192.168.14.13 TCP 66 [TCP Keep-Alive ACK] 8500 → 36482 [ACK] Seq=2 Ack=1 Win=501 Len=0 TSval=1435567867 TSecr=672808686
   35  31.187897 192.168.206.154 → 192.168.163.24 TCP 66 [TCP Keep-Alive] 47646 → 8500 [ACK] Seq=0 Ack=2 Win=501 Len=0 TSval=3188606119 TSecr=3621369787
   36  31.187909 192.168.163.24 → 192.168.206.154 TCP 66 [TCP Keep-Alive ACK] 8500 → 47646 [ACK] Seq=2 Ack=1 Win=501 Len=0 TSval=3621400506 TSecr=3188605652
   37  34.815993 192.168.163.24 → 192.168.14.13 TCP 66 [TCP Keep-Alive] 8500 → 36438 [ACK] Seq=1 Ack=1 Win=501 Len=0 TSval=1435571857 TSecr=672782062
   38  34.816408 192.168.14.13 → 192.168.163.24 TCP 66 [TCP Keep-Alive ACK] 36438 → 8500 [ACK] Seq=1 Ack=2 Win=501 Len=0 TSval=672812782 TSecr=1435541243
   39  34.922198 192.168.14.13 → 192.168.163.24 TCP 66 [TCP Keep-Alive] 36438 → 8500 [ACK] Seq=0 Ack=2 Win=501 Len=0 TSval=672812888 TSecr=1435541243
   40  34.922216 192.168.163.24 → 192.168.14.13 TCP 66 [TCP Keep-Alive ACK] 8500 → 36438 [ACK] Seq=2 Ack=1 Win=501 Len=0 TSval=1435571963 TSecr=672812782
   41  45.056012 192.168.163.24 → 192.168.14.13 TCP 66 [TCP Keep-Alive] 8500 → 36484 [ACK] Seq=1 Ack=1 Win=501 Len=0 TSval=1435582097 TSecr=672792302
   42  45.056331 192.168.14.13 → 192.168.163.24 TCP 66 [TCP Keep-Alive ACK] 36484 → 8500 [ACK] Seq=1 Ack=2 Win=698 Len=0 TSval=672823022 TSecr=1435551483
   43  45.162158 192.168.14.13 → 192.168.163.24 TCP 66 [TCP Keep-Alive] 36484 → 8500 [ACK] Seq=0 Ack=2 Win=698 Len=0 TSval=672823128 TSecr=1435551483
   44  45.162175 192.168.163.24 → 192.168.14.13 TCP 66 [TCP Keep-Alive ACK] 8500 → 36484 [ACK] Seq=2 Ack=1 Win=501 Len=0 TSval=1435582203 TSecr=672823022
   45  45.523992 192.168.206.154 → 192.168.163.24 TCP 66 [TCP Keep-Alive] 47644 → 8500 [ACK] Seq=1 Ack=1 Win=501 Len=0 TSval=3188620455 TSecr=3621384123
   46  45.524017 192.168.163.24 → 192.168.206.154 TCP 66 [TCP Keep-Alive ACK] 8500 → 47644 [ACK] Seq=1 Ack=2 Win=501 Len=0 TSval=3621414843 TSecr=3188591316
   47  47.103993 192.168.163.24 → 192.168.14.13 TCP 66 [TCP Keep-Alive] 8500 → 36480 [ACK] Seq=1 Ack=1 Win=501 Len=0 TSval=1435584145 TSecr=672794350
   48  47.104002 192.168.163.24 → 192.168.206.154 TCP 66 [TCP Keep-Alive] 8500 → 47644 [ACK] Seq=0 Ack=2 Win=501 Len=0 TSval=3621416423 TSecr=3188591316
   49  47.104002 192.168.163.24 → 192.168.14.13 TCP 66 [TCP Keep-Alive] 8500 → 36440 [ACK] Seq=1 Ack=1 Win=501 Len=0 TSval=1435584145 TSecr=672794350
   50  47.104327 192.168.206.154 → 192.168.163.24 TCP 66 [TCP Keep-Alive ACK] 47644 → 8500 [ACK] Seq=2 Ack=1 Win=501 Len=0 TSval=3188622036 TSecr=3621414843
   51  47.104399 192.168.14.13 → 192.168.163.24 TCP 66 [TCP Keep-Alive ACK] 36480 → 8500 [ACK] Seq=1 Ack=2 Win=501 Len=0 TSval=672825070 TSecr=1435553531
   52  47.104405 192.168.14.13 → 192.168.163.24 TCP 66 [TCP Keep-Alive ACK] 36440 → 8500 [ACK] Seq=1 Ack=2 Win=604 Len=0 TSval=672825070 TSecr=1435553531
   53  47.210169 192.168.14.13 → 192.168.163.24 TCP 66 [TCP Keep-Alive] 36440 → 8500 [ACK] Seq=0 Ack=2 Win=604 Len=0 TSval=672825176 TSecr=1435553531
   54  47.210193 192.168.163.24 → 192.168.14.13 TCP 66 [TCP Keep-Alive ACK] 8500 → 36440 [ACK] Seq=2 Ack=1 Win=501 Len=0 TSval=1435584251 TSecr=672825070
   55  47.210175 192.168.14.13 → 192.168.163.24 TCP 66 [TCP Keep-Alive] 36480 → 8500 [ACK] Seq=0 Ack=2 Win=501 Len=0 TSval=672825176 TSecr=1435553531
   56  47.210203 192.168.163.24 → 192.168.14.13 TCP 66 [TCP Keep-Alive ACK] 8500 → 36480 [ACK] Seq=2 Ack=1 Win=501 Len=0 TSval=1435584251 TSecr=672825070
   57  61.439962 192.168.163.24 → 192.168.14.13 TCP 66 [TCP Keep-Alive] 8500 → 36482 [ACK] Seq=1 Ack=1 Win=501 Len=0 TSval=1435598480 TSecr=672808686
   58  61.439999 192.168.163.24 → 192.168.206.154 TCP 66 [TCP Keep-Alive] 8500 → 47646 [ACK] Seq=1 Ack=1 Win=501 Len=0 TSval=3621430759 TSecr=3188605652
   59  61.440269 192.168.206.154 → 192.168.163.24 TCP 66 [TCP Keep-Alive ACK] 47646 → 8500 [ACK] Seq=1 Ack=2 Win=501 Len=0 TSval=3188636372 TSecr=3621400506
   60  61.440294 192.168.14.13 → 192.168.163.24 TCP 66 [TCP Keep-Alive ACK] 36482 → 8500 [ACK] Seq=1 Ack=2 Win=750 Len=0 TSval=672839406 TSecr=1435567867
   61  61.546199 192.168.14.13 → 192.168.163.24 TCP 66 [TCP Keep-Alive] 36482 → 8500 [ACK] Seq=0 Ack=2 Win=750 Len=0 TSval=672839512 TSecr=1435567867
   62  61.546217 192.168.163.24 → 192.168.14.13 TCP 66 [TCP Keep-Alive ACK] 8500 → 36482 [ACK] Seq=2 Ack=1 Win=501 Len=0 TSval=1435598587 TSecr=672839406
   63  61.907898 192.168.206.154 → 192.168.163.24 TCP 66 [TCP Keep-Alive] 47646 → 8500 [ACK] Seq=0 Ack=2 Win=501 Len=0 TSval=3188636839 TSecr=3621400506
   64  61.907912 192.168.163.24 → 192.168.206.154 TCP 66 [TCP Keep-Alive ACK] 8500 → 47646 [ACK] Seq=2 Ack=1 Win=501 Len=0 TSval=3621431226 TSecr=3188636372
   65  65.539993 192.168.163.24 → 192.168.14.13 TCP 66 [TCP Keep-Alive] 8500 → 36438 [ACK] Seq=1 Ack=1 Win=501 Len=0 TSval=1435602581 TSecr=672812782
   66  65.540363 192.168.14.13 → 192.168.163.24 TCP 66 [TCP Keep-Alive ACK] 36438 → 8500 [ACK] Seq=1 Ack=2 Win=501 Len=0 TSval=672843506 TSecr=1435571963
   67  65.642127 192.168.14.13 → 192.168.163.24 TCP 66 [TCP Keep-Alive] 36438 → 8500 [ACK] Seq=0 Ack=2 Win=501 Len=0 TSval=672843608 TSecr=1435571963
   68  65.642149 192.168.163.24 → 192.168.14.13 TCP 66 [TCP Keep-Alive ACK] 8500 → 36438 [ACK] Seq=2 Ack=1 Win=501 Len=0 TSval=1435602683 TSecr=672843506
   69  68.822963 192.168.163.24 → 192.168.14.13 HTTP 1003 HTTP/1.1 200 OK  (application/json)
   70  68.824110 192.168.14.13 → 192.168.163.24 HTTP 205 GET /v1/health/service/srv-search?index=16&passing=1 HTTP/1.1 
   71  68.824149 192.168.163.24 → 192.168.14.13 TCP 66 8500 → 36484 [ACK] Seq=939 Ack=140 Win=501 Len=0 TSval=1435605865 TSecr=672846790
   72  69.568301 192.168.163.24 → 192.168.206.154 HTTP 1000 HTTP/1.1 200 OK  (application/json)
   73  69.569379 192.168.206.154 → 192.168.163.24 HTTP 202 GET /v1/health/service/srv-geo?index=19&passing=1 HTTP/1.1 
   74  69.569418 192.168.163.24 → 192.168.206.154 TCP 66 8500 → 47644 [ACK] Seq=935 Ack=138 Win=501 Len=0 TSval=3621438888 TSecr=3188644501
   75  70.445782 192.168.163.24 → 192.168.14.13 HTTP 1007 HTTP/1.1 200 OK  (application/json)
   76  70.446857 192.168.14.13 → 192.168.163.24 HTTP 213 GET /v1/health/service/srv-recommendation?index=20&passing=1 HTTP/1.1 
   77  70.446898 192.168.163.24 → 192.168.14.13 TCP 66 8500 → 36480 [ACK] Seq=943 Ack=148 Win=501 Len=0 TSval=1435607487 TSecr=672848412
   78  71.171642 192.168.163.24 → 192.168.14.13 HTTP 1004 HTTP/1.1 200 OK  (application/json)
   79  71.172609 192.168.14.13 → 192.168.163.24 HTTP 203 GET /v1/health/service/srv-user?index=22&passing=1 HTTP/1.1 
   80  71.172647 192.168.163.24 → 192.168.14.13 TCP 66 8500 → 36440 [ACK] Seq=940 Ack=138 Win=501 Len=0 TSval=1435608213 TSecr=672849138
   81  92.159998 192.168.163.24 → 192.168.206.154 TCP 66 [TCP Keep-Alive] 8500 → 47646 [ACK] Seq=1 Ack=1 Win=501 Len=0 TSval=3621461479 TSecr=3188636372
   82  92.160003 192.168.163.24 → 192.168.14.13 TCP 66 [TCP Keep-Alive] 8500 → 36482 [ACK] Seq=1 Ack=1 Win=501 Len=0 TSval=1435629201 TSecr=672839406
   83  92.160350 192.168.206.154 → 192.168.163.24 TCP 66 [TCP Keep-Alive ACK] 47646 → 8500 [ACK] Seq=1 Ack=2 Win=501 Len=0 TSval=3188667092 TSecr=3621431226
   84  92.160387 192.168.14.13 → 192.168.163.24 TCP 66 [TCP Keep-Alive ACK] 36482 → 8500 [ACK] Seq=1 Ack=2 Win=750 Len=0 TSval=672870126 TSecr=1435598587
   85  92.270163 192.168.14.13 → 192.168.163.24 TCP 66 [TCP Keep-Alive] 36482 → 8500 [ACK] Seq=0 Ack=2 Win=750 Len=0 TSval=672870236 TSecr=1435598587
   86  92.270181 192.168.163.24 → 192.168.14.13 TCP 66 [TCP Keep-Alive ACK] 8500 → 36482 [ACK] Seq=2 Ack=1 Win=501 Len=0 TSval=1435629311 TSecr=672870126
   87  92.627978 192.168.206.154 → 192.168.163.24 TCP 66 [TCP Keep-Alive] 47646 → 8500 [ACK] Seq=0 Ack=2 Win=501 Len=0 TSval=3188667559 TSecr=3621431226
   88  92.627997 192.168.163.24 → 192.168.206.154 TCP 66 [TCP Keep-Alive ACK] 8500 → 47646 [ACK] Seq=2 Ack=1 Win=501 Len=0 TSval=3621461947 TSecr=3188667092
   89  96.256008 192.168.163.24 → 192.168.14.13 TCP 66 [TCP Keep-Alive] 8500 → 36438 [ACK] Seq=1 Ack=1 Win=501 Len=0 TSval=1435633297 TSecr=672843506
   90  96.256327 192.168.14.13 → 192.168.163.24 TCP 66 [TCP Keep-Alive ACK] 36438 → 8500 [ACK] Seq=1 Ack=2 Win=501 Len=0 TSval=672874222 TSecr=1435602683
   91  96.362391 192.168.14.13 → 192.168.163.24 TCP 66 [TCP Keep-Alive] 36438 → 8500 [ACK] Seq=0 Ack=2 Win=501 Len=0 TSval=672874328 TSecr=1435602683
   92  96.362410 192.168.163.24 → 192.168.14.13 TCP 66 [TCP Keep-Alive ACK] 8500 → 36438 [ACK] Seq=2 Ack=1 Win=501 Len=0 TSval=1435633403 TSecr=672874222
   93 100.351948 192.168.163.24 → 192.168.14.13 TCP 66 [TCP Keep-Alive] 8500 → 36484 [ACK] Seq=938 Ack=140 Win=501 Len=0 TSval=1435637392 TSecr=672846790
   94 100.351995 192.168.163.24 → 192.168.206.154 TCP 66 [TCP Keep-Alive] 8500 → 47644 [ACK] Seq=934 Ack=138 Win=501 Len=0 TSval=3621469671 TSecr=3188644501
   95 100.352324 192.168.14.13 → 192.168.163.24 TCP 66 [TCP Keep-Alive ACK] 36484 → 8500 [ACK] Seq=140 Ack=939 Win=698 Len=0 TSval=672878318 TSecr=1435605865
   96 100.352344 192.168.206.154 → 192.168.163.24 TCP 66 [TCP Keep-Alive ACK] 47644 → 8500 [ACK] Seq=138 Ack=935 Win=501 Len=0 TSval=3188675284 TSecr=3621438888
   97 100.458178 192.168.14.13 → 192.168.163.24 TCP 66 [TCP Keep-Alive] 36480 → 8500 [ACK] Seq=147 Ack=943 Win=501 Len=0 TSval=672878424 TSecr=1435607487
   98 100.458203 192.168.163.24 → 192.168.14.13 TCP 66 [TCP Keep-Alive ACK] 8500 → 36480 [ACK] Seq=943 Ack=148 Win=501 Len=0 TSval=1435637499 TSecr=672848412
   99 100.458185 192.168.14.13 → 192.168.163.24 TCP 66 [TCP Keep-Alive] 36484 → 8500 [ACK] Seq=139 Ack=939 Win=698 Len=0 TSval=672878424 TSecr=1435605865
  100 100.458212 192.168.163.24 → 192.168.14.13 TCP 66 [TCP Keep-Alive ACK] 8500 → 36484 [ACK] Seq=939 Ack=140 Win=501 Len=0 TSval=1435637499 TSecr=672878318
  101 100.820051 192.168.206.154 → 192.168.163.24 TCP 66 [TCP Keep-Alive] 47644 → 8500 [ACK] Seq=137 Ack=935 Win=501 Len=0 TSval=3188675751 TSecr=3621438888
  102 100.820069 192.168.163.24 → 192.168.206.154 TCP 66 [TCP Keep-Alive ACK] 8500 → 47644 [ACK] Seq=935 Ack=138 Win=501 Len=0 TSval=3621470139 TSecr=3188675284
  103 102.399952 192.168.163.24 → 192.168.14.13 TCP 66 [TCP Keep-Alive] 8500 → 36440 [ACK] Seq=939 Ack=138 Win=501 Len=0 TSval=1435639440 TSecr=672849138
  104 102.399993 192.168.163.24 → 192.168.14.13 TCP 66 [TCP Keep-Alive] 8500 → 36480 [ACK] Seq=942 Ack=148 Win=501 Len=0 TSval=1435639441 TSecr=672848412
  105 102.400397 192.168.14.13 → 192.168.163.24 TCP 66 [TCP Keep-Alive ACK] 36440 → 8500 [ACK] Seq=138 Ack=940 Win=619 Len=0 TSval=672880366 TSecr=1435608213
  106 102.400403 192.168.14.13 → 192.168.163.24 TCP 66 [TCP Keep-Alive ACK] 36480 → 8500 [ACK] Seq=148 Ack=943 Win=501 Len=0 TSval=672880366 TSecr=1435637499
  107 102.506116 192.168.14.13 → 192.168.163.24 TCP 66 [TCP Keep-Alive] 36440 → 8500 [ACK] Seq=137 Ack=940 Win=619 Len=0 TSval=672880472 TSecr=1435608213
  108 102.506133 192.168.163.24 → 192.168.14.13 TCP 66 [TCP Keep-Alive ACK] 8500 → 36440 [ACK] Seq=940 Ack=138 Win=501 Len=0 TSval=1435639547 TSecr=672880366
  109 122.879949 192.168.163.24 → 192.168.206.154 TCP 66 [TCP Keep-Alive] 8500 → 47646 [ACK] Seq=1 Ack=1 Win=501 Len=0 TSval=3621492198 TSecr=3188667092
  110 122.879953 192.168.163.24 → 192.168.14.13 TCP 66 [TCP Keep-Alive] 8500 → 36482 [ACK] Seq=1 Ack=1 Win=501 Len=0 TSval=1435659920 TSecr=672870126
  111 122.880412 192.168.206.154 → 192.168.163.24 TCP 66 [TCP Keep-Alive ACK] 47646 → 8500 [ACK] Seq=1 Ack=2 Win=501 Len=0 TSval=3188697812 TSecr=3621461947
  112 122.880423 192.168.14.13 → 192.168.163.24 TCP 66 [TCP Keep-Alive ACK] 36482 → 8500 [ACK] Seq=1 Ack=2 Win=750 Len=0 TSval=672900846 TSecr=1435629311
  113 122.986205 192.168.14.13 → 192.168.163.24 TCP 66 [TCP Keep-Alive] 36482 → 8500 [ACK] Seq=0 Ack=2 Win=750 Len=0 TSval=672900952 TSecr=1435629311
  114 122.986224 192.168.163.24 → 192.168.14.13 TCP 66 [TCP Keep-Alive ACK] 8500 → 36482 [ACK] Seq=2 Ack=1 Win=501 Len=0 TSval=1435660027 TSecr=672900846
  115 123.348059 192.168.206.154 → 192.168.163.24 TCP 66 [TCP Keep-Alive] 47646 → 8500 [ACK] Seq=0 Ack=2 Win=501 Len=0 TSval=3188698279 TSecr=3621461947
  116 123.348077 192.168.163.24 → 192.168.206.154 TCP 66 [TCP Keep-Alive ACK] 8500 → 47646 [ACK] Seq=2 Ack=1 Win=501 Len=0 TSval=3621492667 TSecr=3188697812
  117 126.976011 192.168.163.24 → 192.168.14.13 TCP 66 [TCP Keep-Alive] 8500 → 36438 [ACK] Seq=1 Ack=1 Win=501 Len=0 TSval=1435664017 TSecr=672874222
  118 126.976463 192.168.14.13 → 192.168.163.24 TCP 66 [TCP Keep-Alive ACK] 36438 → 8500 [ACK] Seq=1 Ack=2 Win=501 Len=0 TSval=672904942 TSecr=1435633403
  119 127.082229 192.168.14.13 → 192.168.163.24 TCP 66 [TCP Keep-Alive] 36438 → 8500 [ACK] Seq=0 Ack=2 Win=501 Len=0 TSval=672905048 TSecr=1435633403
  120 127.082248 192.168.163.24 → 192.168.14.13 TCP 66 [TCP Keep-Alive ACK] 8500 → 36438 [ACK] Seq=2 Ack=1 Win=501 Len=0 TSval=1435664123 TSecr=672904942
