    1   0.000000 192.168.206.155 → 192.168.14.18 TCP 66 38218 → 27017 [ACK] Seq=1 Ack=1 Win=504 Len=0 TSval=973397384 TSecr=3226802670
    2   0.000022 192.168.14.18 → 192.168.206.155 TCP 66 [TCP ACKed unseen segment] 27017 → 38218 [ACK] Seq=1 Ack=2 Win=501 Len=0 TSval=3226817774 TSecr=973277727
    3   7.855630 192.168.206.155 → 192.168.14.18 SSL 120 Continuation Data
    4   7.855903 192.168.14.18 → 192.168.206.155 SSL 119 Continuation Data
    5   7.856239 192.168.206.155 → 192.168.14.18 TCP 66 38220 → 27017 [ACK] Seq=55 Ack=54 Win=6146 Len=0 TSval=973405241 TSecr=3226825630
    6  15.104040 192.168.206.155 → 192.168.14.18 TCP 66 [TCP Dup ACK 1#1] 38218 → 27017 [ACK] Seq=1 Ack=1 Win=504 Len=0 TSval=973412488 TSecr=3226817774
    7  15.104061 192.168.14.18 → 192.168.206.155 TCP 66 [TCP Dup ACK 2#1] [TCP ACKed unseen segment] 27017 → 38218 [ACK] Seq=1 Ack=2 Win=501 Len=0 TSval=3226832878 TSecr=973277727
    8  22.251265 192.168.206.155 → 192.168.14.18 SSL 124 Continuation Data
    9  22.251617 192.168.14.18 → 192.168.206.155 SSL 385 Continuation Data
   10  22.251994 192.168.206.155 → 192.168.14.18 TCP 66 38220 → 27017 [ACK] Seq=113 Ack=373 Win=6146 Len=0 TSval=973419636 TSecr=3226840025
   11  22.856792 192.168.206.155 → 192.168.14.18 SSL 120 Continuation Data
   12  22.857053 192.168.14.18 → 192.168.206.155 SSL 119 Continuation Data
   13  22.857338 192.168.206.155 → 192.168.14.18 TCP 66 38220 → 27017 [ACK] Seq=167 Ack=426 Win=6146 Len=0 TSval=973420242 TSecr=3226840631
   14  30.207954 192.168.206.155 → 192.168.14.18 TCP 66 [TCP Dup ACK 1#2] 38218 → 27017 [ACK] Seq=1 Ack=1 Win=504 Len=0 TSval=973427592 TSecr=3226832878
   15  30.207967 192.168.14.18 → 192.168.206.155 TCP 66 [TCP Dup ACK 2#2] [TCP ACKed unseen segment] 27017 → 38218 [ACK] Seq=1 Ack=2 Win=501 Len=0 TSval=3226847982 TSecr=973277727
   16  37.857714 192.168.206.155 → 192.168.14.18 SSL 120 Continuation Data
   17  37.858038 192.168.14.18 → 192.168.206.155 SSL 119 Continuation Data
   18  37.858310 192.168.206.155 → 192.168.14.18 TCP 66 38220 → 27017 [ACK] Seq=221 Ack=479 Win=6146 Len=0 TSval=973435243 TSecr=3226855632
   19  45.311903 192.168.206.155 → 192.168.14.18 TCP 66 [TCP Dup ACK 1#3] 38218 → 27017 [ACK] Seq=1 Ack=1 Win=504 Len=0 TSval=973442696 TSecr=3226847982
   20  45.311917 192.168.14.18 → 192.168.206.155 TCP 66 [TCP Dup ACK 2#3] [TCP ACKed unseen segment] 27017 → 38218 [ACK] Seq=1 Ack=2 Win=501 Len=0 TSval=3226863086 TSecr=973277727
   21  52.754415 192.168.206.155 → 192.168.14.18 SSL 124 Continuation Data
   22  52.754728 192.168.14.18 → 192.168.206.155 SSL 385 Continuation Data
   23  52.754936 192.168.206.155 → 192.168.14.18 TCP 66 38220 → 27017 [ACK] Seq=279 Ack=798 Win=6146 Len=0 TSval=973450139 TSecr=3226870528
   24  52.859036 192.168.206.155 → 192.168.14.18 SSL 120 Continuation Data
   25  52.859289 192.168.14.18 → 192.168.206.155 SSL 119 Continuation Data
   26  52.859526 192.168.206.155 → 192.168.14.18 TCP 66 38220 → 27017 [ACK] Seq=333 Ack=851 Win=6146 Len=0 TSval=973450244 TSecr=3226870633
   27  60.415882 192.168.206.155 → 192.168.14.18 TCP 66 [TCP Dup ACK 1#4] 38218 → 27017 [ACK] Seq=1 Ack=1 Win=504 Len=0 TSval=973457800 TSecr=3226863086
   28  60.415898 192.168.14.18 → 192.168.206.155 TCP 66 [TCP Dup ACK 2#4] [TCP ACKed unseen segment] 27017 → 38218 [ACK] Seq=1 Ack=2 Win=501 Len=0 TSval=3226878190 TSecr=973277727
   29  67.860738 192.168.206.155 → 192.168.14.18 SSL 120 Continuation Data
   30  67.861083 192.168.14.18 → 192.168.206.155 SSL 119 Continuation Data
   31  67.861320 192.168.206.155 → 192.168.14.18 TCP 66 38220 → 27017 [ACK] Seq=387 Ack=904 Win=6146 Len=0 TSval=973465246 TSecr=3226885635
   32  75.519951 192.168.206.155 → 192.168.14.18 TCP 66 [TCP Dup ACK 1#5] 38218 → 27017 [ACK] Seq=1 Ack=1 Win=504 Len=0 TSval=973472904 TSecr=3226878190
   33  75.519970 192.168.14.18 → 192.168.206.155 TCP 66 [TCP Dup ACK 2#5] [TCP ACKed unseen segment] 27017 → 38218 [ACK] Seq=1 Ack=2 Win=501 Len=0 TSval=3226893294 TSecr=973277727
   34  82.862096 192.168.206.155 → 192.168.14.18 SSL 120 Continuation Data
   35  82.862368 192.168.14.18 → 192.168.206.155 SSL 119 Continuation Data
   36  82.862597 192.168.206.155 → 192.168.14.18 TCP 66 38220 → 27017 [ACK] Seq=441 Ack=957 Win=6146 Len=0 TSval=973480247 TSecr=3226900636
   37  83.258552 192.168.206.155 → 192.168.14.18 SSL 124 Continuation Data
   38  83.258824 192.168.14.18 → 192.168.206.155 SSL 385 Continuation Data
   39  83.259061 192.168.206.155 → 192.168.14.18 TCP 66 38220 → 27017 [ACK] Seq=499 Ack=1276 Win=6146 Len=0 TSval=973480644 TSecr=3226901032
   40  90.623895 192.168.206.155 → 192.168.14.18 TCP 66 [TCP Dup ACK 1#6] 38218 → 27017 [ACK] Seq=1 Ack=1 Win=504 Len=0 TSval=973488008 TSecr=3226893294
   41  90.623916 192.168.14.18 → 192.168.206.155 TCP 66 [TCP Dup ACK 2#6] [TCP ACKed unseen segment] 27017 → 38218 [ACK] Seq=1 Ack=2 Win=501 Len=0 TSval=3226908398 TSecr=973277727
   42  97.863419 192.168.206.155 → 192.168.14.18 SSL 120 Continuation Data
   43  97.863684 192.168.14.18 → 192.168.206.155 SSL 119 Continuation Data
   44  97.863923 192.168.206.155 → 192.168.14.18 TCP 66 38220 → 27017 [ACK] Seq=553 Ack=1329 Win=6146 Len=0 TSval=973495248 TSecr=3226915637
   45 105.728011 192.168.206.155 → 192.168.14.18 TCP 66 [TCP Dup ACK 1#7] 38218 → 27017 [ACK] Seq=1 Ack=1 Win=504 Len=0 TSval=973503112 TSecr=3226908398
   46 105.728032 192.168.14.18 → 192.168.206.155 TCP 66 [TCP Dup ACK 2#7] [TCP ACKed unseen segment] 27017 → 38218 [ACK] Seq=1 Ack=2 Win=501 Len=0 TSval=3226923502 TSecr=973277727
   47 112.864835 192.168.206.155 → 192.168.14.18 SSL 120 Continuation Data
   48 112.865138 192.168.14.18 → 192.168.206.155 SSL 119 Continuation Data
   49 112.865430 192.168.206.155 → 192.168.14.18 TCP 66 38220 → 27017 [ACK] Seq=607 Ack=1382 Win=6146 Len=0 TSval=973510250 TSecr=3226930639
   50 113.763056 192.168.206.155 → 192.168.14.18 SSL 124 Continuation Data
   51 113.763354 192.168.14.18 → 192.168.206.155 SSL 385 Continuation Data
   52 113.763593 192.168.206.155 → 192.168.14.18 TCP 66 38220 → 27017 [ACK] Seq=665 Ack=1701 Win=6146 Len=0 TSval=973511148 TSecr=3226931537
   53 120.831985 192.168.206.155 → 192.168.14.18 TCP 66 [TCP Dup ACK 1#8] 38218 → 27017 [ACK] Seq=1 Ack=1 Win=504 Len=0 TSval=973518216 TSecr=3226923502
   54 120.832007 192.168.14.18 → 192.168.206.155 TCP 66 [TCP Dup ACK 2#8] [TCP ACKed unseen segment] 27017 → 38218 [ACK] Seq=1 Ack=2 Win=501 Len=0 TSval=3226938606 TSecr=973277727
   55 127.866177 192.168.206.155 → 192.168.14.18 SSL 120 Continuation Data
   56 127.866484 192.168.14.18 → 192.168.206.155 SSL 119 Continuation Data
   57 127.866855 192.168.206.155 → 192.168.14.18 TCP 66 38220 → 27017 [ACK] Seq=719 Ack=1754 Win=6146 Len=0 TSval=973525251 TSecr=3226945640
