    1   0.000000 192.168.14.16 → 192.168.14.15 TCP 66 27017 → 39428 [ACK] Seq=1 Ack=1 Win=502 Len=0 TSval=1613252819 TSecr=86775385
    2   0.000094 192.168.14.15 → 192.168.14.16 TCP 66 [TCP ACKed unseen segment] 39428 → 27017 [ACK] Seq=1 Ack=2 Win=5321 Len=0 TSval=87086681 TSecr=1613239763
    3   2.048046 192.168.14.15 → 192.168.14.16 TCP 66 [TCP Keep-Alive] [TCP ACKed unseen segment] 39428 → 27017 [ACK] Seq=0 Ack=2 Win=5321 Len=0 TSval=87088729 TSecr=1613239763
    4   2.048064 192.168.14.16 → 192.168.14.15 TCP 66 [TCP Previous segment not captured] 27017 → 39428 [ACK] Seq=2 Ack=1 Win=502 Len=0 TSval=1613254867 TSecr=87086681
    5   4.352058 192.168.14.15 → 192.168.14.16 TCP 66 39418 → 27017 [ACK] Seq=1 Ack=1 Win=504 Len=0 TSval=87091033 TSecr=1613242067
    6   4.352077 192.168.14.16 → 192.168.14.15 TCP 66 [TCP ACKed unseen segment] 27017 → 39418 [ACK] Seq=1 Ack=2 Win=501 Len=0 TSval=1613257171 TSecr=86971993
    7  10.746233 192.168.14.15 → 192.168.14.16 SSL 120 Continuation Data
    8  10.746532 192.168.14.16 → 192.168.14.15 SSL 119 Continuation Data
    9  10.746619 192.168.14.15 → 192.168.14.16 TCP 66 43870 → 27017 [ACK] Seq=55 Ack=54 Win=501 Len=0 TSval=87097427 TSecr=1613263565
   10  17.152063 192.168.14.15 → 192.168.14.16 TCP 66 [TCP Keep-Alive] [TCP ACKed unseen segment] 39428 → 27017 [ACK] Seq=0 Ack=2 Win=5321 Len=0 TSval=87103833 TSecr=1613254867
   11  17.152080 192.168.14.16 → 192.168.14.15 TCP 66 [TCP Keep-Alive ACK] 27017 → 39428 [ACK] Seq=2 Ack=1 Win=502 Len=0 TSval=1613269971 TSecr=87086681
   12  19.456082 192.168.14.15 → 192.168.14.16 TCP 66 [TCP Dup ACK 5#1] 39418 → 27017 [ACK] Seq=1 Ack=1 Win=504 Len=0 TSval=87106137 TSecr=1613257171
   13  19.456100 192.168.14.16 → 192.168.14.15 TCP 66 [TCP Dup ACK 6#1] [TCP ACKed unseen segment] 27017 → 39418 [ACK] Seq=1 Ack=2 Win=501 Len=0 TSval=1613272275 TSecr=86971993
   14  25.747107 192.168.14.15 → 192.168.14.16 SSL 120 Continuation Data
   15  25.747402 192.168.14.16 → 192.168.14.15 SSL 119 Continuation Data
   16  25.747492 192.168.14.15 → 192.168.14.16 TCP 66 43870 → 27017 [ACK] Seq=109 Ack=107 Win=501 Len=0 TSval=87112428 TSecr=1613278566
   17  26.282124 192.168.14.15 → 192.168.14.16 SSL 124 Continuation Data
   18  26.282423 192.168.14.16 → 192.168.14.15 SSL 385 Continuation Data
   19  26.282508 192.168.14.15 → 192.168.14.16 TCP 66 43870 → 27017 [ACK] Seq=167 Ack=426 Win=501 Len=0 TSval=87112963 TSecr=1613279101
   20  32.256047 192.168.14.15 → 192.168.14.16 TCP 66 [TCP Keep-Alive] 39428 → 27017 [ACK] Seq=0 Ack=2 Win=5321 Len=0 TSval=87118937 TSecr=1613269971
   21  32.256064 192.168.14.16 → 192.168.14.15 TCP 66 [TCP Keep-Alive ACK] 27017 → 39428 [ACK] Seq=2 Ack=1 Win=502 Len=0 TSval=1613285075 TSecr=87086681
   22  34.564009 192.168.14.15 → 192.168.14.16 TCP 66 [TCP Dup ACK 5#2] 39418 → 27017 [ACK] Seq=1 Ack=1 Win=504 Len=0 TSval=87121245 TSecr=1613272275
   23  34.564031 192.168.14.16 → 192.168.14.15 TCP 66 [TCP Dup ACK 6#2] [TCP ACKed unseen segment] 27017 → 39418 [ACK] Seq=1 Ack=2 Win=501 Len=0 TSval=1613287383 TSecr=86971993
   24  40.748697 192.168.14.15 → 192.168.14.16 SSL 120 Continuation Data
   25  40.748973 192.168.14.16 → 192.168.14.15 SSL 119 Continuation Data
   26  40.749034 192.168.14.15 → 192.168.14.16 TCP 66 43870 → 27017 [ACK] Seq=221 Ack=479 Win=501 Len=0 TSval=87127430 TSecr=1613293568
   27  47.360002 192.168.14.15 → 192.168.14.16 TCP 66 [TCP Keep-Alive] 39428 → 27017 [ACK] Seq=0 Ack=2 Win=5321 Len=0 TSval=87134041 TSecr=1613285075
   28  47.360019 192.168.14.16 → 192.168.14.15 TCP 66 [TCP Keep-Alive ACK] 27017 → 39428 [ACK] Seq=2 Ack=1 Win=502 Len=0 TSval=1613300179 TSecr=87086681
   29  49.664020 192.168.14.15 → 192.168.14.16 TCP 66 [TCP Dup ACK 5#3] 39418 → 27017 [ACK] Seq=1 Ack=1 Win=504 Len=0 TSval=87136345 TSecr=1613287383
   30  49.664041 192.168.14.16 → 192.168.14.15 TCP 66 [TCP Dup ACK 6#3] [TCP ACKed unseen segment] 27017 → 39418 [ACK] Seq=1 Ack=2 Win=501 Len=0 TSval=1613302483 TSecr=86971993
   31  55.749356 192.168.14.15 → 192.168.14.16 SSL 120 Continuation Data
   32  55.749632 192.168.14.16 → 192.168.14.15 SSL 119 Continuation Data
   33  55.749712 192.168.14.15 → 192.168.14.16 TCP 66 43870 → 27017 [ACK] Seq=275 Ack=532 Win=501 Len=0 TSval=87142430 TSecr=1613308568
   34  56.784582 192.168.14.15 → 192.168.14.16 SSL 124 Continuation Data
   35  56.784928 192.168.14.16 → 192.168.14.15 SSL 385 Continuation Data
   36  56.785017 192.168.14.15 → 192.168.14.16 TCP 66 43870 → 27017 [ACK] Seq=333 Ack=851 Win=501 Len=0 TSval=87143466 TSecr=1613309604
   37  62.464004 192.168.14.15 → 192.168.14.16 TCP 66 [TCP Keep-Alive] 39428 → 27017 [ACK] Seq=0 Ack=2 Win=5321 Len=0 TSval=87149145 TSecr=1613300179
   38  62.464020 192.168.14.16 → 192.168.14.15 TCP 66 [TCP Keep-Alive ACK] 27017 → 39428 [ACK] Seq=2 Ack=1 Win=502 Len=0 TSval=1613315283 TSecr=87086681
   39  64.767993 192.168.14.15 → 192.168.14.16 TCP 66 [TCP Dup ACK 5#4] 39418 → 27017 [ACK] Seq=1 Ack=1 Win=504 Len=0 TSval=87151449 TSecr=1613302483
   40  64.768009 192.168.14.16 → 192.168.14.15 TCP 66 [TCP Dup ACK 6#4] [TCP ACKed unseen segment] 27017 → 39418 [ACK] Seq=1 Ack=2 Win=501 Len=0 TSval=1613317587 TSecr=86971993
   41  70.750397 192.168.14.15 → 192.168.14.16 SSL 120 Continuation Data
   42  70.750739 192.168.14.16 → 192.168.14.15 SSL 119 Continuation Data
   43  70.750820 192.168.14.15 → 192.168.14.16 TCP 66 43870 → 27017 [ACK] Seq=387 Ack=904 Win=501 Len=0 TSval=87157431 TSecr=1613323569
   44  77.568044 192.168.14.15 → 192.168.14.16 TCP 66 [TCP Keep-Alive] 39428 → 27017 [ACK] Seq=0 Ack=2 Win=5321 Len=0 TSval=87164249 TSecr=1613315283
   45  77.568061 192.168.14.16 → 192.168.14.15 TCP 66 [TCP Keep-Alive ACK] 27017 → 39428 [ACK] Seq=2 Ack=1 Win=502 Len=0 TSval=1613330387 TSecr=87086681
   46  79.875983 192.168.14.15 → 192.168.14.16 TCP 66 [TCP Dup ACK 5#5] 39418 → 27017 [ACK] Seq=1 Ack=1 Win=504 Len=0 TSval=87166557 TSecr=1613317587
   47  79.875998 192.168.14.16 → 192.168.14.15 TCP 66 [TCP Dup ACK 6#5] [TCP ACKed unseen segment] 27017 → 39418 [ACK] Seq=1 Ack=2 Win=501 Len=0 TSval=1613332695 TSecr=86971993
   48  85.751676 192.168.14.15 → 192.168.14.16 SSL 120 Continuation Data
   49  85.752027 192.168.14.16 → 192.168.14.15 SSL 119 Continuation Data
   50  85.752119 192.168.14.15 → 192.168.14.16 TCP 66 43870 → 27017 [ACK] Seq=441 Ack=957 Win=501 Len=0 TSval=87172433 TSecr=1613338571
   51  87.287985 192.168.14.15 → 192.168.14.16 SSL 124 Continuation Data
   52  87.288363 192.168.14.16 → 192.168.14.15 SSL 385 Continuation Data
   53  87.288452 192.168.14.15 → 192.168.14.16 TCP 66 43870 → 27017 [ACK] Seq=499 Ack=1276 Win=501 Len=0 TSval=87173969 TSecr=1613340107
   54  92.671983 192.168.14.15 → 192.168.14.16 TCP 66 [TCP Keep-Alive] 39428 → 27017 [ACK] Seq=0 Ack=2 Win=5321 Len=0 TSval=87179353 TSecr=1613330387
   55  92.671997 192.168.14.16 → 192.168.14.15 TCP 66 [TCP Keep-Alive ACK] 27017 → 39428 [ACK] Seq=2 Ack=1 Win=502 Len=0 TSval=1613345491 TSecr=87086681
   56  94.976051 192.168.14.15 → 192.168.14.16 TCP 66 [TCP Dup ACK 5#6] 39418 → 27017 [ACK] Seq=1 Ack=1 Win=504 Len=0 TSval=87181657 TSecr=1613332695
   57  94.976067 192.168.14.16 → 192.168.14.15 TCP 66 [TCP Dup ACK 6#6] [TCP ACKed unseen segment] 27017 → 39418 [ACK] Seq=1 Ack=2 Win=501 Len=0 TSval=1613347795 TSecr=86971993
   58 100.752705 192.168.14.15 → 192.168.14.16 SSL 120 Continuation Data
   59 100.752980 192.168.14.16 → 192.168.14.15 SSL 119 Continuation Data
   60 100.753049 192.168.14.15 → 192.168.14.16 TCP 66 43870 → 27017 [ACK] Seq=553 Ack=1329 Win=501 Len=0 TSval=87187434 TSecr=1613353572
   61 107.776004 192.168.14.15 → 192.168.14.16 TCP 66 [TCP Keep-Alive] 39428 → 27017 [ACK] Seq=0 Ack=2 Win=5321 Len=0 TSval=87194457 TSecr=1613345491
   62 107.776020 192.168.14.16 → 192.168.14.15 TCP 66 [TCP Keep-Alive ACK] 27017 → 39428 [ACK] Seq=2 Ack=1 Win=502 Len=0 TSval=1613360595 TSecr=87086681
   63 110.080045 192.168.14.15 → 192.168.14.16 TCP 66 [TCP Dup ACK 5#7] 39418 → 27017 [ACK] Seq=1 Ack=1 Win=504 Len=0 TSval=87196761 TSecr=1613347795
   64 110.080061 192.168.14.16 → 192.168.14.15 TCP 66 [TCP Dup ACK 6#7] [TCP ACKed unseen segment] 27017 → 39418 [ACK] Seq=1 Ack=2 Win=501 Len=0 TSval=1613362899 TSecr=86971993
   65 115.754367 192.168.14.15 → 192.168.14.16 SSL 120 Continuation Data
   66 115.754679 192.168.14.16 → 192.168.14.15 SSL 119 Continuation Data
   67 115.754770 192.168.14.15 → 192.168.14.16 TCP 66 43870 → 27017 [ACK] Seq=607 Ack=1382 Win=501 Len=0 TSval=87202435 TSecr=1613368573
   68 117.791806 192.168.14.15 → 192.168.14.16 SSL 124 Continuation Data
   69 117.792196 192.168.14.16 → 192.168.14.15 SSL 385 Continuation Data
   70 117.792277 192.168.14.15 → 192.168.14.16 TCP 66 43870 → 27017 [ACK] Seq=665 Ack=1701 Win=501 Len=0 TSval=87204473 TSecr=1613370611
   71 122.880072 192.168.14.15 → 192.168.14.16 TCP 66 [TCP Keep-Alive] 39428 → 27017 [ACK] Seq=0 Ack=2 Win=5321 Len=0 TSval=87209561 TSecr=1613360595
   72 122.880088 192.168.14.16 → 192.168.14.15 TCP 66 [TCP Keep-Alive ACK] 27017 → 39428 [ACK] Seq=2 Ack=1 Win=502 Len=0 TSval=1613375699 TSecr=87086681
   73 125.184054 192.168.14.15 → 192.168.14.16 TCP 66 [TCP Dup ACK 5#8] 39418 → 27017 [ACK] Seq=1 Ack=1 Win=504 Len=0 TSval=87211865 TSecr=1613362899
   74 125.184071 192.168.14.16 → 192.168.14.15 TCP 66 [TCP Dup ACK 6#8] [TCP ACKed unseen segment] 27017 → 39418 [ACK] Seq=1 Ack=2 Win=501 Len=0 TSval=1613378003 TSecr=86971993
   75 130.755071 192.168.14.15 → 192.168.14.16 SSL 120 Continuation Data
   76 130.755293 192.168.14.16 → 192.168.14.15 SSL 119 Continuation Data
   77 130.755355 192.168.14.15 → 192.168.14.16 TCP 66 43870 → 27017 [ACK] Seq=719 Ack=1754 Win=501 Len=0 TSval=87217436 TSecr=1613383574
