    1   0.000000 192.168.14.14 → 192.168.14.12 SSL 120 Continuation Data
    2   0.000254 192.168.14.12 → 192.168.14.14 SSL 119 Continuation Data
    3   0.000352 192.168.14.14 → 192.168.14.12 TCP 66 40134 → 27017 [ACK] Seq=55 Ack=54 Win=501 Len=0 TSval=1022773553 TSecr=2220361884
    4   4.405986 192.168.14.14 → 192.168.14.12 TCP 66 40132 → 27017 [ACK] Seq=1 Ack=1 Win=504 Len=0 TSval=1022777959 TSecr=2220351186
    5   4.406003 192.168.14.12 → 192.168.14.14 TCP 66 [TCP ACKed unseen segment] 27017 → 40132 [ACK] Seq=1 Ack=2 Win=501 Len=0 TSval=2220366290 TSecr=1022644583
    6  11.491704 192.168.14.14 → 192.168.14.12 SSL 124 Continuation Data
    7  11.491996 192.168.14.12 → 192.168.14.14 SSL 385 Continuation Data
    8  11.492080 192.168.14.14 → 192.168.14.12 TCP 66 40134 → 27017 [ACK] Seq=113 Ack=373 Win=501 Len=0 TSval=1022785045 TSecr=2220373376
    9  15.000830 192.168.14.14 → 192.168.14.12 SSL 120 Continuation Data
   10  15.001109 192.168.14.12 → 192.168.14.14 SSL 119 Continuation Data
   11  15.001202 192.168.14.14 → 192.168.14.12 TCP 66 40134 → 27017 [ACK] Seq=167 Ack=426 Win=501 Len=0 TSval=1022788554 TSecr=2220376885
   12  19.509942 192.168.14.14 → 192.168.14.12 TCP 66 [TCP Dup ACK 4#1] 40132 → 27017 [ACK] Seq=1 Ack=1 Win=504 Len=0 TSval=1022793063 TSecr=2220366290
   13  19.509959 192.168.14.12 → 192.168.14.14 TCP 66 [TCP Dup ACK 5#1] [TCP ACKed unseen segment] 27017 → 40132 [ACK] Seq=1 Ack=2 Win=501 Len=0 TSval=2220381394 TSecr=1022644583
   14  30.002097 192.168.14.14 → 192.168.14.12 SSL 120 Continuation Data
   15  30.002355 192.168.14.12 → 192.168.14.14 SSL 119 Continuation Data
   16  30.002428 192.168.14.14 → 192.168.14.12 TCP 66 40134 → 27017 [ACK] Seq=221 Ack=479 Win=501 Len=0 TSval=1022803555 TSecr=2220391886
   17  34.613926 192.168.14.14 → 192.168.14.12 TCP 66 [TCP Dup ACK 4#2] 40132 → 27017 [ACK] Seq=1 Ack=1 Win=504 Len=0 TSval=1022808167 TSecr=2220381394
   18  34.613942 192.168.14.12 → 192.168.14.14 TCP 66 [TCP Dup ACK 5#2] [TCP ACKed unseen segment] 27017 → 40132 [ACK] Seq=1 Ack=2 Win=501 Len=0 TSval=2220396498 TSecr=1022644583
   19  41.994911 192.168.14.14 → 192.168.14.12 SSL 124 Continuation Data
   20  41.995239 192.168.14.12 → 192.168.14.14 SSL 385 Continuation Data
   21  41.995339 192.168.14.14 → 192.168.14.12 TCP 66 40134 → 27017 [ACK] Seq=279 Ack=798 Win=501 Len=0 TSval=1022815548 TSecr=2220403879
   22  45.002697 192.168.14.14 → 192.168.14.12 SSL 120 Continuation Data
   23  45.003000 192.168.14.12 → 192.168.14.14 SSL 119 Continuation Data
   24  45.003087 192.168.14.14 → 192.168.14.12 TCP 66 40134 → 27017 [ACK] Seq=333 Ack=851 Win=501 Len=0 TSval=1022818556 TSecr=2220406887
   25  49.717924 192.168.14.14 → 192.168.14.12 TCP 66 [TCP Dup ACK 4#3] 40132 → 27017 [ACK] Seq=1 Ack=1 Win=504 Len=0 TSval=1022823271 TSecr=2220396498
   26  49.717940 192.168.14.12 → 192.168.14.14 TCP 66 [TCP Dup ACK 5#3] [TCP ACKed unseen segment] 27017 → 40132 [ACK] Seq=1 Ack=2 Win=501 Len=0 TSval=2220411602 TSecr=1022644583
   27  60.003514 192.168.14.14 → 192.168.14.12 SSL 120 Continuation Data
   28  60.003799 192.168.14.12 → 192.168.14.14 SSL 119 Continuation Data
   29  60.003881 192.168.14.14 → 192.168.14.12 TCP 66 40134 → 27017 [ACK] Seq=387 Ack=904 Win=501 Len=0 TSval=1022833557 TSecr=2220421887
   30  64.825927 192.168.14.14 → 192.168.14.12 TCP 66 [TCP Dup ACK 4#4] 40132 → 27017 [ACK] Seq=1 Ack=1 Win=504 Len=0 TSval=1022838379 TSecr=2220411602
   31  64.825944 192.168.14.12 → 192.168.14.14 TCP 66 [TCP Dup ACK 5#4] [TCP ACKed unseen segment] 27017 → 40132 [ACK] Seq=1 Ack=2 Win=501 Len=0 TSval=2220426710 TSecr=1022644583
   32  72.498471 192.168.14.14 → 192.168.14.12 SSL 124 Continuation Data
   33  72.498832 192.168.14.12 → 192.168.14.14 SSL 385 Continuation Data
   34  72.498920 192.168.14.14 → 192.168.14.12 TCP 66 40134 → 27017 [ACK] Seq=445 Ack=1223 Win=501 Len=0 TSval=1022846052 TSecr=2220434383
   35  75.004200 192.168.14.14 → 192.168.14.12 SSL 120 Continuation Data
   36  75.004448 192.168.14.12 → 192.168.14.14 SSL 119 Continuation Data
   37  75.004516 192.168.14.14 → 192.168.14.12 TCP 66 40134 → 27017 [ACK] Seq=499 Ack=1276 Win=501 Len=0 TSval=1022848557 TSecr=2220436888
   38  79.925937 192.168.14.14 → 192.168.14.12 TCP 66 [TCP Dup ACK 4#5] 40132 → 27017 [ACK] Seq=1 Ack=1 Win=504 Len=0 TSval=1022853479 TSecr=2220426710
   39  79.925954 192.168.14.12 → 192.168.14.14 TCP 66 [TCP Dup ACK 5#5] [TCP ACKed unseen segment] 27017 → 40132 [ACK] Seq=1 Ack=2 Win=501 Len=0 TSval=2220441810 TSecr=1022644583
   40  90.005160 192.168.14.14 → 192.168.14.12 SSL 120 Continuation Data
   41  90.005422 192.168.14.12 → 192.168.14.14 SSL 119 Continuation Data
   42  90.005496 192.168.14.14 → 192.168.14.12 TCP 66 40134 → 27017 [ACK] Seq=553 Ack=1329 Win=501 Len=0 TSval=1022863558 TSecr=2220451889
   43  95.033978 192.168.14.14 → 192.168.14.12 TCP 66 [TCP Dup ACK 4#6] 40132 → 27017 [ACK] Seq=1 Ack=1 Win=504 Len=0 TSval=1022868587 TSecr=2220441810
   44  95.033995 192.168.14.12 → 192.168.14.14 TCP 66 [TCP Dup ACK 5#6] [TCP ACKed unseen segment] 27017 → 40132 [ACK] Seq=1 Ack=2 Win=501 Len=0 TSval=2220456918 TSecr=1022644583
   45 103.002246 192.168.14.14 → 192.168.14.12 SSL 124 Continuation Data
   46 103.002576 192.168.14.12 → 192.168.14.14 SSL 385 Continuation Data
   47 103.002662 192.168.14.14 → 192.168.14.12 TCP 66 40134 → 27017 [ACK] Seq=611 Ack=1648 Win=501 Len=0 TSval=1022876555 TSecr=2220464886
   48 105.006365 192.168.14.14 → 192.168.14.12 SSL 120 Continuation Data
   49 105.006631 192.168.14.12 → 192.168.14.14 SSL 119 Continuation Data
   50 105.006718 192.168.14.14 → 192.168.14.12 TCP 66 40134 → 27017 [ACK] Seq=665 Ack=1701 Win=501 Len=0 TSval=1022878559 TSecr=2220466890
   51 110.134185 192.168.14.14 → 192.168.14.12 TCP 66 [TCP Dup ACK 4#7] 40132 → 27017 [ACK] Seq=1 Ack=1 Win=504 Len=0 TSval=1022883687 TSecr=2220456918
   52 110.134209 192.168.14.12 → 192.168.14.14 TCP 66 [TCP Dup ACK 5#7] [TCP ACKed unseen segment] 27017 → 40132 [ACK] Seq=1 Ack=2 Win=501 Len=0 TSval=2220472018 TSecr=1022644583
   53 120.008003 192.168.14.14 → 192.168.14.12 SSL 120 Continuation Data
   54 120.008315 192.168.14.12 → 192.168.14.14 SSL 119 Continuation Data
   55 120.008415 192.168.14.14 → 192.168.14.12 TCP 66 40134 → 27017 [ACK] Seq=719 Ack=1754 Win=501 Len=0 TSval=1022893561 TSecr=2220481892
   56 125.238032 192.168.14.14 → 192.168.14.12 TCP 66 [TCP Dup ACK 4#8] 40132 → 27017 [ACK] Seq=1 Ack=1 Win=504 Len=0 TSval=1022898791 TSecr=2220472018
   57 125.238051 192.168.14.12 → 192.168.14.14 TCP 66 [TCP Dup ACK 5#8] [TCP ACKed unseen segment] 27017 → 40132 [ACK] Seq=1 Ack=2 Win=501 Len=0 TSval=2220487122 TSecr=1022644583
