    1   0.000000 192.168.14.17 → 192.168.206.153 TCP 66 37512 → 27017 [ACK] Seq=1 Ack=1 Win=504 Len=0 TSval=2013495123 TSecr=4106079054
    2   0.000022 192.168.206.153 → 192.168.14.17 TCP 66 [TCP ACKed unseen segment] 27017 → 37512 [ACK] Seq=1 Ack=2 Win=501 Len=0 TSval=4106094158 TSecr=2013267389
    3   5.217494 192.168.14.17 → 192.168.206.153 SSL 120 Continuation Data
    4   5.217801 192.168.206.153 → 192.168.14.17 SSL 119 Continuation Data
    5   5.218060 192.168.14.17 → 192.168.206.153 TCP 66 37538 → 27017 [ACK] Seq=55 Ack=54 Win=1062 Len=0 TSval=2013500341 TSecr=4106099376
    6   5.313371 192.168.14.17 → 192.168.206.153 SSL 124 Continuation Data
    7   5.313702 192.168.206.153 → 192.168.14.17 SSL 385 Continuation Data
    8   5.313969 192.168.14.17 → 192.168.206.153 TCP 66 37538 → 27017 [ACK] Seq=113 Ack=373 Win=1071 Len=0 TSval=2013500437 TSecr=4106099471
    9   6.144032 192.168.14.17 → 192.168.206.153 TCP 66 37522 → 27017 [ACK] Seq=1 Ack=1 Win=1540 Len=0 TSval=2013501267 TSecr=4106085198
   10   6.144051 192.168.206.153 → 192.168.14.17 TCP 66 [TCP ACKed unseen segment] 27017 → 37522 [ACK] Seq=1 Ack=2 Win=3081 Len=0 TSval=4106100302 TSecr=2013244477
   11  15.104031 192.168.14.17 → 192.168.206.153 TCP 66 [TCP Dup ACK 1#1] 37512 → 27017 [ACK] Seq=1 Ack=1 Win=504 Len=0 TSval=2013510227 TSecr=4106094158
   12  15.104052 192.168.206.153 → 192.168.14.17 TCP 66 [TCP Dup ACK 2#1] [TCP ACKed unseen segment] 27017 → 37512 [ACK] Seq=1 Ack=2 Win=501 Len=0 TSval=4106109262 TSecr=2013267389
   13  20.219169 192.168.14.17 → 192.168.206.153 SSL 120 Continuation Data
   14  20.219498 192.168.206.153 → 192.168.14.17 SSL 119 Continuation Data
   15  20.219844 192.168.14.17 → 192.168.206.153 TCP 66 37538 → 27017 [ACK] Seq=167 Ack=426 Win=1071 Len=0 TSval=2013515343 TSecr=4106114377
   16  21.248047 192.168.14.17 → 192.168.206.153 TCP 66 [TCP Dup ACK 9#1] 37522 → 27017 [ACK] Seq=1 Ack=1 Win=1540 Len=0 TSval=2013516371 TSecr=4106100302
   17  21.248066 192.168.206.153 → 192.168.14.17 TCP 66 [TCP Dup ACK 10#1] [TCP ACKed unseen segment] 27017 → 37522 [ACK] Seq=1 Ack=2 Win=3081 Len=0 TSval=4106115406 TSecr=2013244477
   18  29.075058 192.168.14.17 → 192.168.206.153 TCP 226 [TCP segment of a reassembled PDU]
   19  29.076560 192.168.206.153 → 192.168.14.17 TCP 196 [TCP segment of a reassembled PDU]
   20  29.076943 192.168.14.17 → 192.168.206.153 TCP 66 37538 → 27017 [ACK] Seq=327 Ack=556 Win=1079 Len=0 TSval=2013524200 TSecr=4106123234
   21  29.078371 192.168.14.17 → 192.168.206.153 TCP 226 37538 → 27017 [PSH, ACK] Seq=327 Ack=556 Win=1079 Len=160 TSval=2013524201 TSecr=4106123234 [TCP segment of a reassembled PDU]
   22  29.079748 192.168.206.153 → 192.168.14.17 TCP 196 27017 → 37538 [PSH, ACK] Seq=556 Ack=487 Win=2369 Len=130 TSval=4106123238 TSecr=2013524201 [TCP segment of a reassembled PDU]
   23  29.079945 192.168.14.17 → 192.168.206.153 TCP 66 37538 → 27017 [ACK] Seq=487 Ack=686 Win=1088 Len=0 TSval=2013524203 TSecr=4106123238
   24  29.081022 192.168.14.17 → 192.168.206.153 TCP 226 37538 → 27017 [PSH, ACK] Seq=487 Ack=686 Win=1088 Len=160 TSval=2013524204 TSecr=4106123238 [TCP segment of a reassembled PDU]
   25  29.082221 192.168.206.153 → 192.168.14.17 TCP 196 27017 → 37538 [PSH, ACK] Seq=686 Ack=647 Win=2377 Len=130 TSval=4106123240 TSecr=2013524204 [TCP segment of a reassembled PDU]
   26  29.084020 192.168.14.17 → 192.168.206.153 TCP 318 37538 → 27017 [PSH, ACK] Seq=647 Ack=816 Win=1096 Len=252 TSval=2013524207 TSecr=4106123240 [TCP segment of a reassembled PDU]
   27  29.084379 192.168.206.153 → 192.168.14.17 TCP 126 27017 → 37538 [PSH, ACK] Seq=816 Ack=899 Win=2386 Len=60 TSval=4106123242 TSecr=2013524207 [TCP segment of a reassembled PDU]
   28  29.084715 192.168.14.17 → 192.168.206.153 TCP 318 37538 → 27017 [PSH, ACK] Seq=899 Ack=876 Win=1096 Len=252 TSval=2013524207 TSecr=4106123242 [TCP segment of a reassembled PDU]
   29  29.084931 192.168.206.153 → 192.168.14.17 TCP 126 27017 → 37538 [PSH, ACK] Seq=876 Ack=1151 Win=2394 Len=60 TSval=4106123243 TSecr=2013524207 [TCP segment of a reassembled PDU]
   30  29.085236 192.168.14.17 → 192.168.206.153 TCP 318 37538 → 27017 [PSH, ACK] Seq=1151 Ack=936 Win=1096 Len=252 TSval=2013524208 TSecr=4106123243 [TCP segment of a reassembled PDU]
   31  29.085434 192.168.206.153 → 192.168.14.17 SSLv2 126 Encrypted Data, Continuation Data
   32  29.122696 192.168.14.17 → 192.168.206.153 TCP 227 37538 → 27017 [PSH, ACK] Seq=1403 Ack=996 Win=1096 Len=161 TSval=2013524245 TSecr=4106123243 [TCP segment of a reassembled PDU]
   33  29.124062 192.168.206.153 → 192.168.14.17 TCP 196 [TCP segment of a reassembled PDU]
   34  29.125591 192.168.14.17 → 192.168.206.153 TCP 227 37538 → 27017 [PSH, ACK] Seq=1564 Ack=1126 Win=1104 Len=161 TSval=2013524248 TSecr=4106123282 [TCP segment of a reassembled PDU]
   35  29.126863 192.168.206.153 → 192.168.14.17 TCP 196 27017 → 37538 [PSH, ACK] Seq=1126 Ack=1725 Win=2419 Len=130 TSval=4106123285 TSecr=2013524248 [TCP segment of a reassembled PDU]
   36  29.128584 192.168.14.17 → 192.168.206.153 TCP 227 37538 → 27017 [PSH, ACK] Seq=1725 Ack=1256 Win=1113 Len=161 TSval=2013524251 TSecr=4106123285 [TCP segment of a reassembled PDU]
   37  29.129875 192.168.206.153 → 192.168.14.17 TCP 196 27017 → 37538 [PSH, ACK] Seq=1256 Ack=1886 Win=2427 Len=130 TSval=4106123288 TSecr=2013524251 [TCP segment of a reassembled PDU]
   38  29.132241 192.168.14.17 → 192.168.206.153 TCP 319 37538 → 27017 [PSH, ACK] Seq=1886 Ack=1386 Win=1121 Len=253 TSval=2013524255 TSecr=4106123288 [TCP segment of a reassembled PDU]
   39  29.132645 192.168.206.153 → 192.168.14.17 TCP 126 27017 → 37538 [PSH, ACK] Seq=1386 Ack=2139 Win=2436 Len=60 TSval=4106123290 TSecr=2013524255 [TCP segment of a reassembled PDU]
   40  29.133249 192.168.14.17 → 192.168.206.153 TCP 319 37538 → 27017 [PSH, ACK] Seq=2139 Ack=1446 Win=1121 Len=253 TSval=2013524256 TSecr=4106123290 [TCP segment of a reassembled PDU]
   41  29.133478 192.168.206.153 → 192.168.14.17 TCP 126 27017 → 37538 [PSH, ACK] Seq=1446 Ack=2392 Win=2444 Len=60 TSval=4106123291 TSecr=2013524256 [TCP segment of a reassembled PDU]
   42  29.133884 192.168.14.17 → 192.168.206.153 TCP 319 37538 → 27017 [PSH, ACK] Seq=2392 Ack=1506 Win=1121 Len=253 TSval=2013524257 TSecr=4106123291 [TCP segment of a reassembled PDU]
   43  29.134095 192.168.206.153 → 192.168.14.17 SSLv2 126 Encrypted Data, Continuation Data
   44  29.134511 192.168.14.17 → 192.168.206.153 TCP 319 37538 → 27017 [PSH, ACK] Seq=2645 Ack=1566 Win=1121 Len=253 TSval=2013524257 TSecr=4106123292 [TCP segment of a reassembled PDU]
   45  29.134702 192.168.206.153 → 192.168.14.17 SSL 126 Continuation Data
   46  29.175917 192.168.14.17 → 192.168.206.153 TCP 66 37538 → 27017 [ACK] Seq=2898 Ack=1626 Win=1121 Len=0 TSval=2013524299 TSecr=4106123292
   47  30.207863 192.168.14.17 → 192.168.206.153 TCP 66 [TCP Dup ACK 1#2] 37512 → 27017 [ACK] Seq=1 Ack=1 Win=504 Len=0 TSval=2013525331 TSecr=4106109262
   48  30.207880 192.168.206.153 → 192.168.14.17 TCP 66 [TCP Dup ACK 2#2] [TCP ACKed unseen segment] 27017 → 37512 [ACK] Seq=1 Ack=2 Win=501 Len=0 TSval=4106124366 TSecr=2013267389
   49  30.933084 192.168.14.17 → 192.168.206.153 TCP 227 37538 → 27017 [PSH, ACK] Seq=2898 Ack=1626 Win=1121 Len=161 TSval=2013526056 TSecr=4106123292 [TCP segment of a reassembled PDU]
   50  30.934547 192.168.206.153 → 192.168.14.17 TCP 196 [TCP segment of a reassembled PDU]
   51  30.934789 192.168.14.17 → 192.168.206.153 TCP 66 37538 → 27017 [ACK] Seq=3059 Ack=1756 Win=1129 Len=0 TSval=2013526057 TSecr=4106125092
   52  30.935978 192.168.14.17 → 192.168.206.153 TCP 319 37538 → 27017 [PSH, ACK] Seq=3059 Ack=1756 Win=1129 Len=253 TSval=2013526059 TSecr=4106125092 [TCP segment of a reassembled PDU]
   53  30.936302 192.168.206.153 → 192.168.14.17 TCP 126 27017 → 37538 [PSH, ACK] Seq=1756 Ack=3312 Win=2478 Len=60 TSval=4106125094 TSecr=2013526059 [TCP segment of a reassembled PDU]
   54  30.936505 192.168.14.17 → 192.168.206.153 TCP 66 37538 → 27017 [ACK] Seq=3312 Ack=1816 Win=1129 Len=0 TSval=2013526059 TSecr=4106125094
   55  31.537747 192.168.14.17 → 192.168.206.153 TCP 319 37538 → 27017 [PSH, ACK] Seq=3312 Ack=1816 Win=1129 Len=253 TSval=2013526660 TSecr=4106125094 [TCP segment of a reassembled PDU]
   56  31.538291 192.168.206.153 → 192.168.14.17 TCP 126 27017 → 37538 [PSH, ACK] Seq=1816 Ack=3565 Win=2486 Len=60 TSval=4106125696 TSecr=2013526660 [TCP segment of a reassembled PDU]
   57  31.538551 192.168.14.17 → 192.168.206.153 TCP 66 37538 → 27017 [ACK] Seq=3565 Ack=1876 Win=1129 Len=0 TSval=2013526661 TSecr=4106125696
   58  31.538786 192.168.14.17 → 192.168.206.153 TCP 319 37538 → 27017 [PSH, ACK] Seq=3565 Ack=1876 Win=1129 Len=253 TSval=2013526661 TSecr=4106125696 [TCP segment of a reassembled PDU]
   59  31.539040 192.168.206.153 → 192.168.14.17 TCP 126 27017 → 37538 [PSH, ACK] Seq=1876 Ack=3818 Win=2494 Len=60 TSval=4106125697 TSecr=2013526661 [TCP segment of a reassembled PDU]
   60  31.539235 192.168.14.17 → 192.168.206.153 TCP 66 37538 → 27017 [ACK] Seq=3818 Ack=1936 Win=1129 Len=0 TSval=2013526662 TSecr=4106125697
   61  31.539374 192.168.14.17 → 192.168.206.153 TCP 319 37538 → 27017 [PSH, ACK] Seq=3818 Ack=1936 Win=1129 Len=253 TSval=2013526662 TSecr=4106125697 [TCP segment of a reassembled PDU]
   62  31.539573 192.168.206.153 → 192.168.14.17 TCP 126 27017 → 37538 [PSH, ACK] Seq=1936 Ack=4071 Win=2503 Len=60 TSval=4106125697 TSecr=2013526662 [TCP segment of a reassembled PDU]
   63  31.539751 192.168.14.17 → 192.168.206.153 TCP 66 37538 → 27017 [ACK] Seq=4071 Ack=1996 Win=1129 Len=0 TSval=2013526662 TSecr=4106125697
   64  31.539913 192.168.14.17 → 192.168.206.153 TCP 319 37538 → 27017 [PSH, ACK] Seq=4071 Ack=1996 Win=1129 Len=253 TSval=2013526663 TSecr=4106125697 [TCP segment of a reassembled PDU]
   65  31.540098 192.168.206.153 → 192.168.14.17 TCP 126 27017 → 37538 [PSH, ACK] Seq=1996 Ack=4324 Win=2511 Len=60 TSval=4106125698 TSecr=2013526663 [TCP segment of a reassembled PDU]
   66  31.540285 192.168.14.17 → 192.168.206.153 TCP 66 37538 → 27017 [ACK] Seq=4324 Ack=2056 Win=1129 Len=0 TSval=2013526663 TSecr=4106125698
   67  31.540578 192.168.14.17 → 192.168.206.153 TCP 319 37538 → 27017 [PSH, ACK] Seq=4324 Ack=2056 Win=1129 Len=253 TSval=2013526663 TSecr=4106125698 [TCP segment of a reassembled PDU]
   68  31.540763 192.168.206.153 → 192.168.14.17 TCP 126 27017 → 37538 [PSH, ACK] Seq=2056 Ack=4577 Win=2520 Len=60 TSval=4106125699 TSecr=2013526663 [TCP segment of a reassembled PDU]
   69  31.540955 192.168.14.17 → 192.168.206.153 TCP 66 37538 → 27017 [ACK] Seq=4577 Ack=2116 Win=1129 Len=0 TSval=2013526664 TSecr=4106125699
   70  32.702590 192.168.14.17 → 192.168.206.153 TCP 227 37538 → 27017 [PSH, ACK] Seq=4577 Ack=2116 Win=1129 Len=161 TSval=2013527825 TSecr=4106125699 [TCP segment of a reassembled PDU]
   71  32.704077 192.168.206.153 → 192.168.14.17 SSLv2 196 Encrypted Data, Continuation Data
   72  32.704325 192.168.14.17 → 192.168.206.153 TCP 66 37538 → 27017 [ACK] Seq=4738 Ack=2246 Win=1138 Len=0 TSval=2013527827 TSecr=4106126862
   73  32.705382 192.168.14.17 → 192.168.206.153 TCP 227 37538 → 27017 [PSH, ACK] Seq=4738 Ack=2246 Win=1138 Len=161 TSval=2013527828 TSecr=4106126862 [TCP segment of a reassembled PDU]
   74  32.706659 192.168.206.153 → 192.168.14.17 TCP 196 [TCP segment of a reassembled PDU]
   75  32.706873 192.168.14.17 → 192.168.206.153 TCP 66 37538 → 27017 [ACK] Seq=4899 Ack=2376 Win=1146 Len=0 TSval=2013527830 TSecr=4106126864
   76  32.708939 192.168.14.17 → 192.168.206.153 TCP 318 37538 → 27017 [PSH, ACK] Seq=4899 Ack=2376 Win=1146 Len=252 TSval=2013527832 TSecr=4106126864 [TCP segment of a reassembled PDU]
   77  32.709272 192.168.206.153 → 192.168.14.17 TCP 126 27017 → 37538 [PSH, ACK] Seq=2376 Ack=5151 Win=2545 Len=60 TSval=4106126867 TSecr=2013527832 [TCP segment of a reassembled PDU]
   78  32.709462 192.168.14.17 → 192.168.206.153 TCP 66 37538 → 27017 [ACK] Seq=5151 Ack=2436 Win=1146 Len=0 TSval=2013527832 TSecr=4106126867
   79  32.709638 192.168.14.17 → 192.168.206.153 TCP 318 37538 → 27017 [PSH, ACK] Seq=5151 Ack=2436 Win=1146 Len=252 TSval=2013527832 TSecr=4106126867 [TCP segment of a reassembled PDU]
   80  32.709862 192.168.206.153 → 192.168.14.17 TCP 126 27017 → 37538 [PSH, ACK] Seq=2436 Ack=5403 Win=2553 Len=60 TSval=4106126868 TSecr=2013527832 [TCP segment of a reassembled PDU]
   81  32.710042 192.168.14.17 → 192.168.206.153 TCP 66 37538 → 27017 [ACK] Seq=5403 Ack=2496 Win=1146 Len=0 TSval=2013527833 TSecr=4106126868
   82  32.710202 192.168.14.17 → 192.168.206.153 TCP 318 37538 → 27017 [PSH, ACK] Seq=5403 Ack=2496 Win=1146 Len=252 TSval=2013527833 TSecr=4106126868 [TCP segment of a reassembled PDU]
   83  32.710405 192.168.206.153 → 192.168.14.17 TCP 126 27017 → 37538 [PSH, ACK] Seq=2496 Ack=5655 Win=2561 Len=60 TSval=4106126868 TSecr=2013527833 [TCP segment of a reassembled PDU]
   84  32.710575 192.168.14.17 → 192.168.206.153 TCP 66 37538 → 27017 [ACK] Seq=5655 Ack=2556 Win=1146 Len=0 TSval=2013527833 TSecr=4106126868
   85  33.548598 192.168.14.17 → 192.168.206.153 TCP 319 37538 → 27017 [PSH, ACK] Seq=5655 Ack=2556 Win=1146 Len=253 TSval=2013528671 TSecr=4106126868 [TCP segment of a reassembled PDU]
   86  33.549141 192.168.206.153 → 192.168.14.17 TCP 126 27017 → 37538 [PSH, ACK] Seq=2556 Ack=5908 Win=2570 Len=60 TSval=4106127707 TSecr=2013528671 [TCP segment of a reassembled PDU]
   87  33.549358 192.168.14.17 → 192.168.206.153 TCP 66 37538 → 27017 [ACK] Seq=5908 Ack=2616 Win=1146 Len=0 TSval=2013528672 TSecr=4106127707
   88  33.549534 192.168.14.17 → 192.168.206.153 TCP 319 37538 → 27017 [PSH, ACK] Seq=5908 Ack=2616 Win=1146 Len=253 TSval=2013528672 TSecr=4106127707 [TCP segment of a reassembled PDU]
   89  33.549833 192.168.206.153 → 192.168.14.17 TCP 126 27017 → 37538 [PSH, ACK] Seq=2616 Ack=6161 Win=2578 Len=60 TSval=4106127708 TSecr=2013528672 [TCP segment of a reassembled PDU]
   90  33.550066 192.168.14.17 → 192.168.206.153 TCP 66 37538 → 27017 [ACK] Seq=6161 Ack=2676 Win=1146 Len=0 TSval=2013528673 TSecr=4106127708
   91  33.550391 192.168.14.17 → 192.168.206.153 TCP 319 37538 → 27017 [PSH, ACK] Seq=6161 Ack=2676 Win=1146 Len=253 TSval=2013528673 TSecr=4106127708 [TCP segment of a reassembled PDU]
   92  33.550601 192.168.206.153 → 192.168.14.17 TCP 126 27017 → 37538 [PSH, ACK] Seq=2676 Ack=6414 Win=2587 Len=60 TSval=4106127708 TSecr=2013528673 [TCP segment of a reassembled PDU]
   93  33.550793 192.168.14.17 → 192.168.206.153 TCP 66 37538 → 27017 [ACK] Seq=6414 Ack=2736 Win=1146 Len=0 TSval=2013528674 TSecr=4106127708
   94  33.550935 192.168.14.17 → 192.168.206.153 TCP 319 37538 → 27017 [PSH, ACK] Seq=6414 Ack=2736 Win=1146 Len=253 TSval=2013528674 TSecr=4106127708 [TCP segment of a reassembled PDU]
   95  33.551134 192.168.206.153 → 192.168.14.17 SSLv2 126 Encrypted Data, Continuation Data
   96  33.551324 192.168.14.17 → 192.168.206.153 TCP 66 37538 → 27017 [ACK] Seq=6667 Ack=2796 Win=1146 Len=0 TSval=2013528674 TSecr=4106127709
   97  33.698927 192.168.14.17 → 192.168.206.153 TCP 227 37538 → 27017 [PSH, ACK] Seq=6667 Ack=2796 Win=1146 Len=161 TSval=2013528822 TSecr=4106127709 [TCP segment of a reassembled PDU]
   98  33.700474 192.168.206.153 → 192.168.14.17 TCP 196 [TCP segment of a reassembled PDU]
   99  33.700711 192.168.14.17 → 192.168.206.153 TCP 66 37538 → 27017 [ACK] Seq=6828 Ack=2926 Win=1155 Len=0 TSval=2013528823 TSecr=4106127858
  100  33.701978 192.168.14.17 → 192.168.206.153 TCP 227 37538 → 27017 [PSH, ACK] Seq=6828 Ack=2926 Win=1155 Len=161 TSval=2013528825 TSecr=4106127858 [TCP segment of a reassembled PDU]
  101  33.703340 192.168.206.153 → 192.168.14.17 TCP 196 27017 → 37538 [PSH, ACK] Seq=2926 Ack=6989 Win=2612 Len=130 TSval=4106127861 TSecr=2013528825 [TCP segment of a reassembled PDU]
  102  33.703556 192.168.14.17 → 192.168.206.153 TCP 66 37538 → 27017 [ACK] Seq=6989 Ack=3056 Win=1163 Len=0 TSval=2013528826 TSecr=4106127861
  103  33.705107 192.168.14.17 → 192.168.206.153 TCP 318 37538 → 27017 [PSH, ACK] Seq=6989 Ack=3056 Win=1163 Len=252 TSval=2013528828 TSecr=4106127861 [TCP segment of a reassembled PDU]
  104  33.705529 192.168.206.153 → 192.168.14.17 TCP 126 27017 → 37538 [PSH, ACK] Seq=3056 Ack=7241 Win=2620 Len=60 TSval=4106127863 TSecr=2013528828 [TCP segment of a reassembled PDU]
  105  33.705741 192.168.14.17 → 192.168.206.153 TCP 66 37538 → 27017 [ACK] Seq=7241 Ack=3116 Win=1163 Len=0 TSval=2013528828 TSecr=4106127863
  106  33.706135 192.168.14.17 → 192.168.206.153 TCP 318 37538 → 27017 [PSH, ACK] Seq=7241 Ack=3116 Win=1163 Len=252 TSval=2013528829 TSecr=4106127863 [TCP segment of a reassembled PDU]
  107  33.706378 192.168.206.153 → 192.168.14.17 TCP 126 27017 → 37538 [PSH, ACK] Seq=3116 Ack=7493 Win=2628 Len=60 TSval=4106127864 TSecr=2013528829 [TCP segment of a reassembled PDU]
  108  33.706557 192.168.14.17 → 192.168.206.153 TCP 66 37538 → 27017 [ACK] Seq=7493 Ack=3176 Win=1163 Len=0 TSval=2013528829 TSecr=4106127864
  109  34.963494 192.168.14.17 → 192.168.206.153 TCP 227 37538 → 27017 [PSH, ACK] Seq=7493 Ack=3176 Win=1163 Len=161 TSval=2013530086 TSecr=4106127864 [TCP segment of a reassembled PDU]
  110  34.965015 192.168.206.153 → 192.168.14.17 TCP 196 27017 → 37538 [PSH, ACK] Seq=3176 Ack=7654 Win=2637 Len=130 TSval=4106129123 TSecr=2013530086 [TCP segment of a reassembled PDU]
  111  34.965222 192.168.14.17 → 192.168.206.153 TCP 66 37538 → 27017 [ACK] Seq=7654 Ack=3306 Win=1171 Len=0 TSval=2013530088 TSecr=4106129123
  112  34.966394 192.168.14.17 → 192.168.206.153 TCP 227 37538 → 27017 [PSH, ACK] Seq=7654 Ack=3306 Win=1171 Len=161 TSval=2013530089 TSecr=4106129123 [TCP segment of a reassembled PDU]
  113  34.967671 192.168.206.153 → 192.168.14.17 SSLv2 196 Encrypted Data, Continuation Data
  114  34.968954 192.168.14.17 → 192.168.206.153 TCP 227 37538 → 27017 [PSH, ACK] Seq=7815 Ack=3436 Win=1180 Len=161 TSval=2013530092 TSecr=4106129125 [TCP segment of a reassembled PDU]
  115  34.970223 192.168.206.153 → 192.168.14.17 TCP 196 [TCP segment of a reassembled PDU]
  116  34.971863 192.168.14.17 → 192.168.206.153 TCP 319 37538 → 27017 [PSH, ACK] Seq=7976 Ack=3566 Win=1188 Len=253 TSval=2013530095 TSecr=4106129128 [TCP segment of a reassembled PDU]
  117  34.972177 192.168.206.153 → 192.168.14.17 TCP 126 27017 → 37538 [PSH, ACK] Seq=3566 Ack=8229 Win=2662 Len=60 TSval=4106129130 TSecr=2013530095 [TCP segment of a reassembled PDU]
  118  34.972487 192.168.14.17 → 192.168.206.153 SSLv2 319 Encrypted Data
  119  34.972720 192.168.206.153 → 192.168.14.17 TCP 126 27017 → 37538 [PSH, ACK] Seq=3626 Ack=8482 Win=2670 Len=60 TSval=4106129130 TSecr=2013530095 [TCP segment of a reassembled PDU]
  120  34.973126 192.168.14.17 → 192.168.206.153 TCP 319 [TCP segment of a reassembled PDU]
  121  34.973349 192.168.206.153 → 192.168.14.17 TCP 126 27017 → 37538 [PSH, ACK] Seq=3686 Ack=8735 Win=2679 Len=60 TSval=4106129131 TSecr=2013530096 [TCP segment of a reassembled PDU]
  122  35.015930 192.168.14.17 → 192.168.206.153 TCP 66 37538 → 27017 [ACK] Seq=8735 Ack=3746 Win=1188 Len=0 TSval=2013530139 TSecr=4106129131
  123  35.160238 192.168.14.17 → 192.168.206.153 TCP 227 37538 → 27017 [PSH, ACK] Seq=8735 Ack=3746 Win=1188 Len=161 TSval=2013530283 TSecr=4106129131 [TCP segment of a reassembled PDU]
  124  35.161704 192.168.206.153 → 192.168.14.17 TCP 196 27017 → 37538 [PSH, ACK] Seq=3746 Ack=8896 Win=2687 Len=130 TSval=4106129319 TSecr=2013530283 [TCP segment of a reassembled PDU]
  125  35.161965 192.168.14.17 → 192.168.206.153 TCP 66 37538 → 27017 [ACK] Seq=8896 Ack=3876 Win=1196 Len=0 TSval=2013530285 TSecr=4106129319
  126  35.162576 192.168.14.17 → 192.168.206.153 TCP 215 37538 → 27017 [PSH, ACK] Seq=8896 Ack=3876 Win=1196 Len=149 TSval=2013530285 TSecr=4106129319 [TCP segment of a reassembled PDU]
  127  35.163122 192.168.206.153 → 192.168.14.17 SSLv2 250 Encrypted Data, Continuation Data
  128  35.163384 192.168.14.17 → 192.168.206.153 TCP 66 37538 → 27017 [ACK] Seq=9045 Ack=4060 Win=1205 Len=0 TSval=2013530286 TSecr=4106129321
  129  35.164141 192.168.14.17 → 192.168.206.153 TCP 319 37538 → 27017 [PSH, ACK] Seq=9045 Ack=4060 Win=1205 Len=253 TSval=2013530287 TSecr=4106129321 [TCP segment of a reassembled PDU]
  130  35.164550 192.168.206.153 → 192.168.14.17 SSL 126 Continuation Data
  131  35.164798 192.168.14.17 → 192.168.206.153 TCP 66 37538 → 27017 [ACK] Seq=9298 Ack=4120 Win=1205 Len=0 TSval=2013530287 TSecr=4106129322
  132  35.220342 192.168.14.17 → 192.168.206.153 TCP 120 37538 → 27017 [PSH, ACK] Seq=9298 Ack=4120 Win=1205 Len=54 TSval=2013530343 TSecr=4106129322 [TCP segment of a reassembled PDU]
  133  35.220592 192.168.206.153 → 192.168.14.17 SSL 119 Continuation Data
  134  35.220837 192.168.14.17 → 192.168.206.153 TCP 66 37538 → 27017 [ACK] Seq=9352 Ack=4173 Win=1205 Len=0 TSval=2013530344 TSecr=4106129378
  135  35.308595 192.168.14.17 → 192.168.206.153 TCP 226 37538 → 27017 [PSH, ACK] Seq=9352 Ack=4173 Win=1205 Len=160 TSval=2013530431 TSecr=4106129378 [TCP segment of a reassembled PDU]
  136  35.310000 192.168.206.153 → 192.168.14.17 TCP 196 [TCP segment of a reassembled PDU]
  137  35.310250 192.168.14.17 → 192.168.206.153 TCP 66 37538 → 27017 [ACK] Seq=9512 Ack=4303 Win=1213 Len=0 TSval=2013530433 TSecr=4106129468
  138  35.311699 192.168.14.17 → 192.168.206.153 TCP 226 37538 → 27017 [PSH, ACK] Seq=9512 Ack=4303 Win=1213 Len=160 TSval=2013530434 TSecr=4106129468 [TCP segment of a reassembled PDU]
  139  35.313007 192.168.206.153 → 192.168.14.17 TCP 196 27017 → 37538 [PSH, ACK] Seq=4303 Ack=9672 Win=2721 Len=130 TSval=4106129471 TSecr=2013530434 [TCP segment of a reassembled PDU]
  140  35.313259 192.168.14.17 → 192.168.206.153 TCP 66 37538 → 27017 [ACK] Seq=9672 Ack=4433 Win=1222 Len=0 TSval=2013530436 TSecr=4106129471
  141  35.314538 192.168.14.17 → 192.168.206.153 TCP 226 37538 → 27017 [PSH, ACK] Seq=9672 Ack=4433 Win=1222 Len=160 TSval=2013530437 TSecr=4106129471 [TCP segment of a reassembled PDU]
  142  35.315781 192.168.206.153 → 192.168.14.17 TCP 196 27017 → 37538 [PSH, ACK] Seq=4433 Ack=9832 Win=2729 Len=130 TSval=4106129474 TSecr=2013530437 [TCP segment of a reassembled PDU]
  143  35.316005 192.168.14.17 → 192.168.206.153 TCP 66 37538 → 27017 [ACK] Seq=9832 Ack=4563 Win=1230 Len=0 TSval=2013530439 TSecr=4106129474
  144  35.317425 192.168.14.17 → 192.168.206.153 TCP 226 37538 → 27017 [PSH, ACK] Seq=9832 Ack=4563 Win=1230 Len=160 TSval=2013530440 TSecr=4106129474 [TCP segment of a reassembled PDU]
  145  35.318822 192.168.206.153 → 192.168.14.17 SSLv2 196 Encrypted Data, Continuation Data
  146  35.319043 192.168.14.17 → 192.168.206.153 TCP 66 37538 → 27017 [ACK] Seq=9992 Ack=4693 Win=1238 Len=0 TSval=2013530442 TSecr=4106129477
  147  35.320913 192.168.14.17 → 192.168.206.153 TCP 317 37538 → 27017 [PSH, ACK] Seq=9992 Ack=4693 Win=1238 Len=251 TSval=2013530444 TSecr=4106129477 [TCP segment of a reassembled PDU]
  148  35.321336 192.168.206.153 → 192.168.14.17 SSL 126 Continuation Data
  149  35.321602 192.168.14.17 → 192.168.206.153 TCP 66 37538 → 27017 [ACK] Seq=10243 Ack=4753 Win=1238 Len=0 TSval=2013530444 TSecr=4106129479
  150  35.321699 192.168.14.17 → 192.168.206.153 TCP 317 37538 → 27017 [PSH, ACK] Seq=10243 Ack=4753 Win=1238 Len=251 TSval=2013530444 TSecr=4106129479 [TCP segment of a reassembled PDU]
  151  35.321939 192.168.206.153 → 192.168.14.17 SSL 126 Continuation Data
  152  35.322183 192.168.14.17 → 192.168.206.153 TCP 66 37538 → 27017 [ACK] Seq=10494 Ack=4813 Win=1238 Len=0 TSval=2013530445 TSecr=4106129480
  153  35.322335 192.168.14.17 → 192.168.206.153 TCP 317 37538 → 27017 [PSH, ACK] Seq=10494 Ack=4813 Win=1238 Len=251 TSval=2013530445 TSecr=4106129480 [TCP segment of a reassembled PDU]
  154  35.322541 192.168.206.153 → 192.168.14.17 SSL 126 Continuation Data
  155  35.322824 192.168.14.17 → 192.168.206.153 TCP 66 37538 → 27017 [ACK] Seq=10745 Ack=4873 Win=1238 Len=0 TSval=2013530446 TSecr=4106129480
  156  35.322987 192.168.14.17 → 192.168.206.153 TCP 317 37538 → 27017 [PSH, ACK] Seq=10745 Ack=4873 Win=1238 Len=251 TSval=2013530446 TSecr=4106129480 [TCP segment of a reassembled PDU]
  157  35.323181 192.168.206.153 → 192.168.14.17 SSL 126 Continuation Data
  158  35.323395 192.168.14.17 → 192.168.206.153 TCP 66 37538 → 27017 [ACK] Seq=10996 Ack=4933 Win=1238 Len=0 TSval=2013530446 TSecr=4106129481
  159  35.817235 192.168.14.17 → 192.168.206.153 TCP 124 37538 → 27017 [PSH, ACK] Seq=10996 Ack=4933 Win=1238 Len=58 TSval=2013530940 TSecr=4106129481 [TCP segment of a reassembled PDU]
  160  35.817535 192.168.206.153 → 192.168.14.17 SSL 385 Continuation Data
  161  35.817772 192.168.14.17 → 192.168.206.153 TCP 66 37538 → 27017 [ACK] Seq=11054 Ack=5252 Win=1247 Len=0 TSval=2013530940 TSecr=4106129975
  162  36.351898 192.168.14.17 → 192.168.206.153 TCP 66 [TCP Dup ACK 9#2] 37522 → 27017 [ACK] Seq=1 Ack=1 Win=1540 Len=0 TSval=2013531475 TSecr=4106115406
  163  36.351911 192.168.206.153 → 192.168.14.17 TCP 66 [TCP Dup ACK 10#2] [TCP ACKed unseen segment] 27017 → 37522 [ACK] Seq=1 Ack=2 Win=3081 Len=0 TSval=4106130510 TSecr=2013244477
  164  37.166388 192.168.14.17 → 192.168.206.153 TCP 227 37538 → 27017 [PSH, ACK] Seq=11054 Ack=5252 Win=1247 Len=161 TSval=2013532289 TSecr=4106129975 [TCP segment of a reassembled PDU]
  165  37.167930 192.168.206.153 → 192.168.14.17 TCP 196 [TCP segment of a reassembled PDU]
  166  37.168162 192.168.14.17 → 192.168.206.153 TCP 66 37538 → 27017 [ACK] Seq=11215 Ack=5382 Win=1255 Len=0 TSval=2013532291 TSecr=4106131326
  167  37.170483 192.168.14.17 → 192.168.206.153 TCP 319 37538 → 27017 [PSH, ACK] Seq=11215 Ack=5382 Win=1255 Len=253 TSval=2013532293 TSecr=4106131326 [TCP segment of a reassembled PDU]
  168  37.170843 192.168.206.153 → 192.168.14.17 TCP 126 27017 → 37538 [PSH, ACK] Seq=5382 Ack=11468 Win=2788 Len=60 TSval=4106131329 TSecr=2013532293 [TCP segment of a reassembled PDU]
  169  37.171184 192.168.14.17 → 192.168.206.153 TCP 319 37538 → 27017 [PSH, ACK] Seq=11468 Ack=5442 Win=1255 Len=253 TSval=2013532294 TSecr=4106131329 [TCP segment of a reassembled PDU]
  170  37.171435 192.168.206.153 → 192.168.14.17 TCP 126 27017 → 37538 [PSH, ACK] Seq=5442 Ack=11721 Win=2796 Len=60 TSval=4106131329 TSecr=2013532294 [TCP segment of a reassembled PDU]
  171  37.171750 192.168.14.17 → 192.168.206.153 TCP 319 37538 → 27017 [PSH, ACK] Seq=11721 Ack=5502 Win=1255 Len=253 TSval=2013532294 TSecr=4106131329 [TCP segment of a reassembled PDU]
  172  37.171957 192.168.206.153 → 192.168.14.17 TCP 126 27017 → 37538 [PSH, ACK] Seq=5502 Ack=11974 Win=2804 Len=60 TSval=4106131330 TSecr=2013532294 [TCP segment of a reassembled PDU]
  173  37.172294 192.168.14.17 → 192.168.206.153 TCP 319 37538 → 27017 [PSH, ACK] Seq=11974 Ack=5562 Win=1255 Len=253 TSval=2013532295 TSecr=4106131330 [TCP segment of a reassembled PDU]
  174  37.172484 192.168.206.153 → 192.168.14.17 TCP 126 27017 → 37538 [PSH, ACK] Seq=5562 Ack=12227 Win=2813 Len=60 TSval=4106131330 TSecr=2013532295 [TCP segment of a reassembled PDU]
  175  37.215856 192.168.14.17 → 192.168.206.153 TCP 66 37538 → 27017 [ACK] Seq=12227 Ack=5622 Win=1255 Len=0 TSval=2013532339 TSecr=4106131330
  176  37.575627 192.168.14.17 → 192.168.206.153 TCP 318 37538 → 27017 [PSH, ACK] Seq=12227 Ack=5622 Win=1255 Len=252 TSval=2013532698 TSecr=4106131330 [TCP segment of a reassembled PDU]
  177  37.576124 192.168.206.153 → 192.168.14.17 TCP 126 27017 → 37538 [PSH, ACK] Seq=5622 Ack=12479 Win=2821 Len=60 TSval=4106131734 TSecr=2013532698 [TCP segment of a reassembled PDU]
  178  37.576334 192.168.14.17 → 192.168.206.153 TCP 66 37538 → 27017 [ACK] Seq=12479 Ack=5682 Win=1255 Len=0 TSval=2013532699 TSecr=4106131734
  179  37.576552 192.168.14.17 → 192.168.206.153 TCP 318 37538 → 27017 [PSH, ACK] Seq=12479 Ack=5682 Win=1255 Len=252 TSval=2013532699 TSecr=4106131734 [TCP segment of a reassembled PDU]
  180  37.576800 192.168.206.153 → 192.168.14.17 TCP 126 27017 → 37538 [PSH, ACK] Seq=5682 Ack=12731 Win=2829 Len=60 TSval=4106131735 TSecr=2013532699 [TCP segment of a reassembled PDU]
  181  37.576981 192.168.14.17 → 192.168.206.153 TCP 66 37538 → 27017 [ACK] Seq=12731 Ack=5742 Win=1255 Len=0 TSval=2013532700 TSecr=4106131735
  182  37.577129 192.168.14.17 → 192.168.206.153 TCP 318 37538 → 27017 [PSH, ACK] Seq=12731 Ack=5742 Win=1255 Len=252 TSval=2013532700 TSecr=4106131735 [TCP segment of a reassembled PDU]
  183  37.577339 192.168.206.153 → 192.168.14.17 SSLv2 126 Encrypted Data, Continuation Data
  184  37.577518 192.168.14.17 → 192.168.206.153 TCP 66 37538 → 27017 [ACK] Seq=12983 Ack=5802 Win=1255 Len=0 TSval=2013532700 TSecr=4106131735
  185  37.577657 192.168.14.17 → 192.168.206.153 TCP 318 37538 → 27017 [PSH, ACK] Seq=12983 Ack=5802 Win=1255 Len=252 TSval=2013532700 TSecr=4106131735 [TCP segment of a reassembled PDU]
  186  37.577860 192.168.206.153 → 192.168.14.17 SSL 126 Continuation Data
  187  37.578038 192.168.14.17 → 192.168.206.153 TCP 66 37538 → 27017 [ACK] Seq=13235 Ack=5862 Win=1255 Len=0 TSval=2013532701 TSecr=4106131736
  188  37.578153 192.168.14.17 → 192.168.206.153 TCP 318 37538 → 27017 [PSH, ACK] Seq=13235 Ack=5862 Win=1255 Len=252 TSval=2013532701 TSecr=4106131736 [TCP segment of a reassembled PDU]
  189  37.578344 192.168.206.153 → 192.168.14.17 SSL 126 Continuation Data
  190  37.578517 192.168.14.17 → 192.168.206.153 TCP 66 37538 → 27017 [ACK] Seq=13487 Ack=5922 Win=1255 Len=0 TSval=2013532701 TSecr=4106131736
  191  37.914421 192.168.14.17 → 192.168.206.153 TCP 319 37538 → 27017 [PSH, ACK] Seq=13487 Ack=5922 Win=1255 Len=253 TSval=2013533037 TSecr=4106131736 [TCP segment of a reassembled PDU]
  192  37.914959 192.168.206.153 → 192.168.14.17 SSL 126 Continuation Data
  193  37.915305 192.168.14.17 → 192.168.206.153 TCP 66 37538 → 27017 [ACK] Seq=13740 Ack=5982 Win=1255 Len=0 TSval=2013533038 TSecr=4106132073
  194  37.915422 192.168.14.17 → 192.168.206.153 TCP 319 37538 → 27017 [PSH, ACK] Seq=13740 Ack=5982 Win=1255 Len=253 TSval=2013533038 TSecr=4106132073 [TCP segment of a reassembled PDU]
  195  37.915688 192.168.206.153 → 192.168.14.17 SSL 126 Continuation Data
  196  37.915904 192.168.14.17 → 192.168.206.153 TCP 66 37538 → 27017 [ACK] Seq=13993 Ack=6042 Win=1255 Len=0 TSval=2013533039 TSecr=4106132073
  197  41.648729 192.168.14.17 → 192.168.206.153 TCP 227 37538 → 27017 [PSH, ACK] Seq=13993 Ack=6042 Win=1255 Len=161 TSval=2013536771 TSecr=4106132073 [TCP segment of a reassembled PDU]
  198  41.650325 192.168.206.153 → 192.168.14.17 TCP 196 [TCP segment of a reassembled PDU]
  199  41.650667 192.168.14.17 → 192.168.206.153 TCP 66 37538 → 27017 [ACK] Seq=14154 Ack=6172 Win=1263 Len=0 TSval=2013536773 TSecr=4106135808
  200  41.651859 192.168.14.17 → 192.168.206.153 TCP 227 37538 → 27017 [PSH, ACK] Seq=14154 Ack=6172 Win=1263 Len=161 TSval=2013536775 TSecr=4106135808 [TCP segment of a reassembled PDU]
  201  41.653066 192.168.206.153 → 192.168.14.17 TCP 196 27017 → 37538 [PSH, ACK] Seq=6172 Ack=14315 Win=2888 Len=130 TSval=4106135811 TSecr=2013536775 [TCP segment of a reassembled PDU]
  202  41.653450 192.168.14.17 → 192.168.206.153 TCP 66 37538 → 27017 [ACK] Seq=14315 Ack=6302 Win=1272 Len=0 TSval=2013536776 TSecr=4106135811
  203  41.654670 192.168.14.17 → 192.168.206.153 TCP 227 37538 → 27017 [PSH, ACK] Seq=14315 Ack=6302 Win=1272 Len=161 TSval=2013536777 TSecr=4106135811 [TCP segment of a reassembled PDU]
  204  41.655868 192.168.206.153 → 192.168.14.17 TCP 196 27017 → 37538 [PSH, ACK] Seq=6302 Ack=14476 Win=2896 Len=130 TSval=4106135814 TSecr=2013536777 [TCP segment of a reassembled PDU]
  205  41.656190 192.168.14.17 → 192.168.206.153 TCP 66 37538 → 27017 [ACK] Seq=14476 Ack=6432 Win=1280 Len=0 TSval=2013536779 TSecr=4106135814
  206  41.657614 192.168.14.17 → 192.168.206.153 TCP 319 37538 → 27017 [PSH, ACK] Seq=14476 Ack=6432 Win=1280 Len=253 TSval=2013536780 TSecr=4106135814 [TCP segment of a reassembled PDU]
  207  41.657957 192.168.206.153 → 192.168.14.17 TCP 126 27017 → 37538 [PSH, ACK] Seq=6432 Ack=14729 Win=2905 Len=60 TSval=4106135816 TSecr=2013536780 [TCP segment of a reassembled PDU]
  208  41.658143 192.168.14.17 → 192.168.206.153 TCP 66 37538 → 27017 [ACK] Seq=14729 Ack=6492 Win=1280 Len=0 TSval=2013536781 TSecr=4106135816
  209  41.658253 192.168.14.17 → 192.168.206.153 TCP 319 37538 → 27017 [PSH, ACK] Seq=14729 Ack=6492 Win=1280 Len=253 TSval=2013536781 TSecr=4106135816 [TCP segment of a reassembled PDU]
  210  41.658468 192.168.206.153 → 192.168.14.17 TCP 126 27017 → 37538 [PSH, ACK] Seq=6492 Ack=14982 Win=2913 Len=60 TSval=4106135816 TSecr=2013536781 [TCP segment of a reassembled PDU]
  211  41.658639 192.168.14.17 → 192.168.206.153 TCP 66 37538 → 27017 [ACK] Seq=14982 Ack=6552 Win=1280 Len=0 TSval=2013536781 TSecr=4106135816
  212  41.658862 192.168.14.17 → 192.168.206.153 TCP 319 37538 → 27017 [PSH, ACK] Seq=14982 Ack=6552 Win=1280 Len=253 TSval=2013536782 TSecr=4106135816 [TCP segment of a reassembled PDU]
  213  41.659058 192.168.206.153 → 192.168.14.17 SSLv2 126 Encrypted Data, Continuation Data
  214  41.659229 192.168.14.17 → 192.168.206.153 TCP 66 37538 → 27017 [ACK] Seq=15235 Ack=6612 Win=1280 Len=0 TSval=2013536782 TSecr=4106135817
  215  45.219411 192.168.14.17 → 192.168.206.153 TCP 227 37538 → 27017 [PSH, ACK] Seq=15235 Ack=6612 Win=1280 Len=161 TSval=2013540342 TSecr=4106135817 [TCP segment of a reassembled PDU]
  216  45.220898 192.168.206.153 → 192.168.14.17 TCP 196 [TCP segment of a reassembled PDU]
  217  45.221091 192.168.14.17 → 192.168.206.153 TCP 66 37538 → 27017 [ACK] Seq=15396 Ack=6742 Win=1289 Len=0 TSval=2013540344 TSecr=4106139379
  218  45.222340 192.168.14.17 → 192.168.206.153 TCP 227 37538 → 27017 [PSH, ACK] Seq=15396 Ack=6742 Win=1289 Len=161 TSval=2013540345 TSecr=4106139379 [TCP segment of a reassembled PDU]
  219  45.223595 192.168.206.153 → 192.168.14.17 TCP 196 27017 → 37538 [PSH, ACK] Seq=6742 Ack=15557 Win=2938 Len=130 TSval=4106139381 TSecr=2013540345 [TCP segment of a reassembled PDU]
  220  45.227585 192.168.14.17 → 192.168.206.153 TCP 317 37538 → 27017 [PSH, ACK] Seq=15557 Ack=6872 Win=1297 Len=251 TSval=2013540350 TSecr=4106139381 [TCP segment of a reassembled PDU]
  221  45.227997 192.168.206.153 → 192.168.14.17 TCP 126 27017 → 37538 [PSH, ACK] Seq=6872 Ack=15808 Win=2947 Len=60 TSval=4106139386 TSecr=2013540350 [TCP segment of a reassembled PDU]
  222  45.228314 192.168.14.17 → 192.168.206.153 TCP 317 37538 → 27017 [PSH, ACK] Seq=15808 Ack=6932 Win=1297 Len=251 TSval=2013540351 TSecr=4106139386 [TCP segment of a reassembled PDU]
  223  45.228697 192.168.206.153 → 192.168.14.17 TCP 126 27017 → 37538 [PSH, ACK] Seq=6932 Ack=16059 Win=2955 Len=60 TSval=4106139386 TSecr=2013540351 [TCP segment of a reassembled PDU]
  224  45.229125 192.168.14.17 → 192.168.206.153 TCP 317 37538 → 27017 [PSH, ACK] Seq=16059 Ack=6992 Win=1297 Len=251 TSval=2013540352 TSecr=4106139386 [TCP segment of a reassembled PDU]
  225  45.229356 192.168.206.153 → 192.168.14.17 TCP 126 27017 → 37538 [PSH, ACK] Seq=6992 Ack=16310 Win=2963 Len=60 TSval=4106139387 TSecr=2013540352 [TCP segment of a reassembled PDU]
  226  45.229734 192.168.14.17 → 192.168.206.153 TCP 317 37538 → 27017 [PSH, ACK] Seq=16310 Ack=7052 Win=1297 Len=251 TSval=2013540352 TSecr=4106139387 [TCP segment of a reassembled PDU]
  227  45.229949 192.168.206.153 → 192.168.14.17 TCP 126 27017 → 37538 [PSH, ACK] Seq=7052 Ack=16561 Win=2972 Len=60 TSval=4106139388 TSecr=2013540352 [TCP segment of a reassembled PDU]
  228  45.271973 192.168.14.17 → 192.168.206.153 TCP 66 37538 → 27017 [ACK] Seq=16561 Ack=7112 Win=1297 Len=0 TSval=2013540395 TSecr=4106139388
  229  45.315847 192.168.14.17 → 192.168.206.153 TCP 66 [TCP Dup ACK 1#3] 37512 → 27017 [ACK] Seq=1 Ack=1 Win=504 Len=0 TSval=2013540439 TSecr=4106124366
  230  45.315857 192.168.206.153 → 192.168.14.17 TCP 66 [TCP Dup ACK 2#3] [TCP ACKed unseen segment] 27017 → 37512 [ACK] Seq=1 Ack=2 Win=501 Len=0 TSval=4106139474 TSecr=2013267389
  231  45.417687 192.168.14.17 → 192.168.206.153 TCP 226 37538 → 27017 [PSH, ACK] Seq=16561 Ack=7112 Win=1297 Len=160 TSval=2013540540 TSecr=4106139388 [TCP segment of a reassembled PDU]
  232  45.419271 192.168.206.153 → 192.168.14.17 SSLv2 196 Encrypted Data, Continuation Data
  233  45.419495 192.168.14.17 → 192.168.206.153 TCP 66 37538 → 27017 [ACK] Seq=16721 Ack=7242 Win=1305 Len=0 TSval=2013540542 TSecr=4106139577
  234  45.420142 192.168.14.17 → 192.168.206.153 TCP 214 37538 → 27017 [PSH, ACK] Seq=16721 Ack=7242 Win=1305 Len=148 TSval=2013540543 TSecr=4106139577 [TCP segment of a reassembled PDU]
  235  45.420640 192.168.206.153 → 192.168.14.17 TCP 249 [TCP segment of a reassembled PDU]
  236  45.420855 192.168.14.17 → 192.168.206.153 TCP 66 37538 → 27017 [ACK] Seq=16869 Ack=7425 Win=1314 Len=0 TSval=2013540544 TSecr=4106139578
  237  45.421785 192.168.14.17 → 192.168.206.153 TCP 226 37538 → 27017 [PSH, ACK] Seq=16869 Ack=7425 Win=1314 Len=160 TSval=2013540544 TSecr=4106139578 [TCP segment of a reassembled PDU]
  238  45.423620 192.168.206.153 → 192.168.14.17 TCP 196 27017 → 37538 [PSH, ACK] Seq=7425 Ack=17029 Win=2997 Len=130 TSval=4106139581 TSecr=2013540544 [TCP segment of a reassembled PDU]
  239  45.423814 192.168.14.17 → 192.168.206.153 TCP 66 37538 → 27017 [ACK] Seq=17029 Ack=7555 Win=1322 Len=0 TSval=2013540547 TSecr=4106139581
  240  45.424882 192.168.14.17 → 192.168.206.153 TCP 226 37538 → 27017 [PSH, ACK] Seq=17029 Ack=7555 Win=1322 Len=160 TSval=2013540548 TSecr=4106139581 [TCP segment of a reassembled PDU]
  241  45.426226 192.168.206.153 → 192.168.14.17 TCP 196 27017 → 37538 [PSH, ACK] Seq=7555 Ack=17189 Win=3005 Len=130 TSval=4106139584 TSecr=2013540548 [TCP segment of a reassembled PDU]
  242  45.426416 192.168.14.17 → 192.168.206.153 TCP 66 37538 → 27017 [ACK] Seq=17189 Ack=7685 Win=1330 Len=0 TSval=2013540549 TSecr=4106139584
  243  45.427438 192.168.14.17 → 192.168.206.153 TCP 226 37538 → 27017 [PSH, ACK] Seq=17189 Ack=7685 Win=1330 Len=160 TSval=2013540550 TSecr=4106139584 [TCP segment of a reassembled PDU]
  244  45.428622 192.168.206.153 → 192.168.14.17 TCP 196 27017 → 37538 [PSH, ACK] Seq=7685 Ack=17349 Win=3014 Len=130 TSval=4106139586 TSecr=2013540550 [TCP segment of a reassembled PDU]
  245  45.428827 192.168.14.17 → 192.168.206.153 TCP 66 37538 → 27017 [ACK] Seq=17349 Ack=7815 Win=1339 Len=0 TSval=2013540552 TSecr=4106139586
  246  45.429872 192.168.14.17 → 192.168.206.153 TCP 226 37538 → 27017 [PSH, ACK] Seq=17349 Ack=7815 Win=1339 Len=160 TSval=2013540553 TSecr=4106139586 [TCP segment of a reassembled PDU]
  247  45.431044 192.168.206.153 → 192.168.14.17 TCP 196 27017 → 37538 [PSH, ACK] Seq=7815 Ack=17509 Win=3022 Len=130 TSval=4106139589 TSecr=2013540553 [TCP segment of a reassembled PDU]
  248  45.431432 192.168.14.17 → 192.168.206.153 TCP 66 37538 → 27017 [ACK] Seq=17509 Ack=7945 Win=1347 Len=0 TSval=2013540554 TSecr=4106139589
  249  45.433343 192.168.14.17 → 192.168.206.153 TCP 318 37538 → 27017 [PSH, ACK] Seq=17509 Ack=7945 Win=1347 Len=252 TSval=2013540556 TSecr=4106139589 [TCP segment of a reassembled PDU]
  250  45.433674 192.168.206.153 → 192.168.14.17 TCP 126 27017 → 37538 [PSH, ACK] Seq=7945 Ack=17761 Win=3030 Len=60 TSval=4106139591 TSecr=2013540556 [TCP segment of a reassembled PDU]
  251  45.433883 192.168.14.17 → 192.168.206.153 TCP 66 37538 → 27017 [ACK] Seq=17761 Ack=8005 Win=1347 Len=0 TSval=2013540557 TSecr=4106139591
  252  45.433990 192.168.14.17 → 192.168.206.153 TCP 318 37538 → 27017 [PSH, ACK] Seq=17761 Ack=8005 Win=1347 Len=252 TSval=2013540557 TSecr=4106139591 [TCP segment of a reassembled PDU]
  253  45.434213 192.168.206.153 → 192.168.14.17 TCP 126 27017 → 37538 [PSH, ACK] Seq=8005 Ack=18013 Win=3039 Len=60 TSval=4106139592 TSecr=2013540557 [TCP segment of a reassembled PDU]
  254  45.434419 192.168.14.17 → 192.168.206.153 TCP 66 37538 → 27017 [ACK] Seq=18013 Ack=8065 Win=1347 Len=0 TSval=2013540557 TSecr=4106139592
