    1   0.000000 192.168.206.150 → 192.168.206.151 TCP 66 41368 → 27017 [ACK] Seq=1 Ack=1 Win=504 Len=0 TSval=4272359975 TSecr=7381879
    2   0.000018 192.168.206.151 → 192.168.206.150 TCP 66 [TCP ACKed unseen segment] 27017 → 41368 [ACK] Seq=1 Ack=2 Win=501 Len=0 TSval=7396983 TSecr=4272103463
    3   0.511995 192.168.206.150 → 192.168.206.151 TCP 66 41392 → 27017 [ACK] Seq=1 Ack=1 Win=501 Len=0 TSval=4272360487 TSecr=7382391
    4   0.512010 192.168.206.151 → 192.168.206.150 TCP 66 [TCP ACKed unseen segment] 27017 → 41392 [ACK] Seq=1 Ack=2 Win=502 Len=0 TSval=7397495 TSecr=4272168999
    5   4.607998 192.168.206.150 → 192.168.206.151 TCP 66 41390 → 27017 [ACK] Seq=1 Ack=1 Win=501 Len=0 TSval=4272364583 TSecr=7386488
    6   4.608016 192.168.206.151 → 192.168.206.150 TCP 66 [TCP ACKed unseen segment] 27017 → 41390 [ACK] Seq=1 Ack=2 Win=502 Len=0 TSval=7401591 TSecr=4272201767
    7   5.101394 192.168.206.150 → 192.168.206.151 SSL 120 Continuation Data
    8   5.101679 192.168.206.151 → 192.168.206.150 SSL 119 Continuation Data
    9   5.101777 192.168.206.150 → 192.168.206.151 TCP 66 41388 → 27017 [ACK] Seq=55 Ack=54 Win=501 Len=0 TSval=4272365077 TSecr=7402085
   10   8.704009 192.168.206.150 → 192.168.206.151 TCP 66 41396 → 27017 [ACK] Seq=1 Ack=1 Win=501 Len=0 TSval=4272368679 TSecr=7390583
   11   8.704038 192.168.206.151 → 192.168.206.150 TCP 66 [TCP ACKed unseen segment] 27017 → 41396 [ACK] Seq=1 Ack=2 Win=502 Len=0 TSval=7405687 TSecr=4272136231
   12   8.704020 192.168.206.150 → 192.168.206.151 TCP 66 41394 → 27017 [ACK] Seq=1 Ack=1 Win=501 Len=0 TSval=4272368679 TSecr=7390583
   13   8.704046 192.168.206.151 → 192.168.206.150 TCP 66 [TCP ACKed unseen segment] 27017 → 41394 [ACK] Seq=1 Ack=2 Win=502 Len=0 TSval=7405688 TSecr=4272136231
   14  15.104017 192.168.206.150 → 192.168.206.151 TCP 66 [TCP Dup ACK 1#1] 41368 → 27017 [ACK] Seq=1 Ack=1 Win=504 Len=0 TSval=4272375079 TSecr=7396983
   15  15.104037 192.168.206.151 → 192.168.206.150 TCP 66 [TCP Dup ACK 2#1] [TCP ACKed unseen segment] 27017 → 41368 [ACK] Seq=1 Ack=2 Win=501 Len=0 TSval=7412087 TSecr=4272103463
   16  15.615998 192.168.206.150 → 192.168.206.151 TCP 66 [TCP Dup ACK 3#1] 41392 → 27017 [ACK] Seq=1 Ack=1 Win=501 Len=0 TSval=4272375591 TSecr=7397495
   17  15.616011 192.168.206.151 → 192.168.206.150 TCP 66 [TCP Dup ACK 4#1] [TCP ACKed unseen segment] 27017 → 41392 [ACK] Seq=1 Ack=2 Win=502 Len=0 TSval=7412599 TSecr=4272168999
   18  19.711966 192.168.206.150 → 192.168.206.151 TCP 66 [TCP Dup ACK 5#1] 41390 → 27017 [ACK] Seq=1 Ack=1 Win=501 Len=0 TSval=4272379687 TSecr=7401591
   19  19.711984 192.168.206.151 → 192.168.206.150 TCP 66 [TCP Dup ACK 6#1] [TCP ACKed unseen segment] 27017 → 41390 [ACK] Seq=1 Ack=2 Win=502 Len=0 TSval=7416695 TSecr=4272201767
   20  20.102174 192.168.206.150 → 192.168.206.151 SSL 120 Continuation Data
   21  20.102427 192.168.206.151 → 192.168.206.150 SSL 119 Continuation Data
   22  20.102501 192.168.206.150 → 192.168.206.151 TCP 66 41388 → 27017 [ACK] Seq=109 Ack=107 Win=501 Len=0 TSval=4272380078 TSecr=7417086
   23  20.758722 192.168.206.150 → 192.168.206.151 SSL 124 Continuation Data
   24  20.759118 192.168.206.151 → 192.168.206.150 SSL 385 Continuation Data
   25  20.759207 192.168.206.150 → 192.168.206.151 TCP 66 41388 → 27017 [ACK] Seq=167 Ack=426 Win=501 Len=0 TSval=4272380735 TSecr=7417743
   26  23.808008 192.168.206.150 → 192.168.206.151 TCP 66 [TCP Dup ACK 12#1] 41394 → 27017 [ACK] Seq=1 Ack=1 Win=501 Len=0 TSval=4272383783 TSecr=7405688
   27  23.808036 192.168.206.151 → 192.168.206.150 TCP 66 [TCP Dup ACK 13#1] [TCP ACKed unseen segment] 27017 → 41394 [ACK] Seq=1 Ack=2 Win=502 Len=0 TSval=7420791 TSecr=4272136231
   28  23.808019 192.168.206.150 → 192.168.206.151 TCP 66 [TCP Dup ACK 10#1] 41396 → 27017 [ACK] Seq=1 Ack=1 Win=501 Len=0 TSval=4272383783 TSecr=7405687
   29  23.808044 192.168.206.151 → 192.168.206.150 TCP 66 [TCP Dup ACK 11#1] [TCP ACKed unseen segment] 27017 → 41396 [ACK] Seq=1 Ack=2 Win=502 Len=0 TSval=7420792 TSecr=4272136231
   30  30.208001 192.168.206.150 → 192.168.206.151 TCP 66 [TCP Dup ACK 1#2] 41368 → 27017 [ACK] Seq=1 Ack=1 Win=504 Len=0 TSval=4272390183 TSecr=7412087
   31  30.208020 192.168.206.151 → 192.168.206.150 TCP 66 [TCP Dup ACK 2#2] [TCP ACKed unseen segment] 27017 → 41368 [ACK] Seq=1 Ack=2 Win=501 Len=0 TSval=7427191 TSecr=4272103463
   32  30.723952 192.168.206.150 → 192.168.206.151 TCP 66 [TCP Dup ACK 3#2] 41392 → 27017 [ACK] Seq=1 Ack=1 Win=501 Len=0 TSval=4272390699 TSecr=7412599
   33  30.723969 192.168.206.151 → 192.168.206.150 TCP 66 [TCP Dup ACK 4#2] [TCP ACKed unseen segment] 27017 → 41392 [ACK] Seq=1 Ack=2 Win=502 Len=0 TSval=7427707 TSecr=4272168999
   34  34.816028 192.168.206.150 → 192.168.206.151 TCP 66 [TCP Dup ACK 5#2] 41390 → 27017 [ACK] Seq=1 Ack=1 Win=501 Len=0 TSval=4272394791 TSecr=7416695
   35  34.816052 192.168.206.151 → 192.168.206.150 TCP 66 [TCP Dup ACK 6#2] [TCP ACKed unseen segment] 27017 → 41390 [ACK] Seq=1 Ack=2 Win=502 Len=0 TSval=7431800 TSecr=4272201767
   36  35.102805 192.168.206.150 → 192.168.206.151 SSL 120 Continuation Data
   37  35.103037 192.168.206.151 → 192.168.206.150 SSL 119 Continuation Data
   38  35.103099 192.168.206.150 → 192.168.206.151 TCP 66 41388 → 27017 [ACK] Seq=221 Ack=479 Win=501 Len=0 TSval=4272395079 TSecr=7432086
   39  38.912004 192.168.206.150 → 192.168.206.151 TCP 66 [TCP Dup ACK 10#2] 41396 → 27017 [ACK] Seq=1 Ack=1 Win=501 Len=0 TSval=4272398887 TSecr=7420792
   40  38.912033 192.168.206.151 → 192.168.206.150 TCP 66 [TCP Dup ACK 11#2] [TCP ACKed unseen segment] 27017 → 41396 [ACK] Seq=1 Ack=2 Win=502 Len=0 TSval=7435895 TSecr=4272136231
   41  38.912016 192.168.206.150 → 192.168.206.151 TCP 66 [TCP Dup ACK 12#2] 41394 → 27017 [ACK] Seq=1 Ack=1 Win=501 Len=0 TSval=4272398887 TSecr=7420791
   42  38.912042 192.168.206.151 → 192.168.206.150 TCP 66 [TCP Dup ACK 13#2] [TCP ACKed unseen segment] 27017 → 41394 [ACK] Seq=1 Ack=2 Win=502 Len=0 TSval=7435896 TSecr=4272136231
   43  45.316012 192.168.206.150 → 192.168.206.151 TCP 66 [TCP Dup ACK 1#3] 41368 → 27017 [ACK] Seq=1 Ack=1 Win=504 Len=0 TSval=4272405291 TSecr=7427191
   44  45.316031 192.168.206.151 → 192.168.206.150 TCP 66 [TCP Dup ACK 2#3] [TCP ACKed unseen segment] 27017 → 41368 [ACK] Seq=1 Ack=2 Win=501 Len=0 TSval=7442299 TSecr=4272103463
   45  45.823988 192.168.206.150 → 192.168.206.151 TCP 66 [TCP Dup ACK 3#3] 41392 → 27017 [ACK] Seq=1 Ack=1 Win=501 Len=0 TSval=4272405799 TSecr=7427707
   46  45.824013 192.168.206.151 → 192.168.206.150 TCP 66 [TCP Dup ACK 4#3] [TCP ACKed unseen segment] 27017 → 41392 [ACK] Seq=1 Ack=2 Win=502 Len=0 TSval=7442807 TSecr=4272168999
   47  49.923948 192.168.206.150 → 192.168.206.151 TCP 66 [TCP Dup ACK 5#3] 41390 → 27017 [ACK] Seq=1 Ack=1 Win=501 Len=0 TSval=4272409899 TSecr=7431800
   48  49.923966 192.168.206.151 → 192.168.206.150 TCP 66 [TCP Dup ACK 6#3] [TCP ACKed unseen segment] 27017 → 41390 [ACK] Seq=1 Ack=2 Win=502 Len=0 TSval=7446907 TSecr=4272201767
   49  50.103633 192.168.206.150 → 192.168.206.151 SSL 120 Continuation Data
   50  50.103900 192.168.206.151 → 192.168.206.150 SSL 119 Continuation Data
   51  50.103995 192.168.206.150 → 192.168.206.151 TCP 66 41388 → 27017 [ACK] Seq=275 Ack=532 Win=501 Len=0 TSval=4272410079 TSecr=7447087
   52  51.262939 192.168.206.150 → 192.168.206.151 SSL 124 Continuation Data
   53  51.263232 192.168.206.151 → 192.168.206.150 SSL 385 Continuation Data
   54  51.263311 192.168.206.150 → 192.168.206.151 TCP 66 41388 → 27017 [ACK] Seq=333 Ack=851 Win=501 Len=0 TSval=4272411239 TSecr=7448247
   55  54.015953 192.168.206.150 → 192.168.206.151 TCP 66 [TCP Dup ACK 12#3] 41394 → 27017 [ACK] Seq=1 Ack=1 Win=501 Len=0 TSval=4272413991 TSecr=7435896
   56  54.015982 192.168.206.151 → 192.168.206.150 TCP 66 [TCP Dup ACK 13#3] [TCP ACKed unseen segment] 27017 → 41394 [ACK] Seq=1 Ack=2 Win=502 Len=0 TSval=7450999 TSecr=4272136231
   57  54.015965 192.168.206.150 → 192.168.206.151 TCP 66 [TCP Dup ACK 10#3] 41396 → 27017 [ACK] Seq=1 Ack=1 Win=501 Len=0 TSval=4272413991 TSecr=7435895
   58  54.015991 192.168.206.151 → 192.168.206.150 TCP 66 [TCP Dup ACK 11#3] [TCP ACKed unseen segment] 27017 → 41396 [ACK] Seq=1 Ack=2 Win=502 Len=0 TSval=7450999 TSecr=4272136231
   59  54.783931 192.168.206.151 → 192.168.206.150 TCP 66 [TCP Keep-Alive] [TCP ACKed unseen segment] 27017 → 41368 [ACK] Seq=0 Ack=2 Win=501 Len=0 TSval=7451767 TSecr=4272103463
   60  54.784019 192.168.206.150 → 192.168.206.151 TCP 66 [TCP Previous segment not captured] 41368 → 27017 [ACK] Seq=2 Ack=1 Win=504 Len=0 TSval=4272414759 TSecr=7442299
   61  60.415992 192.168.206.150 → 192.168.206.151 TCP 66 [TCP Keep-Alive] 41368 → 27017 [ACK] Seq=1 Ack=1 Win=504 Len=0 TSval=4272420391 TSecr=7442299
   62  60.416010 192.168.206.151 → 192.168.206.150 TCP 66 [TCP Keep-Alive ACK] 27017 → 41368 [ACK] Seq=1 Ack=2 Win=501 Len=0 TSval=7457399 TSecr=4272414759
   63  60.927988 192.168.206.150 → 192.168.206.151 TCP 66 [TCP Dup ACK 3#4] 41392 → 27017 [ACK] Seq=1 Ack=1 Win=501 Len=0 TSval=4272420903 TSecr=7442807
   64  60.928003 192.168.206.151 → 192.168.206.150 TCP 66 [TCP Dup ACK 4#4] [TCP ACKed unseen segment] 27017 → 41392 [ACK] Seq=1 Ack=2 Win=502 Len=0 TSval=7457911 TSecr=4272168999
   65  65.023939 192.168.206.150 → 192.168.206.151 TCP 66 [TCP Dup ACK 5#4] 41390 → 27017 [ACK] Seq=1 Ack=1 Win=501 Len=0 TSval=4272424999 TSecr=7446907
   66  65.023956 192.168.206.151 → 192.168.206.150 TCP 66 [TCP Dup ACK 6#4] [TCP ACKed unseen segment] 27017 → 41390 [ACK] Seq=1 Ack=2 Win=502 Len=0 TSval=7462007 TSecr=4272201767
   67  65.104612 192.168.206.150 → 192.168.206.151 SSL 120 Continuation Data
   68  65.104905 192.168.206.151 → 192.168.206.150 SSL 119 Continuation Data
   69  65.104984 192.168.206.150 → 192.168.206.151 TCP 66 41388 → 27017 [ACK] Seq=387 Ack=904 Win=501 Len=0 TSval=4272425080 TSecr=7462088
   70  69.119953 192.168.206.150 → 192.168.206.151 TCP 66 [TCP Dup ACK 10#4] 41396 → 27017 [ACK] Seq=1 Ack=1 Win=501 Len=0 TSval=4272429095 TSecr=7450999
   71  69.119982 192.168.206.151 → 192.168.206.150 TCP 66 [TCP Dup ACK 11#4] [TCP ACKed unseen segment] 27017 → 41396 [ACK] Seq=1 Ack=2 Win=502 Len=0 TSval=7466103 TSecr=4272136231
   72  69.119966 192.168.206.150 → 192.168.206.151 TCP 66 [TCP Dup ACK 12#4] 41394 → 27017 [ACK] Seq=1 Ack=1 Win=501 Len=0 TSval=4272429095 TSecr=7450999
   73  69.119991 192.168.206.151 → 192.168.206.150 TCP 66 [TCP Dup ACK 13#4] [TCP ACKed unseen segment] 27017 → 41394 [ACK] Seq=1 Ack=2 Win=502 Len=0 TSval=7466103 TSecr=4272136231
   74  75.523934 192.168.206.150 → 192.168.206.151 TCP 66 [TCP Keep-Alive] 41368 → 27017 [ACK] Seq=1 Ack=1 Win=504 Len=0 TSval=4272435499 TSecr=7457399
   75  75.523951 192.168.206.151 → 192.168.206.150 TCP 66 [TCP Keep-Alive ACK] 27017 → 41368 [ACK] Seq=1 Ack=2 Win=501 Len=0 TSval=7472507 TSecr=4272414759
   76  76.032026 192.168.206.150 → 192.168.206.151 TCP 66 [TCP Dup ACK 3#5] 41392 → 27017 [ACK] Seq=1 Ack=1 Win=501 Len=0 TSval=4272436007 TSecr=7457911
   77  76.032044 192.168.206.151 → 192.168.206.150 TCP 66 [TCP Dup ACK 4#5] [TCP ACKed unseen segment] 27017 → 41392 [ACK] Seq=1 Ack=2 Win=502 Len=0 TSval=7473015 TSecr=4272168999
   78  80.105698 192.168.206.150 → 192.168.206.151 SSL 120 Continuation Data
   79  80.105945 192.168.206.151 → 192.168.206.150 SSL 119 Continuation Data
   80  80.106037 192.168.206.150 → 192.168.206.151 TCP 66 41388 → 27017 [ACK] Seq=441 Ack=957 Win=501 Len=0 TSval=4272440081 TSecr=7477089
   81  80.128034 192.168.206.150 → 192.168.206.151 TCP 66 [TCP Dup ACK 5#5] 41390 → 27017 [ACK] Seq=1 Ack=1 Win=501 Len=0 TSval=4272440103 TSecr=7462007
   82  80.128053 192.168.206.151 → 192.168.206.150 TCP 66 [TCP Dup ACK 6#5] [TCP ACKed unseen segment] 27017 → 41390 [ACK] Seq=1 Ack=2 Win=502 Len=0 TSval=7477112 TSecr=4272201767
   83  81.767835 192.168.206.150 → 192.168.206.151 SSL 124 Continuation Data
   84  81.768174 192.168.206.151 → 192.168.206.150 SSL 385 Continuation Data
   85  81.768255 192.168.206.150 → 192.168.206.151 TCP 66 41388 → 27017 [ACK] Seq=499 Ack=1276 Win=501 Len=0 TSval=4272441744 TSecr=7478752
   86  84.223950 192.168.206.150 → 192.168.206.151 TCP 66 [TCP Dup ACK 12#5] 41394 → 27017 [ACK] Seq=1 Ack=1 Win=501 Len=0 TSval=4272444199 TSecr=7466103
   87  84.223978 192.168.206.151 → 192.168.206.150 TCP 66 [TCP Dup ACK 13#5] [TCP ACKed unseen segment] 27017 → 41394 [ACK] Seq=1 Ack=2 Win=502 Len=0 TSval=7481207 TSecr=4272136231
   88  84.223961 192.168.206.150 → 192.168.206.151 TCP 66 [TCP Dup ACK 10#5] 41396 → 27017 [ACK] Seq=1 Ack=1 Win=501 Len=0 TSval=4272444199 TSecr=7466103
   89  84.223986 192.168.206.151 → 192.168.206.150 TCP 66 [TCP Dup ACK 11#5] [TCP ACKed unseen segment] 27017 → 41396 [ACK] Seq=1 Ack=2 Win=502 Len=0 TSval=7481207 TSecr=4272136231
   90  87.551933 192.168.206.151 → 192.168.206.150 TCP 66 [TCP Keep-Alive] [TCP ACKed unseen segment] 27017 → 41394 [ACK] Seq=0 Ack=2 Win=502 Len=0 TSval=7484535 TSecr=4272136231
   91  87.551951 192.168.206.151 → 192.168.206.150 TCP 66 [TCP Keep-Alive] [TCP ACKed unseen segment] 27017 → 41396 [ACK] Seq=0 Ack=2 Win=502 Len=0 TSval=7484535 TSecr=4272136231
   92  87.552052 192.168.206.150 → 192.168.206.151 TCP 66 [TCP Previous segment not captured] 41394 → 27017 [ACK] Seq=2 Ack=1 Win=501 Len=0 TSval=4272447527 TSecr=7481207
   93  87.552062 192.168.206.150 → 192.168.206.151 TCP 66 [TCP Previous segment not captured] 41396 → 27017 [ACK] Seq=2 Ack=1 Win=501 Len=0 TSval=4272447527 TSecr=7481207
   94  90.623978 192.168.206.150 → 192.168.206.151 TCP 66 [TCP Keep-Alive] 41368 → 27017 [ACK] Seq=1 Ack=1 Win=504 Len=0 TSval=4272450599 TSecr=7472507
   95  90.623996 192.168.206.151 → 192.168.206.150 TCP 66 [TCP Keep-Alive ACK] 27017 → 41368 [ACK] Seq=1 Ack=2 Win=501 Len=0 TSval=7487607 TSecr=4272414759
   96  91.135959 192.168.206.150 → 192.168.206.151 TCP 66 [TCP Dup ACK 3#6] 41392 → 27017 [ACK] Seq=1 Ack=1 Win=501 Len=0 TSval=4272451111 TSecr=7473015
   97  91.135976 192.168.206.151 → 192.168.206.150 TCP 66 [TCP Dup ACK 4#6] [TCP ACKed unseen segment] 27017 → 41392 [ACK] Seq=1 Ack=2 Win=502 Len=0 TSval=7488119 TSecr=4272168999
   98  95.107193 192.168.206.150 → 192.168.206.151 SSL 120 Continuation Data
   99  95.107433 192.168.206.151 → 192.168.206.150 SSL 119 Continuation Data
  100  95.107530 192.168.206.150 → 192.168.206.151 TCP 66 41388 → 27017 [ACK] Seq=553 Ack=1329 Win=501 Len=0 TSval=4272455083 TSecr=7492091
  101  95.231987 192.168.206.150 → 192.168.206.151 TCP 66 [TCP Dup ACK 5#6] 41390 → 27017 [ACK] Seq=1 Ack=1 Win=501 Len=0 TSval=4272455207 TSecr=7477112
  102  95.232005 192.168.206.151 → 192.168.206.150 TCP 66 [TCP Dup ACK 6#6] [TCP ACKed unseen segment] 27017 → 41390 [ACK] Seq=1 Ack=2 Win=502 Len=0 TSval=7492215 TSecr=4272201767
  103  99.327992 192.168.206.150 → 192.168.206.151 TCP 66 [TCP Keep-Alive] 41396 → 27017 [ACK] Seq=1 Ack=1 Win=501 Len=0 TSval=4272459303 TSecr=7481207
  104  99.328020 192.168.206.151 → 192.168.206.150 TCP 66 [TCP Keep-Alive ACK] 27017 → 41396 [ACK] Seq=1 Ack=2 Win=502 Len=0 TSval=7496311 TSecr=4272447527
  105  99.328004 192.168.206.150 → 192.168.206.151 TCP 66 [TCP Keep-Alive] 41394 → 27017 [ACK] Seq=1 Ack=1 Win=501 Len=0 TSval=4272459303 TSecr=7481207
  106  99.328029 192.168.206.151 → 192.168.206.150 TCP 66 [TCP Keep-Alive ACK] 27017 → 41394 [ACK] Seq=1 Ack=2 Win=502 Len=0 TSval=7496311 TSecr=4272447527
  107 105.727956 192.168.206.150 → 192.168.206.151 TCP 66 [TCP Keep-Alive] 41368 → 27017 [ACK] Seq=1 Ack=1 Win=504 Len=0 TSval=4272465703 TSecr=7487607
  108 105.727973 192.168.206.151 → 192.168.206.150 TCP 66 [TCP Keep-Alive ACK] 27017 → 41368 [ACK] Seq=1 Ack=2 Win=501 Len=0 TSval=7502711 TSecr=4272414759
  109 106.239956 192.168.206.150 → 192.168.206.151 TCP 66 [TCP Dup ACK 3#7] 41392 → 27017 [ACK] Seq=1 Ack=1 Win=501 Len=0 TSval=4272466215 TSecr=7488119
  110 106.239974 192.168.206.151 → 192.168.206.150 TCP 66 [TCP Dup ACK 4#7] [TCP ACKed unseen segment] 27017 → 41392 [ACK] Seq=1 Ack=2 Win=502 Len=0 TSval=7503223 TSecr=4272168999
  111 110.108377 192.168.206.150 → 192.168.206.151 SSL 120 Continuation Data
  112 110.108618 192.168.206.151 → 192.168.206.150 SSL 119 Continuation Data
  113 110.108715 192.168.206.150 → 192.168.206.151 TCP 66 41388 → 27017 [ACK] Seq=607 Ack=1382 Win=501 Len=0 TSval=4272470084 TSecr=7507092
  114 110.336004 192.168.206.150 → 192.168.206.151 TCP 66 [TCP Dup ACK 5#7] 41390 → 27017 [ACK] Seq=1 Ack=1 Win=501 Len=0 TSval=4272470311 TSecr=7492215
  115 110.336022 192.168.206.151 → 192.168.206.150 TCP 66 [TCP Dup ACK 6#7] [TCP ACKed unseen segment] 27017 → 41390 [ACK] Seq=1 Ack=2 Win=502 Len=0 TSval=7507319 TSecr=4272201767
  116 112.270939 192.168.206.150 → 192.168.206.151 SSL 124 Continuation Data
  117 112.271241 192.168.206.151 → 192.168.206.150 SSL 385 Continuation Data
  118 112.271321 192.168.206.150 → 192.168.206.151 TCP 66 41388 → 27017 [ACK] Seq=665 Ack=1701 Win=501 Len=0 TSval=4272472247 TSecr=7509255
  119 114.432017 192.168.206.150 → 192.168.206.151 TCP 66 [TCP Keep-Alive] 41394 → 27017 [ACK] Seq=1 Ack=1 Win=501 Len=0 TSval=4272474407 TSecr=7496311
  120 114.432047 192.168.206.151 → 192.168.206.150 TCP 66 [TCP Keep-Alive ACK] 27017 → 41394 [ACK] Seq=1 Ack=2 Win=502 Len=0 TSval=7511416 TSecr=4272447527
  121 114.432028 192.168.206.150 → 192.168.206.151 TCP 66 [TCP Keep-Alive] 41396 → 27017 [ACK] Seq=1 Ack=1 Win=501 Len=0 TSval=4272474407 TSecr=7496311
  122 114.432055 192.168.206.151 → 192.168.206.150 TCP 66 [TCP Keep-Alive ACK] 27017 → 41396 [ACK] Seq=1 Ack=2 Win=502 Len=0 TSval=7511416 TSecr=4272447527
  123 120.319941 192.168.206.151 → 192.168.206.150 TCP 66 [TCP Keep-Alive] [TCP ACKed unseen segment] 27017 → 41392 [ACK] Seq=0 Ack=2 Win=502 Len=0 TSval=7517303 TSecr=4272168999
  124 120.320033 192.168.206.150 → 192.168.206.151 TCP 66 [TCP Previous segment not captured] 41392 → 27017 [ACK] Seq=2 Ack=1 Win=501 Len=0 TSval=4272480295 TSecr=7503223
  125 120.831997 192.168.206.150 → 192.168.206.151 TCP 66 [TCP Keep-Alive] 41368 → 27017 [ACK] Seq=1 Ack=1 Win=504 Len=0 TSval=4272480807 TSecr=7502711
  126 120.832014 192.168.206.151 → 192.168.206.150 TCP 66 [TCP Keep-Alive ACK] 27017 → 41368 [ACK] Seq=1 Ack=2 Win=501 Len=0 TSval=7517815 TSecr=4272414759
  127 121.344005 192.168.206.150 → 192.168.206.151 TCP 66 [TCP Keep-Alive] 41392 → 27017 [ACK] Seq=1 Ack=1 Win=501 Len=0 TSval=4272481319 TSecr=7503223
  128 121.344021 192.168.206.151 → 192.168.206.150 TCP 66 [TCP Keep-Alive ACK] 27017 → 41392 [ACK] Seq=1 Ack=2 Win=502 Len=0 TSval=7518327 TSecr=4272480295
  129 125.109203 192.168.206.150 → 192.168.206.151 SSL 120 Continuation Data
  130 125.109448 192.168.206.151 → 192.168.206.150 SSL 119 Continuation Data
  131 125.109545 192.168.206.150 → 192.168.206.151 TCP 66 41388 → 27017 [ACK] Seq=719 Ack=1754 Win=501 Len=0 TSval=4272485085 TSecr=7522093
  132 125.440000 192.168.206.150 → 192.168.206.151 TCP 66 [TCP Dup ACK 5#8] 41390 → 27017 [ACK] Seq=1 Ack=1 Win=501 Len=0 TSval=4272485415 TSecr=7507319
  133 125.440016 192.168.206.151 → 192.168.206.150 TCP 66 [TCP Dup ACK 6#8] [TCP ACKed unseen segment] 27017 → 41390 [ACK] Seq=1 Ack=2 Win=502 Len=0 TSval=7522423 TSecr=4272201767
  134 129.536022 192.168.206.150 → 192.168.206.151 TCP 66 [TCP Keep-Alive] 41396 → 27017 [ACK] Seq=1 Ack=1 Win=501 Len=0 TSval=4272489511 TSecr=7511416
  135 129.536051 192.168.206.151 → 192.168.206.150 TCP 66 [TCP Keep-Alive ACK] 27017 → 41396 [ACK] Seq=1 Ack=2 Win=502 Len=0 TSval=7526520 TSecr=4272447527
  136 129.536034 192.168.206.150 → 192.168.206.151 TCP 66 [TCP Keep-Alive] 41394 → 27017 [ACK] Seq=1 Ack=1 Win=501 Len=0 TSval=4272489511 TSecr=7511416
  137 129.536059 192.168.206.151 → 192.168.206.150 TCP 66 [TCP Keep-Alive ACK] 27017 → 41394 [ACK] Seq=1 Ack=2 Win=502 Len=0 TSval=7526520 TSecr=4272447527
  138 135.936010 192.168.206.150 → 192.168.206.151 TCP 66 [TCP Keep-Alive] 41368 → 27017 [ACK] Seq=1 Ack=1 Win=504 Len=0 TSval=4272495911 TSecr=7517815
  139 135.936030 192.168.206.151 → 192.168.206.150 TCP 66 [TCP Keep-Alive ACK] 27017 → 41368 [ACK] Seq=1 Ack=2 Win=501 Len=0 TSval=7532919 TSecr=4272414759
  140 136.448026 192.168.206.150 → 192.168.206.151 TCP 66 [TCP Keep-Alive] 41392 → 27017 [ACK] Seq=1 Ack=1 Win=501 Len=0 TSval=4272496423 TSecr=7518327
  141 136.448042 192.168.206.151 → 192.168.206.150 TCP 66 [TCP Keep-Alive ACK] 27017 → 41392 [ACK] Seq=1 Ack=2 Win=502 Len=0 TSval=7533431 TSecr=4272480295
