    1   0.000000 192.168.206.149 → 192.168.163.26 TCP 66 33760 → 27017 [ACK] Seq=1 Ack=1 Win=504 Len=0 TSval=3478789745 TSecr=662814198
    2   0.000022 192.168.163.26 → 192.168.206.149 TCP 66 [TCP ACKed unseen segment] 27017 → 33760 [ACK] Seq=1 Ack=2 Win=501 Len=0 TSval=662829302 TSecr=3478533534
    3   1.792009 192.168.206.149 → 192.168.163.26 TCP 66 33782 → 27017 [ACK] Seq=1 Ack=1 Win=502 Len=0 TSval=3478791537 TSecr=662815990
    4   1.792040 192.168.163.26 → 192.168.206.149 TCP 66 [TCP ACKed unseen segment] 27017 → 33782 [ACK] Seq=1 Ack=2 Win=501 Len=0 TSval=662831094 TSecr=3478549918
    5   1.792015 192.168.206.149 → 192.168.163.26 TCP 66 33786 → 27017 [ACK] Seq=1 Ack=1 Win=502 Len=0 TSval=3478791537 TSecr=662815990
    6   1.792050 192.168.163.26 → 192.168.206.149 TCP 66 [TCP ACKed unseen segment] 27017 → 33786 [ACK] Seq=1 Ack=2 Win=501 Len=0 TSval=662831094 TSecr=3478549918
    7   1.792020 192.168.206.149 → 192.168.163.26 TCP 66 33784 → 27017 [ACK] Seq=1 Ack=1 Win=502 Len=0 TSval=3478791537 TSecr=662815990
    8   1.792058 192.168.163.26 → 192.168.206.149 TCP 66 [TCP ACKed unseen segment] 27017 → 33784 [ACK] Seq=1 Ack=2 Win=501 Len=0 TSval=662831094 TSecr=3478549918
    9   2.303974 192.168.206.149 → 192.168.163.26 TCP 66 33780 → 27017 [ACK] Seq=1 Ack=1 Win=501 Len=0 TSval=3478792049 TSecr=662816502
   10   2.303992 192.168.163.26 → 192.168.206.149 TCP 66 [TCP ACKed unseen segment] 27017 → 33780 [ACK] Seq=1 Ack=2 Win=501 Len=0 TSval=662831606 TSecr=3478566302
   11   5.022574 192.168.206.149 → 192.168.163.26 SSL 120 Continuation Data
   12   5.022861 192.168.163.26 → 192.168.206.149 SSL 119 Continuation Data
   13   5.023249 192.168.206.149 → 192.168.163.26 TCP 66 33778 → 27017 [ACK] Seq=55 Ack=54 Win=501 Len=0 TSval=3478794769 TSecr=662834324
   14  15.103978 192.168.206.149 → 192.168.163.26 TCP 66 [TCP Dup ACK 1#1] 33760 → 27017 [ACK] Seq=1 Ack=1 Win=504 Len=0 TSval=3478804849 TSecr=662829302
   15  15.103997 192.168.163.26 → 192.168.206.149 TCP 66 [TCP Dup ACK 2#1] [TCP ACKed unseen segment] 27017 → 33760 [ACK] Seq=1 Ack=2 Win=501 Len=0 TSval=662844406 TSecr=3478533534
   16  16.896021 192.168.206.149 → 192.168.163.26 TCP 66 [TCP Dup ACK 7#1] 33784 → 27017 [ACK] Seq=1 Ack=1 Win=502 Len=0 TSval=3478806641 TSecr=662831094
   17  16.896051 192.168.163.26 → 192.168.206.149 TCP 66 [TCP Dup ACK 8#1] [TCP ACKed unseen segment] 27017 → 33784 [ACK] Seq=1 Ack=2 Win=501 Len=0 TSval=662846198 TSecr=3478549918
   18  16.896028 192.168.206.149 → 192.168.163.26 TCP 66 [TCP Dup ACK 5#1] 33786 → 27017 [ACK] Seq=1 Ack=1 Win=502 Len=0 TSval=3478806641 TSecr=662831094
   19  16.896061 192.168.163.26 → 192.168.206.149 TCP 66 [TCP Dup ACK 6#1] [TCP ACKed unseen segment] 27017 → 33786 [ACK] Seq=1 Ack=2 Win=501 Len=0 TSval=662846198 TSecr=3478549918
   20  16.896032 192.168.206.149 → 192.168.163.26 TCP 66 [TCP Dup ACK 3#1] 33782 → 27017 [ACK] Seq=1 Ack=1 Win=502 Len=0 TSval=3478806641 TSecr=662831094
   21  16.896069 192.168.163.26 → 192.168.206.149 TCP 66 [TCP Dup ACK 4#1] [TCP ACKed unseen segment] 27017 → 33782 [ACK] Seq=1 Ack=2 Win=501 Len=0 TSval=662846198 TSecr=3478549918
   22  17.407930 192.168.206.149 → 192.168.163.26 TCP 66 [TCP Dup ACK 9#1] 33780 → 27017 [ACK] Seq=1 Ack=1 Win=501 Len=0 TSval=3478807153 TSecr=662831606
   23  17.407951 192.168.163.26 → 192.168.206.149 TCP 66 [TCP Dup ACK 10#1] [TCP ACKed unseen segment] 27017 → 33780 [ACK] Seq=1 Ack=2 Win=501 Len=0 TSval=662846710 TSecr=3478566302
   24  20.023743 192.168.206.149 → 192.168.163.26 SSL 120 Continuation Data
   25  20.024055 192.168.163.26 → 192.168.206.149 SSL 119 Continuation Data
   26  20.024279 192.168.206.149 → 192.168.163.26 TCP 66 33778 → 27017 [ACK] Seq=109 Ack=107 Win=501 Len=0 TSval=3478809770 TSecr=662849326
   27  20.634676 192.168.206.149 → 192.168.163.26 SSL 124 Continuation Data
   28  20.634996 192.168.163.26 → 192.168.206.149 SSL 385 Continuation Data
   29  20.635235 192.168.206.149 → 192.168.163.26 TCP 66 33778 → 27017 [ACK] Seq=167 Ack=426 Win=501 Len=0 TSval=3478810381 TSecr=662849937
   30  30.207908 192.168.206.149 → 192.168.163.26 TCP 66 [TCP Dup ACK 1#2] 33760 → 27017 [ACK] Seq=1 Ack=1 Win=504 Len=0 TSval=3478819953 TSecr=662844406
   31  30.207940 192.168.163.26 → 192.168.206.149 TCP 66 [TCP Dup ACK 2#2] [TCP ACKed unseen segment] 27017 → 33760 [ACK] Seq=1 Ack=2 Win=501 Len=0 TSval=662859510 TSecr=3478533534
   32  31.999922 192.168.206.149 → 192.168.163.26 TCP 66 [TCP Dup ACK 7#2] 33784 → 27017 [ACK] Seq=1 Ack=1 Win=502 Len=0 TSval=3478821745 TSecr=662846198
   33  31.999947 192.168.163.26 → 192.168.206.149 TCP 66 [TCP Dup ACK 8#2] [TCP ACKed unseen segment] 27017 → 33784 [ACK] Seq=1 Ack=2 Win=501 Len=0 TSval=662861302 TSecr=3478549918
   34  31.999928 192.168.206.149 → 192.168.163.26 TCP 66 [TCP Dup ACK 5#2] 33786 → 27017 [ACK] Seq=1 Ack=1 Win=502 Len=0 TSval=3478821745 TSecr=662846198
   35  31.999957 192.168.163.26 → 192.168.206.149 TCP 66 [TCP Dup ACK 6#2] [TCP ACKed unseen segment] 27017 → 33786 [ACK] Seq=1 Ack=2 Win=501 Len=0 TSval=662861302 TSecr=3478549918
   36  32.003890 192.168.206.149 → 192.168.163.26 TCP 66 [TCP Dup ACK 3#2] 33782 → 27017 [ACK] Seq=1 Ack=1 Win=502 Len=0 TSval=3478821749 TSecr=662846198
   37  32.003917 192.168.163.26 → 192.168.206.149 TCP 66 [TCP Dup ACK 4#2] [TCP ACKed unseen segment] 27017 → 33782 [ACK] Seq=1 Ack=2 Win=501 Len=0 TSval=662861306 TSecr=3478549918
   38  32.511835 192.168.206.149 → 192.168.163.26 TCP 66 [TCP Dup ACK 9#2] 33780 → 27017 [ACK] Seq=1 Ack=1 Win=501 Len=0 TSval=3478822257 TSecr=662846710
   39  32.511875 192.168.163.26 → 192.168.206.149 TCP 66 [TCP Dup ACK 10#2] [TCP ACKed unseen segment] 27017 → 33780 [ACK] Seq=1 Ack=2 Win=501 Len=0 TSval=662861814 TSecr=3478566302
   40  35.024838 192.168.206.149 → 192.168.163.26 SSL 120 Continuation Data
   41  35.025074 192.168.163.26 → 192.168.206.149 SSL 119 Continuation Data
   42  35.025355 192.168.206.149 → 192.168.163.26 TCP 66 33778 → 27017 [ACK] Seq=221 Ack=479 Win=501 Len=0 TSval=3478824771 TSecr=662864327
   43  45.311960 192.168.206.149 → 192.168.163.26 TCP 66 [TCP Dup ACK 1#3] 33760 → 27017 [ACK] Seq=1 Ack=1 Win=504 Len=0 TSval=3478835057 TSecr=662859510
   44  45.311980 192.168.163.26 → 192.168.206.149 TCP 66 [TCP Dup ACK 2#3] [TCP ACKed unseen segment] 27017 → 33760 [ACK] Seq=1 Ack=2 Win=501 Len=0 TSval=662874614 TSecr=3478533534
   45  47.103988 192.168.206.149 → 192.168.163.26 TCP 66 [TCP Dup ACK 7#3] 33784 → 27017 [ACK] Seq=1 Ack=1 Win=502 Len=0 TSval=3478836849 TSecr=662861302
   46  47.104028 192.168.163.26 → 192.168.206.149 TCP 66 [TCP Dup ACK 8#3] [TCP ACKed unseen segment] 27017 → 33784 [ACK] Seq=1 Ack=2 Win=501 Len=0 TSval=662876406 TSecr=3478549918
   47  47.103997 192.168.206.149 → 192.168.163.26 TCP 66 [TCP Dup ACK 5#3] 33786 → 27017 [ACK] Seq=1 Ack=1 Win=502 Len=0 TSval=3478836849 TSecr=662861302
   48  47.104042 192.168.163.26 → 192.168.206.149 TCP 66 [TCP Dup ACK 6#3] [TCP ACKed unseen segment] 27017 → 33786 [ACK] Seq=1 Ack=2 Win=501 Len=0 TSval=662876406 TSecr=3478549918
   49  47.104004 192.168.206.149 → 192.168.163.26 TCP 66 [TCP Dup ACK 3#3] 33782 → 27017 [ACK] Seq=1 Ack=1 Win=502 Len=0 TSval=3478836849 TSecr=662861306
   50  47.104053 192.168.163.26 → 192.168.206.149 TCP 66 [TCP Dup ACK 4#3] [TCP ACKed unseen segment] 27017 → 33782 [ACK] Seq=1 Ack=2 Win=501 Len=0 TSval=662876406 TSecr=3478549918
   51  47.615816 192.168.206.149 → 192.168.163.26 TCP 66 [TCP Dup ACK 9#3] 33780 → 27017 [ACK] Seq=1 Ack=1 Win=501 Len=0 TSval=3478837361 TSecr=662861814
   52  47.615828 192.168.163.26 → 192.168.206.149 TCP 66 [TCP Dup ACK 10#3] [TCP ACKed unseen segment] 27017 → 33780 [ACK] Seq=1 Ack=2 Win=501 Len=0 TSval=662876917 TSecr=3478566302
   53  50.026327 192.168.206.149 → 192.168.163.26 SSL 120 Continuation Data
   54  50.026569 192.168.163.26 → 192.168.206.149 SSL 119 Continuation Data
   55  50.026825 192.168.206.149 → 192.168.163.26 TCP 66 33778 → 27017 [ACK] Seq=275 Ack=532 Win=501 Len=0 TSval=3478839772 TSecr=662879328
   56  51.138429 192.168.206.149 → 192.168.163.26 SSL 124 Continuation Data
   57  51.138762 192.168.163.26 → 192.168.206.149 SSL 385 Continuation Data
   58  51.139053 192.168.206.149 → 192.168.163.26 TCP 66 33778 → 27017 [ACK] Seq=333 Ack=851 Win=501 Len=0 TSval=3478840885 TSecr=662880440
   59  55.083912 192.168.163.26 → 192.168.206.149 TCP 66 [TCP Keep-Alive] [TCP ACKed unseen segment] 27017 → 33760 [ACK] Seq=0 Ack=2 Win=501 Len=0 TSval=662884386 TSecr=3478533534
   60  55.084175 192.168.206.149 → 192.168.163.26 TCP 66 [TCP Previous segment not captured] 33760 → 27017 [ACK] Seq=2 Ack=1 Win=504 Len=0 TSval=3478844830 TSecr=662874614
   61  60.415952 192.168.206.149 → 192.168.163.26 TCP 66 [TCP Keep-Alive] 33760 → 27017 [ACK] Seq=1 Ack=1 Win=504 Len=0 TSval=3478850161 TSecr=662874614
   62  60.415971 192.168.163.26 → 192.168.206.149 TCP 66 [TCP Keep-Alive ACK] 27017 → 33760 [ACK] Seq=1 Ack=2 Win=501 Len=0 TSval=662889718 TSecr=3478844830
   63  62.207924 192.168.206.149 → 192.168.163.26 TCP 66 [TCP Dup ACK 7#4] 33784 → 27017 [ACK] Seq=1 Ack=1 Win=502 Len=0 TSval=3478851953 TSecr=662876406
   64  62.207960 192.168.163.26 → 192.168.206.149 TCP 66 [TCP Dup ACK 8#4] [TCP ACKed unseen segment] 27017 → 33784 [ACK] Seq=1 Ack=2 Win=501 Len=0 TSval=662891510 TSecr=3478549918
   65  62.207930 192.168.206.149 → 192.168.163.26 TCP 66 [TCP Dup ACK 3#4] 33782 → 27017 [ACK] Seq=1 Ack=1 Win=502 Len=0 TSval=3478851953 TSecr=662876406
   66  62.207971 192.168.163.26 → 192.168.206.149 TCP 66 [TCP Dup ACK 4#4] [TCP ACKed unseen segment] 27017 → 33782 [ACK] Seq=1 Ack=2 Win=501 Len=0 TSval=662891510 TSecr=3478549918
   67  62.208041 192.168.206.149 → 192.168.163.26 TCP 66 [TCP Dup ACK 5#4] 33786 → 27017 [ACK] Seq=1 Ack=1 Win=502 Len=0 TSval=3478851953 TSecr=662876406
   68  62.208049 192.168.163.26 → 192.168.206.149 TCP 66 [TCP Dup ACK 6#4] [TCP ACKed unseen segment] 27017 → 33786 [ACK] Seq=1 Ack=2 Win=501 Len=0 TSval=662891510 TSecr=3478549918
   69  62.719951 192.168.206.149 → 192.168.163.26 TCP 66 [TCP Dup ACK 9#4] 33780 → 27017 [ACK] Seq=1 Ack=1 Win=501 Len=0 TSval=3478852465 TSecr=662876917
   70  62.719970 192.168.163.26 → 192.168.206.149 TCP 66 [TCP Dup ACK 10#4] [TCP ACKed unseen segment] 27017 → 33780 [ACK] Seq=1 Ack=2 Win=501 Len=0 TSval=662892022 TSecr=3478566302
   71  65.027353 192.168.206.149 → 192.168.163.26 SSL 120 Continuation Data
   72  65.027588 192.168.163.26 → 192.168.206.149 SSL 119 Continuation Data
   73  65.027996 192.168.206.149 → 192.168.163.26 TCP 66 33778 → 27017 [ACK] Seq=387 Ack=904 Win=501 Len=0 TSval=3478854773 TSecr=662894329
   74  71.467865 192.168.163.26 → 192.168.206.149 TCP 66 [TCP Keep-Alive] [TCP ACKed unseen segment] 27017 → 33786 [ACK] Seq=0 Ack=2 Win=501 Len=0 TSval=662900769 TSecr=3478549918
   75  71.467881 192.168.163.26 → 192.168.206.149 TCP 66 [TCP Keep-Alive] [TCP ACKed unseen segment] 27017 → 33784 [ACK] Seq=0 Ack=2 Win=501 Len=0 TSval=662900770 TSecr=3478549918
   76  71.467887 192.168.163.26 → 192.168.206.149 TCP 66 [TCP Keep-Alive] [TCP ACKed unseen segment] 27017 → 33782 [ACK] Seq=0 Ack=2 Win=501 Len=0 TSval=662900770 TSecr=3478549918
   77  71.468160 192.168.206.149 → 192.168.163.26 TCP 66 [TCP Previous segment not captured] 33786 → 27017 [ACK] Seq=2 Ack=1 Win=502 Len=0 TSval=3478861214 TSecr=662891510
   78  71.468230 192.168.206.149 → 192.168.163.26 TCP 66 [TCP Previous segment not captured] 33784 → 27017 [ACK] Seq=2 Ack=1 Win=502 Len=0 TSval=3478861214 TSecr=662891510
   79  71.468281 192.168.206.149 → 192.168.163.26 TCP 66 [TCP Previous segment not captured] 33782 → 27017 [ACK] Seq=2 Ack=1 Win=502 Len=0 TSval=3478861214 TSecr=662891510
   80  75.519800 192.168.206.149 → 192.168.163.26 TCP 66 [TCP Keep-Alive] 33760 → 27017 [ACK] Seq=1 Ack=1 Win=504 Len=0 TSval=3478865265 TSecr=662889718
   81  75.519829 192.168.163.26 → 192.168.206.149 TCP 66 [TCP Keep-Alive ACK] 27017 → 33760 [ACK] Seq=1 Ack=2 Win=501 Len=0 TSval=662904821 TSecr=3478844830
   82  77.311976 192.168.206.149 → 192.168.163.26 TCP 66 [TCP Keep-Alive] 33784 → 27017 [ACK] Seq=1 Ack=1 Win=502 Len=0 TSval=3478867057 TSecr=662891510
   83  77.312001 192.168.163.26 → 192.168.206.149 TCP 66 [TCP Keep-Alive ACK] 27017 → 33784 [ACK] Seq=1 Ack=2 Win=501 Len=0 TSval=662906614 TSecr=3478861214
   84  77.311982 192.168.206.149 → 192.168.163.26 TCP 66 [TCP Keep-Alive] 33782 → 27017 [ACK] Seq=1 Ack=1 Win=502 Len=0 TSval=3478867057 TSecr=662891510
   85  77.312010 192.168.163.26 → 192.168.206.149 TCP 66 [TCP Keep-Alive ACK] 27017 → 33782 [ACK] Seq=1 Ack=2 Win=501 Len=0 TSval=662906614 TSecr=3478861214
   86  77.315791 192.168.206.149 → 192.168.163.26 TCP 66 [TCP Keep-Alive] 33786 → 27017 [ACK] Seq=1 Ack=1 Win=502 Len=0 TSval=3478867061 TSecr=662891510
   87  77.315804 192.168.163.26 → 192.168.206.149 TCP 66 [TCP Keep-Alive ACK] 27017 → 33786 [ACK] Seq=1 Ack=2 Win=501 Len=0 TSval=662906617 TSecr=3478861214
   88  77.823918 192.168.206.149 → 192.168.163.26 TCP 66 [TCP Dup ACK 9#5] 33780 → 27017 [ACK] Seq=1 Ack=1 Win=501 Len=0 TSval=3478867569 TSecr=662892022
   89  77.823936 192.168.163.26 → 192.168.206.149 TCP 66 [TCP Dup ACK 10#5] [TCP ACKed unseen segment] 27017 → 33780 [ACK] Seq=1 Ack=2 Win=501 Len=0 TSval=662907126 TSecr=3478566302
   90  80.029176 192.168.206.149 → 192.168.163.26 SSL 120 Continuation Data
   91  80.029420 192.168.163.26 → 192.168.206.149 SSL 119 Continuation Data
   92  80.029668 192.168.206.149 → 192.168.163.26 TCP 66 33778 → 27017 [ACK] Seq=441 Ack=957 Win=501 Len=0 TSval=3478869775 TSecr=662909331
   93  81.642953 192.168.206.149 → 192.168.163.26 SSL 124 Continuation Data
   94  81.643309 192.168.163.26 → 192.168.206.149 SSL 385 Continuation Data
   95  81.643651 192.168.206.149 → 192.168.163.26 TCP 66 33778 → 27017 [ACK] Seq=499 Ack=1276 Win=501 Len=0 TSval=3478871389 TSecr=662910945
   96  87.851910 192.168.163.26 → 192.168.206.149 TCP 66 [TCP Keep-Alive] [TCP ACKed unseen segment] 27017 → 33780 [ACK] Seq=0 Ack=2 Win=501 Len=0 TSval=662917154 TSecr=3478566302
   97  87.852221 192.168.206.149 → 192.168.163.26 TCP 66 [TCP Previous segment not captured] 33780 → 27017 [ACK] Seq=2 Ack=1 Win=501 Len=0 TSval=3478877598 TSecr=662907126
   98  90.623926 192.168.206.149 → 192.168.163.26 TCP 66 [TCP Keep-Alive] 33760 → 27017 [ACK] Seq=1 Ack=1 Win=504 Len=0 TSval=3478880369 TSecr=662904821
   99  90.623946 192.168.163.26 → 192.168.206.149 TCP 66 [TCP Keep-Alive ACK] 27017 → 33760 [ACK] Seq=1 Ack=2 Win=501 Len=0 TSval=662919926 TSecr=3478844830
  100  92.415821 192.168.206.149 → 192.168.163.26 TCP 66 [TCP Keep-Alive] 33784 → 27017 [ACK] Seq=1 Ack=1 Win=502 Len=0 TSval=3478882161 TSecr=662906614
  101  92.415844 192.168.163.26 → 192.168.206.149 TCP 66 [TCP Keep-Alive ACK] 27017 → 33784 [ACK] Seq=1 Ack=2 Win=501 Len=0 TSval=662921717 TSecr=3478861214
  102  92.415827 192.168.206.149 → 192.168.163.26 TCP 66 [TCP Keep-Alive] 33786 → 27017 [ACK] Seq=1 Ack=1 Win=502 Len=0 TSval=3478882161 TSecr=662906617
  103  92.415853 192.168.163.26 → 192.168.206.149 TCP 66 [TCP Keep-Alive ACK] 27017 → 33786 [ACK] Seq=1 Ack=2 Win=501 Len=0 TSval=662921717 TSecr=3478861214
  104  92.415957 192.168.206.149 → 192.168.163.26 TCP 66 [TCP Keep-Alive] 33782 → 27017 [ACK] Seq=1 Ack=1 Win=502 Len=0 TSval=3478882161 TSecr=662906614
  105  92.415971 192.168.163.26 → 192.168.206.149 TCP 66 [TCP Keep-Alive ACK] 27017 → 33782 [ACK] Seq=1 Ack=2 Win=501 Len=0 TSval=662921718 TSecr=3478861214
  106  92.931888 192.168.206.149 → 192.168.163.26 TCP 66 [TCP Keep-Alive] 33780 → 27017 [ACK] Seq=1 Ack=1 Win=501 Len=0 TSval=3478882677 TSecr=662907126
  107  92.931925 192.168.163.26 → 192.168.206.149 TCP 66 [TCP Keep-Alive ACK] 27017 → 33780 [ACK] Seq=1 Ack=2 Win=501 Len=0 TSval=662922234 TSecr=3478877598
  108  95.030141 192.168.206.149 → 192.168.163.26 SSL 120 Continuation Data
  109  95.030383 192.168.163.26 → 192.168.206.149 SSL 119 Continuation Data
  110  95.030673 192.168.206.149 → 192.168.163.26 TCP 66 33778 → 27017 [ACK] Seq=553 Ack=1329 Win=501 Len=0 TSval=3478884776 TSecr=662924332
  111 105.727801 192.168.206.149 → 192.168.163.26 TCP 66 [TCP Keep-Alive] 33760 → 27017 [ACK] Seq=1 Ack=1 Win=504 Len=0 TSval=3478895473 TSecr=662919926
  112 105.727817 192.168.163.26 → 192.168.206.149 TCP 66 [TCP Keep-Alive ACK] 27017 → 33760 [ACK] Seq=1 Ack=2 Win=501 Len=0 TSval=662935029 TSecr=3478844830
  113 107.519991 192.168.206.149 → 192.168.163.26 TCP 66 [TCP Keep-Alive] 33784 → 27017 [ACK] Seq=1 Ack=1 Win=502 Len=0 TSval=3478897265 TSecr=662921717
  114 107.520020 192.168.163.26 → 192.168.206.149 TCP 66 [TCP Keep-Alive ACK] 27017 → 33784 [ACK] Seq=1 Ack=2 Win=501 Len=0 TSval=662936822 TSecr=3478861214
  115 107.519997 192.168.206.149 → 192.168.163.26 TCP 66 [TCP Keep-Alive] 33786 → 27017 [ACK] Seq=1 Ack=1 Win=502 Len=0 TSval=3478897265 TSecr=662921717
  116 107.520030 192.168.163.26 → 192.168.206.149 TCP 66 [TCP Keep-Alive ACK] 27017 → 33786 [ACK] Seq=1 Ack=2 Win=501 Len=0 TSval=662936822 TSecr=3478861214
  117 107.520002 192.168.206.149 → 192.168.163.26 TCP 66 [TCP Keep-Alive] 33782 → 27017 [ACK] Seq=1 Ack=1 Win=502 Len=0 TSval=3478897265 TSecr=662921718
  118 107.520038 192.168.163.26 → 192.168.206.149 TCP 66 [TCP Keep-Alive ACK] 27017 → 33782 [ACK] Seq=1 Ack=2 Win=501 Len=0 TSval=662936822 TSecr=3478861214
  119 108.031986 192.168.206.149 → 192.168.163.26 TCP 66 [TCP Keep-Alive] 33780 → 27017 [ACK] Seq=1 Ack=1 Win=501 Len=0 TSval=3478897777 TSecr=662922234
  120 108.032004 192.168.163.26 → 192.168.206.149 TCP 66 [TCP Keep-Alive ACK] 27017 → 33780 [ACK] Seq=1 Ack=2 Win=501 Len=0 TSval=662937334 TSecr=3478877598
  121 110.031416 192.168.206.149 → 192.168.163.26 SSL 120 Continuation Data
  122 110.031707 192.168.163.26 → 192.168.206.149 SSL 119 Continuation Data
  123 110.032100 192.168.206.149 → 192.168.163.26 TCP 66 33778 → 27017 [ACK] Seq=607 Ack=1382 Win=501 Len=0 TSval=3478899778 TSecr=662939333
  124 112.147109 192.168.206.149 → 192.168.163.26 SSL 124 Continuation Data
  125 112.147441 192.168.163.26 → 192.168.206.149 SSL 385 Continuation Data
  126 112.147842 192.168.206.149 → 192.168.163.26 TCP 66 33778 → 27017 [ACK] Seq=665 Ack=1701 Win=501 Len=0 TSval=3478901893 TSecr=662941449
  127 120.832005 192.168.206.149 → 192.168.163.26 TCP 66 [TCP Keep-Alive] 33760 → 27017 [ACK] Seq=1 Ack=1 Win=504 Len=0 TSval=3478910577 TSecr=662935029
  128 120.832027 192.168.163.26 → 192.168.206.149 TCP 66 [TCP Keep-Alive ACK] 27017 → 33760 [ACK] Seq=1 Ack=2 Win=501 Len=0 TSval=662950134 TSecr=3478844830
  129 122.624053 192.168.206.149 → 192.168.163.26 TCP 66 [TCP Keep-Alive] 33786 → 27017 [ACK] Seq=1 Ack=1 Win=502 Len=0 TSval=3478912369 TSecr=662936822
  130 122.624117 192.168.163.26 → 192.168.206.149 TCP 66 [TCP Keep-Alive ACK] 27017 → 33786 [ACK] Seq=1 Ack=2 Win=501 Len=0 TSval=662951926 TSecr=3478861214
  131 122.624058 192.168.206.149 → 192.168.163.26 TCP 66 [TCP Keep-Alive] 33782 → 27017 [ACK] Seq=1 Ack=1 Win=502 Len=0 TSval=3478912369 TSecr=662936822
  132 122.624125 192.168.163.26 → 192.168.206.149 TCP 66 [TCP Keep-Alive ACK] 27017 → 33782 [ACK] Seq=1 Ack=2 Win=501 Len=0 TSval=662951926 TSecr=3478861214
  133 122.624063 192.168.206.149 → 192.168.163.26 TCP 66 [TCP Keep-Alive] 33784 → 27017 [ACK] Seq=1 Ack=1 Win=502 Len=0 TSval=3478912369 TSecr=662936822
  134 122.624132 192.168.163.26 → 192.168.206.149 TCP 66 [TCP Keep-Alive ACK] 27017 → 33784 [ACK] Seq=1 Ack=2 Win=501 Len=0 TSval=662951926 TSecr=3478861214
  135 123.136002 192.168.206.149 → 192.168.163.26 TCP 66 [TCP Keep-Alive] 33780 → 27017 [ACK] Seq=1 Ack=1 Win=501 Len=0 TSval=3478912881 TSecr=662937334
  136 123.136029 192.168.163.26 → 192.168.206.149 TCP 66 [TCP Keep-Alive ACK] 27017 → 33780 [ACK] Seq=1 Ack=2 Win=501 Len=0 TSval=662952438 TSecr=3478877598
  137 125.032561 192.168.206.149 → 192.168.163.26 SSL 120 Continuation Data
  138 125.032850 192.168.163.26 → 192.168.206.149 SSL 119 Continuation Data
  139 125.033241 192.168.206.149 → 192.168.163.26 TCP 66 33778 → 27017 [ACK] Seq=719 Ack=1754 Win=501 Len=0 TSval=3478914779 TSecr=662954334
