    1   0.000000 192.168.14.13 → 192.168.206.155 TCP 66 49852 → 8086 [ACK] Seq=1 Ack=1 Win=507 Len=0 TSval=3704094885 TSecr=2807813530
    2   0.000022 192.168.206.155 → 192.168.14.13 TCP 66 [TCP ACKed unseen segment] 8086 → 49852 [ACK] Seq=1 Ack=2 Win=501 Len=0 TSval=2807828634 TSecr=3704079887
    3   0.105637 192.168.206.155 → 192.168.14.13 TCP 66 [TCP Keep-Alive] [TCP ACKed unseen segment] 8086 → 49852 [ACK] Seq=0 Ack=2 Win=501 Len=0 TSval=2807828739 TSecr=3704079887
    4   0.106030 192.168.14.13 → 192.168.206.155 TCP 66 [TCP Previous segment not captured] 49852 → 8086 [ACK] Seq=2 Ack=1 Win=507 Len=0 TSval=3704094991 TSecr=2807828634
    5   2.388850 192.168.206.155 → 10.110.26.230 SSL 124 Continuation Data
    6   2.389660 10.110.26.230 → 192.168.206.155 SSL 385 Continuation Data
    7   2.389684 192.168.206.155 → 10.110.26.230 TCP 66 38220 → 27017 [ACK] Seq=59 Ack=320 Win=6146 Len=0 TSval=973419636 TSecr=3226840025
    8   2.994395 192.168.206.155 → 10.110.26.230 SSL 120 Continuation Data
    9   2.995019 10.110.26.230 → 192.168.206.155 SSL 119 Continuation Data
   10   2.995042 192.168.206.155 → 10.110.26.230 TCP 66 38220 → 27017 [ACK] Seq=113 Ack=373 Win=6146 Len=0 TSval=973420242 TSecr=3226840631
   11   5.008172 192.168.14.13 → 192.168.206.155 TCP 179 49852 → 8086 [PSH, ACK] Seq=2 Ack=1 Win=507 Len=113 TSval=3704099893 TSecr=2807828634
   12   5.008440 192.168.206.155 → 192.168.14.13 TCP 96 [TCP ACKed unseen segment] 8086 → 49852 [PSH, ACK] Seq=1 Ack=115 Win=501 Len=30 TSval=2807833642 TSecr=3704099893
   13   5.008642 192.168.14.13 → 192.168.206.155 TCP 66 49852 → 8086 [ACK] Seq=115 Ack=31 Win=507 Len=0 TSval=3704099893 TSecr=2807833642
   14   5.008771 192.168.14.13 → 192.168.206.155 TCP 83 49852 → 8086 [PSH, ACK] Seq=115 Ack=31 Win=507 Len=17 TSval=3704099894 TSecr=2807833642
   15   5.009135 192.168.206.155 → 192.168.14.13 TCP 104 8086 → 49852 [PSH, ACK] Seq=31 Ack=132 Win=501 Len=38 TSval=2807833643 TSecr=3704099894
   16   5.009330 192.168.14.13 → 192.168.206.155 TCP 66 49852 → 8086 [ACK] Seq=132 Ack=69 Win=507 Len=0 TSval=3704099894 TSecr=2807833643
   17   5.009423 192.168.14.13 → 192.168.206.155 TCP 96 49852 → 8086 [PSH, ACK] Seq=132 Ack=69 Win=507 Len=30 TSval=3704099894 TSecr=2807833643
   18   5.009502 192.168.206.155 → 192.168.14.13 TCP 83 8086 → 49852 [PSH, ACK] Seq=69 Ack=162 Win=501 Len=17 TSval=2807833643 TSecr=3704099894
   19   5.010169 192.168.14.13 → 192.168.206.155 TCP 66 49852 → 8086 [ACK] Seq=162 Ack=86 Win=507 Len=0 TSval=3704099895 TSecr=2807833643
   20   5.055355 192.168.14.13 → 192.168.206.155 TCP 181 49852 → 8086 [PSH, ACK] Seq=162 Ack=86 Win=507 Len=115 TSval=3704099940 TSecr=2807833643
   21   5.055606 192.168.206.155 → 192.168.14.13 TCP 96 8086 → 49852 [PSH, ACK] Seq=86 Ack=277 Win=501 Len=30 TSval=2807833689 TSecr=3704099940
   22   5.055860 192.168.14.13 → 192.168.206.155 TCP 66 49852 → 8086 [ACK] Seq=277 Ack=116 Win=507 Len=0 TSval=3704099941 TSecr=2807833689
   23   5.055930 192.168.14.13 → 192.168.206.155 TCP 83 49852 → 8086 [PSH, ACK] Seq=277 Ack=116 Win=507 Len=17 TSval=3704099941 TSecr=2807833689
   24   5.056125 192.168.206.155 → 192.168.14.13 TCP 104 8086 → 49852 [PSH, ACK] Seq=116 Ack=294 Win=501 Len=38 TSval=2807833690 TSecr=3704099941
   25   5.056367 192.168.14.13 → 192.168.206.155 TCP 66 49852 → 8086 [ACK] Seq=294 Ack=154 Win=507 Len=0 TSval=3704099941 TSecr=2807833690
   26   5.056437 192.168.14.13 → 192.168.206.155 TCP 96 49852 → 8086 [PSH, ACK] Seq=294 Ack=154 Win=507 Len=30 TSval=3704099941 TSecr=2807833690
   27   5.056509 192.168.206.155 → 192.168.14.13 TCP 83 8086 → 49852 [PSH, ACK] Seq=154 Ack=324 Win=501 Len=17 TSval=2807833690 TSecr=3704099941
   28   5.056686 192.168.14.13 → 192.168.206.155 TCP 66 49852 → 8086 [ACK] Seq=324 Ack=171 Win=507 Len=0 TSval=3704099941 TSecr=2807833690
   29   6.866474 192.168.14.13 → 192.168.206.155 TCP 181 49852 → 8086 [PSH, ACK] Seq=324 Ack=171 Win=507 Len=115 TSval=3704101751 TSecr=2807833690
   30   6.866736 192.168.206.155 → 192.168.14.13 TCP 96 8086 → 49852 [PSH, ACK] Seq=171 Ack=439 Win=501 Len=30 TSval=2807835501 TSecr=3704101751
   31   6.867005 192.168.14.13 → 192.168.206.155 TCP 66 49852 → 8086 [ACK] Seq=439 Ack=201 Win=507 Len=0 TSval=3704101752 TSecr=2807835501
   32   6.867067 192.168.14.13 → 192.168.206.155 TCP 83 49852 → 8086 [PSH, ACK] Seq=439 Ack=201 Win=507 Len=17 TSval=3704101752 TSecr=2807835501
   33   6.867536 192.168.206.155 → 192.168.14.13 TCP 104 8086 → 49852 [PSH, ACK] Seq=201 Ack=456 Win=501 Len=38 TSval=2807835501 TSecr=3704101752
   34   6.867707 192.168.14.13 → 192.168.206.155 TCP 66 49852 → 8086 [ACK] Seq=456 Ack=239 Win=507 Len=0 TSval=3704101752 TSecr=2807835501
   35   6.867827 192.168.14.13 → 192.168.206.155 TCP 96 49852 → 8086 [PSH, ACK] Seq=456 Ack=239 Win=507 Len=30 TSval=3704101753 TSecr=2807835501
   36   6.867918 192.168.206.155 → 192.168.14.13 TCP 83 8086 → 49852 [PSH, ACK] Seq=239 Ack=486 Win=501 Len=17 TSval=2807835502 TSecr=3704101753
   37   6.868150 192.168.14.13 → 192.168.206.155 TCP 66 49852 → 8086 [ACK] Seq=486 Ack=256 Win=507 Len=0 TSval=3704101753 TSecr=2807835502
   38   7.000927 192.168.14.13 → 192.168.206.155 TCP 181 49852 → 8086 [PSH, ACK] Seq=486 Ack=256 Win=507 Len=115 TSval=3704101886 TSecr=2807835502
   39   7.001124 192.168.206.155 → 192.168.14.13 TCP 96 8086 → 49852 [PSH, ACK] Seq=256 Ack=601 Win=501 Len=30 TSval=2807835635 TSecr=3704101886
   40   7.001368 192.168.14.13 → 192.168.206.155 TCP 66 49852 → 8086 [ACK] Seq=601 Ack=286 Win=507 Len=0 TSval=3704101886 TSecr=2807835635
   41   7.001431 192.168.14.13 → 192.168.206.155 TCP 83 49852 → 8086 [PSH, ACK] Seq=601 Ack=286 Win=507 Len=17 TSval=3704101886 TSecr=2807835635
   42   7.001849 192.168.206.155 → 192.168.14.13 TCP 104 8086 → 49852 [PSH, ACK] Seq=286 Ack=618 Win=501 Len=38 TSval=2807835636 TSecr=3704101886
   43   7.002049 192.168.14.13 → 192.168.206.155 TCP 66 49852 → 8086 [ACK] Seq=618 Ack=324 Win=507 Len=0 TSval=3704101887 TSecr=2807835636
   44   7.002159 192.168.14.13 → 192.168.206.155 TCP 96 49852 → 8086 [PSH, ACK] Seq=618 Ack=324 Win=507 Len=30 TSval=3704101887 TSecr=2807835636
   45   7.002274 192.168.206.155 → 192.168.14.13 TCP 83 8086 → 49852 [PSH, ACK] Seq=324 Ack=648 Win=501 Len=17 TSval=2807835636 TSecr=3704101887
   46   7.002471 192.168.14.13 → 192.168.206.155 TCP 66 49852 → 8086 [ACK] Seq=648 Ack=341 Win=507 Len=0 TSval=3704101887 TSecr=2807835636
   47   7.466408 192.168.14.13 → 192.168.206.155 TCP 180 49852 → 8086 [PSH, ACK] Seq=648 Ack=341 Win=507 Len=114 TSval=3704102351 TSecr=2807835636
   48   7.466616 192.168.206.155 → 192.168.14.13 TCP 96 8086 → 49852 [PSH, ACK] Seq=341 Ack=762 Win=501 Len=30 TSval=2807836100 TSecr=3704102351
   49   7.466843 192.168.14.13 → 192.168.206.155 TCP 66 49852 → 8086 [ACK] Seq=762 Ack=371 Win=507 Len=0 TSval=3704102352 TSecr=2807836100
   50   7.466908 192.168.14.13 → 192.168.206.155 TCP 83 49852 → 8086 [PSH, ACK] Seq=762 Ack=371 Win=507 Len=17 TSval=3704102352 TSecr=2807836100
   51   7.467269 192.168.206.155 → 192.168.14.13 TCP 104 8086 → 49852 [PSH, ACK] Seq=371 Ack=779 Win=501 Len=38 TSval=2807836101 TSecr=3704102352
   52   7.467454 192.168.14.13 → 192.168.206.155 TCP 66 49852 → 8086 [ACK] Seq=779 Ack=409 Win=507 Len=0 TSval=3704102352 TSecr=2807836101
   53   7.467549 192.168.14.13 → 192.168.206.155 TCP 96 49852 → 8086 [PSH, ACK] Seq=779 Ack=409 Win=507 Len=30 TSval=3704102352 TSecr=2807836101
   54   7.467730 192.168.206.155 → 192.168.14.13 TCP 83 8086 → 49852 [PSH, ACK] Seq=409 Ack=809 Win=501 Len=17 TSval=2807836102 TSecr=3704102352
   55   7.467947 192.168.14.13 → 192.168.206.155 TCP 66 49852 → 8086 [ACK] Seq=809 Ack=426 Win=507 Len=0 TSval=3704102353 TSecr=2807836102
   56   8.636229 192.168.14.13 → 192.168.206.155 TCP 170 49852 → 8086 [PSH, ACK] Seq=809 Ack=426 Win=507 Len=104 TSval=3704103521 TSecr=2807836102
   57   8.636462 192.168.206.155 → 192.168.14.13 TCP 96 8086 → 49852 [PSH, ACK] Seq=426 Ack=913 Win=501 Len=30 TSval=2807837270 TSecr=3704103521
   58   8.636663 192.168.14.13 → 192.168.206.155 TCP 66 49852 → 8086 [ACK] Seq=913 Ack=456 Win=507 Len=0 TSval=3704103521 TSecr=2807837270
   59   8.636769 192.168.14.13 → 192.168.206.155 TCP 83 49852 → 8086 [PSH, ACK] Seq=913 Ack=456 Win=507 Len=17 TSval=3704103522 TSecr=2807837270
   60   8.637038 192.168.206.155 → 192.168.14.13 TCP 104 8086 → 49852 [PSH, ACK] Seq=456 Ack=930 Win=501 Len=38 TSval=2807837271 TSecr=3704103522
   61   8.637243 192.168.14.13 → 192.168.206.155 TCP 66 49852 → 8086 [ACK] Seq=930 Ack=494 Win=507 Len=0 TSval=3704103522 TSecr=2807837271
   62   8.637346 192.168.14.13 → 192.168.206.155 TCP 96 49852 → 8086 [PSH, ACK] Seq=930 Ack=494 Win=507 Len=30 TSval=3704103522 TSecr=2807837271
   63   8.637463 192.168.206.155 → 192.168.14.13 TCP 83 8086 → 49852 [PSH, ACK] Seq=494 Ack=960 Win=501 Len=17 TSval=2807837271 TSecr=3704103522
   64   8.637629 192.168.14.13 → 192.168.206.155 TCP 66 49852 → 8086 [ACK] Seq=960 Ack=511 Win=507 Len=0 TSval=3704103522 TSecr=2807837271
   65   8.687559 192.168.14.13 → 192.168.206.155 TCP 180 49852 → 8086 [PSH, ACK] Seq=960 Ack=511 Win=507 Len=114 TSval=3704103572 TSecr=2807837271
   66   8.687814 192.168.206.155 → 192.168.14.13 TCP 96 8086 → 49852 [PSH, ACK] Seq=511 Ack=1074 Win=501 Len=30 TSval=2807837322 TSecr=3704103572
   67   8.688022 192.168.14.13 → 192.168.206.155 TCP 66 49852 → 8086 [ACK] Seq=1074 Ack=541 Win=507 Len=0 TSval=3704103573 TSecr=2807837322
   68   8.688116 192.168.14.13 → 192.168.206.155 TCP 83 49852 → 8086 [PSH, ACK] Seq=1074 Ack=541 Win=507 Len=17 TSval=3704103573 TSecr=2807837322
   69   8.688460 192.168.206.155 → 192.168.14.13 TCP 104 8086 → 49852 [PSH, ACK] Seq=541 Ack=1091 Win=501 Len=38 TSval=2807837322 TSecr=3704103573
   70   8.688661 192.168.14.13 → 192.168.206.155 TCP 66 49852 → 8086 [ACK] Seq=1091 Ack=579 Win=507 Len=0 TSval=3704103573 TSecr=2807837322
   71   8.688750 192.168.14.13 → 192.168.206.155 TCP 96 49852 → 8086 [PSH, ACK] Seq=1091 Ack=579 Win=507 Len=30 TSval=3704103574 TSecr=2807837322
   72   8.688922 192.168.206.155 → 192.168.14.13 TCP 83 8086 → 49852 [PSH, ACK] Seq=579 Ack=1121 Win=501 Len=17 TSval=2807837323 TSecr=3704103574
   73   8.689126 192.168.14.13 → 192.168.206.155 TCP 66 49852 → 8086 [ACK] Seq=1121 Ack=596 Win=507 Len=0 TSval=3704103574 TSecr=2807837323
   74   9.475966 192.168.14.13 → 192.168.206.155 TCP 180 49852 → 8086 [PSH, ACK] Seq=1121 Ack=596 Win=507 Len=114 TSval=3704104361 TSecr=2807837323
   75   9.476247 192.168.206.155 → 192.168.14.13 TCP 96 8086 → 49852 [PSH, ACK] Seq=596 Ack=1235 Win=501 Len=30 TSval=2807838110 TSecr=3704104361
   76   9.476490 192.168.14.13 → 192.168.206.155 TCP 66 49852 → 8086 [ACK] Seq=1235 Ack=626 Win=507 Len=0 TSval=3704104361 TSecr=2807838110
   77   9.476553 192.168.14.13 → 192.168.206.155 TCP 83 49852 → 8086 [PSH, ACK] Seq=1235 Ack=626 Win=507 Len=17 TSval=3704104361 TSecr=2807838110
   78   9.476809 192.168.206.155 → 192.168.14.13 TCP 104 8086 → 49852 [PSH, ACK] Seq=626 Ack=1252 Win=501 Len=38 TSval=2807838111 TSecr=3704104361
   79   9.477013 192.168.14.13 → 192.168.206.155 TCP 66 49852 → 8086 [ACK] Seq=1252 Ack=664 Win=507 Len=0 TSval=3704104362 TSecr=2807838111
   80   9.477124 192.168.14.13 → 192.168.206.155 TCP 96 49852 → 8086 [PSH, ACK] Seq=1252 Ack=664 Win=507 Len=30 TSval=3704104362 TSecr=2807838111
   81   9.477239 192.168.206.155 → 192.168.14.13 TCP 83 8086 → 49852 [PSH, ACK] Seq=664 Ack=1282 Win=501 Len=17 TSval=2807838111 TSecr=3704104362
   82   9.477411 192.168.14.13 → 192.168.206.155 TCP 66 49852 → 8086 [ACK] Seq=1282 Ack=681 Win=507 Len=0 TSval=3704104362 TSecr=2807838111
   83   9.632776 192.168.14.13 → 192.168.206.155 TCP 167 49852 → 8086 [PSH, ACK] Seq=1282 Ack=681 Win=507 Len=101 TSval=3704104518 TSecr=2807838111
   84   9.633044 192.168.206.155 → 192.168.14.13 TCP 96 8086 → 49852 [PSH, ACK] Seq=681 Ack=1383 Win=501 Len=30 TSval=2807838267 TSecr=3704104518
   85   9.633271 192.168.14.13 → 192.168.206.155 TCP 66 49852 → 8086 [ACK] Seq=1383 Ack=711 Win=507 Len=0 TSval=3704104518 TSecr=2807838267
   86   9.633334 192.168.14.13 → 192.168.206.155 TCP 83 49852 → 8086 [PSH, ACK] Seq=1383 Ack=711 Win=507 Len=17 TSval=3704104518 TSecr=2807838267
   87   9.633525 192.168.206.155 → 192.168.14.13 TCP 104 8086 → 49852 [PSH, ACK] Seq=711 Ack=1400 Win=501 Len=38 TSval=2807838267 TSecr=3704104518
   88   9.633742 192.168.14.13 → 192.168.206.155 TCP 66 49852 → 8086 [ACK] Seq=1400 Ack=749 Win=507 Len=0 TSval=3704104519 TSecr=2807838267
   89   9.633835 192.168.14.13 → 192.168.206.155 TCP 96 49852 → 8086 [PSH, ACK] Seq=1400 Ack=749 Win=507 Len=30 TSval=3704104519 TSecr=2807838267
   90   9.633921 192.168.206.155 → 192.168.14.13 TCP 83 8086 → 49852 [PSH, ACK] Seq=749 Ack=1430 Win=501 Len=17 TSval=2807838268 TSecr=3704104519
   91   9.634113 192.168.14.13 → 192.168.206.155 TCP 66 49852 → 8086 [ACK] Seq=1430 Ack=766 Win=507 Len=0 TSval=3704104519 TSecr=2807838268
   92  10.345618 192.168.206.155 → 10.110.26.230 TCP 66 38218 → 27017 [ACK] Seq=1 Ack=1 Win=504 Len=0 TSval=973427592 TSecr=3226832878
   93  10.345866 10.110.26.230 → 192.168.206.155 TCP 66 [TCP ACKed unseen segment] 27017 → 38218 [ACK] Seq=1 Ack=2 Win=501 Len=0 TSval=3226847982 TSecr=973277727
   94  10.897188 192.168.14.13 → 192.168.206.155 TCP 180 49852 → 8086 [PSH, ACK] Seq=1430 Ack=766 Win=507 Len=114 TSval=3704105782 TSecr=2807838268
   95  10.897411 192.168.206.155 → 192.168.14.13 TCP 96 8086 → 49852 [PSH, ACK] Seq=766 Ack=1544 Win=501 Len=30 TSval=2807839531 TSecr=3704105782
   96  10.897609 192.168.14.13 → 192.168.206.155 TCP 66 49852 → 8086 [ACK] Seq=1544 Ack=796 Win=507 Len=0 TSval=3704105782 TSecr=2807839531
   97  10.897697 192.168.14.13 → 192.168.206.155 TCP 83 49852 → 8086 [PSH, ACK] Seq=1544 Ack=796 Win=507 Len=17 TSval=3704105782 TSecr=2807839531
   98  10.898021 192.168.206.155 → 192.168.14.13 TCP 104 8086 → 49852 [PSH, ACK] Seq=796 Ack=1561 Win=501 Len=38 TSval=2807839532 TSecr=3704105782
   99  10.898223 192.168.14.13 → 192.168.206.155 TCP 66 49852 → 8086 [ACK] Seq=1561 Ack=834 Win=507 Len=0 TSval=3704105783 TSecr=2807839532
  100  10.898334 192.168.14.13 → 192.168.206.155 TCP 96 49852 → 8086 [PSH, ACK] Seq=1561 Ack=834 Win=507 Len=30 TSval=3704105783 TSecr=2807839532
  101  10.898410 192.168.206.155 → 192.168.14.13 TCP 83 8086 → 49852 [PSH, ACK] Seq=834 Ack=1591 Win=501 Len=17 TSval=2807839532 TSecr=3704105783
  102  10.898576 192.168.14.13 → 192.168.206.155 TCP 66 49852 → 8086 [ACK] Seq=1591 Ack=851 Win=507 Len=0 TSval=3704105783 TSecr=2807839532
  103  11.093665 192.168.14.13 → 192.168.206.155 TCP 181 49852 → 8086 [PSH, ACK] Seq=1591 Ack=851 Win=507 Len=115 TSval=3704105978 TSecr=2807839532
  104  11.093890 192.168.206.155 → 192.168.14.13 TCP 96 8086 → 49852 [PSH, ACK] Seq=851 Ack=1706 Win=501 Len=30 TSval=2807839728 TSecr=3704105978
  105  11.094117 192.168.14.13 → 192.168.206.155 TCP 66 49852 → 8086 [ACK] Seq=1706 Ack=881 Win=507 Len=0 TSval=3704105979 TSecr=2807839728
  106  11.094185 192.168.14.13 → 192.168.206.155 TCP 83 49852 → 8086 [PSH, ACK] Seq=1706 Ack=881 Win=507 Len=17 TSval=3704105979 TSecr=2807839728
  107  11.094431 192.168.206.155 → 192.168.14.13 TCP 104 8086 → 49852 [PSH, ACK] Seq=881 Ack=1723 Win=501 Len=38 TSval=2807839728 TSecr=3704105979
  108  11.094666 192.168.14.13 → 192.168.206.155 TCP 66 49852 → 8086 [ACK] Seq=1723 Ack=919 Win=507 Len=0 TSval=3704105979 TSecr=2807839728
  109  11.094763 192.168.14.13 → 192.168.206.155 TCP 96 49852 → 8086 [PSH, ACK] Seq=1723 Ack=919 Win=507 Len=30 TSval=3704105980 TSecr=2807839728
  110  11.094842 192.168.206.155 → 192.168.14.13 TCP 83 8086 → 49852 [PSH, ACK] Seq=919 Ack=1753 Win=501 Len=17 TSval=2807839729 TSecr=3704105980
  111  11.095029 192.168.14.13 → 192.168.206.155 TCP 66 49852 → 8086 [ACK] Seq=1753 Ack=936 Win=507 Len=0 TSval=3704105980 TSecr=2807839729
  112  11.161824 192.168.14.13 → 192.168.206.155 TCP 169 49852 → 8086 [PSH, ACK] Seq=1753 Ack=936 Win=507 Len=103 TSval=3704106047 TSecr=2807839729
  113  11.162061 192.168.206.155 → 192.168.14.13 TCP 96 8086 → 49852 [PSH, ACK] Seq=936 Ack=1856 Win=501 Len=30 TSval=2807839796 TSecr=3704106047
  114  11.162313 192.168.14.13 → 192.168.206.155 TCP 66 49852 → 8086 [ACK] Seq=1856 Ack=966 Win=507 Len=0 TSval=3704106047 TSecr=2807839796
  115  11.162493 192.168.14.13 → 192.168.206.155 TCP 83 49852 → 8086 [PSH, ACK] Seq=1856 Ack=966 Win=507 Len=17 TSval=3704106047 TSecr=2807839796
  116  11.162539 192.168.206.155 → 192.168.14.13 TCP 104 8086 → 49852 [PSH, ACK] Seq=966 Ack=1873 Win=501 Len=38 TSval=2807839796 TSecr=3704106047
  117  11.162758 192.168.14.13 → 192.168.206.155 TCP 66 49852 → 8086 [ACK] Seq=1873 Ack=1004 Win=507 Len=0 TSval=3704106048 TSecr=2807839796
  118  11.162932 192.168.14.13 → 192.168.206.155 TCP 96 49852 → 8086 [PSH, ACK] Seq=1873 Ack=1004 Win=507 Len=30 TSval=3704106048 TSecr=2807839796
  119  11.163017 192.168.206.155 → 192.168.14.13 TCP 83 8086 → 49852 [PSH, ACK] Seq=1004 Ack=1903 Win=501 Len=17 TSval=2807839797 TSecr=3704106048
  120  11.163264 192.168.14.13 → 192.168.206.155 TCP 66 49852 → 8086 [ACK] Seq=1903 Ack=1021 Win=507 Len=0 TSval=3704106048 TSecr=2807839797
  121  11.214636 192.168.14.13 → 192.168.206.155 TCP 180 49852 → 8086 [PSH, ACK] Seq=1903 Ack=1021 Win=507 Len=114 TSval=3704106099 TSecr=2807839797
  122  11.214874 192.168.206.155 → 192.168.14.13 TCP 96 8086 → 49852 [PSH, ACK] Seq=1021 Ack=2017 Win=501 Len=30 TSval=2807839849 TSecr=3704106099
  123  11.215127 192.168.14.13 → 192.168.206.155 TCP 66 49852 → 8086 [ACK] Seq=2017 Ack=1051 Win=507 Len=0 TSval=3704106100 TSecr=2807839849
  124  11.215215 192.168.14.13 → 192.168.206.155 TCP 83 49852 → 8086 [PSH, ACK] Seq=2017 Ack=1051 Win=507 Len=17 TSval=3704106100 TSecr=2807839849
  125  11.215550 192.168.206.155 → 192.168.14.13 TCP 104 8086 → 49852 [PSH, ACK] Seq=1051 Ack=2034 Win=501 Len=38 TSval=2807839849 TSecr=3704106100
  126  11.215796 192.168.14.13 → 192.168.206.155 TCP 66 49852 → 8086 [ACK] Seq=2034 Ack=1089 Win=507 Len=0 TSval=3704106101 TSecr=2807839849
  127  11.215877 192.168.14.13 → 192.168.206.155 TCP 96 49852 → 8086 [PSH, ACK] Seq=2034 Ack=1089 Win=507 Len=30 TSval=3704106101 TSecr=2807839849
  128  11.216051 192.168.206.155 → 192.168.14.13 TCP 83 8086 → 49852 [PSH, ACK] Seq=1089 Ack=2064 Win=501 Len=17 TSval=2807839850 TSecr=3704106101
  129  11.216303 192.168.14.13 → 192.168.206.155 TCP 66 49852 → 8086 [ACK] Seq=2064 Ack=1106 Win=507 Len=0 TSval=3704106101 TSecr=2807839850
  130  11.242267 192.168.14.13 → 192.168.206.155 TCP 169 49852 → 8086 [PSH, ACK] Seq=2064 Ack=1106 Win=507 Len=103 TSval=3704106127 TSecr=2807839850
  131  11.242468 192.168.206.155 → 192.168.14.13 TCP 96 8086 → 49852 [PSH, ACK] Seq=1106 Ack=2167 Win=501 Len=30 TSval=2807839876 TSecr=3704106127
  132  11.242697 192.168.14.13 → 192.168.206.155 TCP 66 49852 → 8086 [ACK] Seq=2167 Ack=1136 Win=507 Len=0 TSval=3704106127 TSecr=2807839876
  133  11.242755 192.168.14.13 → 192.168.206.155 TCP 83 49852 → 8086 [PSH, ACK] Seq=2167 Ack=1136 Win=507 Len=17 TSval=3704106128 TSecr=2807839876
  134  11.242919 192.168.206.155 → 192.168.14.13 TCP 104 8086 → 49852 [PSH, ACK] Seq=1136 Ack=2184 Win=501 Len=38 TSval=2807839877 TSecr=3704106128
  135  11.243154 192.168.14.13 → 192.168.206.155 TCP 66 49852 → 8086 [ACK] Seq=2184 Ack=1174 Win=507 Len=0 TSval=3704106128 TSecr=2807839877
  136  11.243252 192.168.14.13 → 192.168.206.155 TCP 96 49852 → 8086 [PSH, ACK] Seq=2184 Ack=1174 Win=507 Len=30 TSval=3704106128 TSecr=2807839877
  137  11.243328 192.168.206.155 → 192.168.14.13 TCP 83 8086 → 49852 [PSH, ACK] Seq=1174 Ack=2214 Win=501 Len=17 TSval=2807839877 TSecr=3704106128
  138  11.243607 192.168.14.13 → 192.168.206.155 TCP 66 49852 → 8086 [ACK] Seq=2214 Ack=1191 Win=507 Len=0 TSval=3704106128 TSecr=2807839877
  139  11.808491 192.168.14.13 → 192.168.206.155 TCP 180 49852 → 8086 [PSH, ACK] Seq=2214 Ack=1191 Win=507 Len=114 TSval=3704106693 TSecr=2807839877
  140  11.808784 192.168.206.155 → 192.168.14.13 TCP 96 8086 → 49852 [PSH, ACK] Seq=1191 Ack=2328 Win=501 Len=30 TSval=2807840443 TSecr=3704106693
  141  11.809004 192.168.14.13 → 192.168.206.155 TCP 66 49852 → 8086 [ACK] Seq=2328 Ack=1221 Win=507 Len=0 TSval=3704106694 TSecr=2807840443
  142  11.809184 192.168.14.13 → 192.168.206.155 TCP 83 49852 → 8086 [PSH, ACK] Seq=2328 Ack=1221 Win=507 Len=17 TSval=3704106694 TSecr=2807840443
  143  11.809370 192.168.206.155 → 192.168.14.13 TCP 104 8086 → 49852 [PSH, ACK] Seq=1221 Ack=2345 Win=501 Len=38 TSval=2807840443 TSecr=3704106694
  144  11.809569 192.168.14.13 → 192.168.206.155 TCP 66 49852 → 8086 [ACK] Seq=2345 Ack=1259 Win=507 Len=0 TSval=3704106694 TSecr=2807840443
  145  11.809743 192.168.14.13 → 192.168.206.155 TCP 96 49852 → 8086 [PSH, ACK] Seq=2345 Ack=1259 Win=507 Len=30 TSval=3704106694 TSecr=2807840443
  146  11.809829 192.168.206.155 → 192.168.14.13 TCP 83 8086 → 49852 [PSH, ACK] Seq=1259 Ack=2375 Win=501 Len=17 TSval=2807840444 TSecr=3704106694
  147  11.810016 192.168.14.13 → 192.168.206.155 TCP 66 49852 → 8086 [ACK] Seq=2375 Ack=1276 Win=507 Len=0 TSval=3704106695 TSecr=2807840444
  148  13.097305 192.168.14.13 → 192.168.206.155 TCP 181 49852 → 8086 [PSH, ACK] Seq=2375 Ack=1276 Win=507 Len=115 TSval=3704107982 TSecr=2807840444
  149  13.097642 192.168.206.155 → 192.168.14.13 TCP 96 8086 → 49852 [PSH, ACK] Seq=1276 Ack=2490 Win=501 Len=30 TSval=2807841731 TSecr=3704107982
  150  13.097974 192.168.14.13 → 192.168.206.155 TCP 66 49852 → 8086 [ACK] Seq=2490 Ack=1306 Win=507 Len=0 TSval=3704107983 TSecr=2807841731
  151  13.098022 192.168.14.13 → 192.168.206.155 TCP 83 49852 → 8086 [PSH, ACK] Seq=2490 Ack=1306 Win=507 Len=17 TSval=3704107983 TSecr=2807841731
  152  13.098188 192.168.206.155 → 192.168.14.13 TCP 104 8086 → 49852 [PSH, ACK] Seq=1306 Ack=2507 Win=501 Len=38 TSval=2807841732 TSecr=3704107983
  153  13.098399 192.168.14.13 → 192.168.206.155 TCP 66 49852 → 8086 [ACK] Seq=2507 Ack=1344 Win=507 Len=0 TSval=3704107983 TSecr=2807841732
  154  13.098483 192.168.14.13 → 192.168.206.155 TCP 96 49852 → 8086 [PSH, ACK] Seq=2507 Ack=1344 Win=507 Len=30 TSval=3704107983 TSecr=2807841732
  155  13.098573 192.168.206.155 → 192.168.14.13 TCP 83 8086 → 49852 [PSH, ACK] Seq=1344 Ack=2537 Win=501 Len=17 TSval=2807841732 TSecr=3704107983
  156  13.098771 192.168.14.13 → 192.168.206.155 TCP 66 49852 → 8086 [ACK] Seq=2537 Ack=1361 Win=507 Len=0 TSval=3704107984 TSecr=2807841732
  157  13.504435 192.168.14.13 → 192.168.206.155 TCP 169 49852 → 8086 [PSH, ACK] Seq=2537 Ack=1361 Win=507 Len=103 TSval=3704108389 TSecr=2807841732
  158  13.504671 192.168.206.155 → 192.168.14.13 TCP 96 8086 → 49852 [PSH, ACK] Seq=1361 Ack=2640 Win=501 Len=30 TSval=2807842138 TSecr=3704108389
  159  13.504905 192.168.14.13 → 192.168.206.155 TCP 66 49852 → 8086 [ACK] Seq=2640 Ack=1391 Win=507 Len=0 TSval=3704108390 TSecr=2807842138
  160  13.504980 192.168.14.13 → 192.168.206.155 TCP 83 49852 → 8086 [PSH, ACK] Seq=2640 Ack=1391 Win=507 Len=17 TSval=3704108390 TSecr=2807842138
  161  13.505145 192.168.206.155 → 192.168.14.13 TCP 104 8086 → 49852 [PSH, ACK] Seq=1391 Ack=2657 Win=501 Len=38 TSval=2807842139 TSecr=3704108390
  162  13.505333 192.168.14.13 → 192.168.206.155 TCP 66 49852 → 8086 [ACK] Seq=2657 Ack=1429 Win=507 Len=0 TSval=3704108390 TSecr=2807842139
  163  13.505432 192.168.14.13 → 192.168.206.155 TCP 96 49852 → 8086 [PSH, ACK] Seq=2657 Ack=1429 Win=507 Len=30 TSval=3704108390 TSecr=2807842139
  164  13.505524 192.168.206.155 → 192.168.14.13 TCP 83 8086 → 49852 [PSH, ACK] Seq=1429 Ack=2687 Win=501 Len=17 TSval=2807842139 TSecr=3704108390
  165  13.505744 192.168.14.13 → 192.168.206.155 TCP 66 49852 → 8086 [ACK] Seq=2687 Ack=1446 Win=507 Len=0 TSval=3704108391 TSecr=2807842139
  166  13.841699 192.168.14.13 → 192.168.206.155 TCP 181 49852 → 8086 [PSH, ACK] Seq=2687 Ack=1446 Win=507 Len=115 TSval=3704108726 TSecr=2807842139
  167  13.841898 192.168.206.155 → 192.168.14.13 TCP 96 8086 → 49852 [PSH, ACK] Seq=1446 Ack=2802 Win=501 Len=30 TSval=2807842476 TSecr=3704108726
  168  13.842096 192.168.14.13 → 192.168.206.155 TCP 66 49852 → 8086 [ACK] Seq=2802 Ack=1476 Win=507 Len=0 TSval=3704108727 TSecr=2807842476
  169  13.842402 192.168.206.155 → 192.168.14.13 TCP 104 8086 → 49852 [PSH, ACK] Seq=1476 Ack=2802 Win=501 Len=38 TSval=2807842476 TSecr=3704108727
  170  13.842587 192.168.14.13 → 192.168.206.155 TCP 66 49852 → 8086 [ACK] Seq=2802 Ack=1514 Win=507 Len=0 TSval=3704108727 TSecr=2807842476
  171  13.842660 192.168.14.13 → 192.168.206.155 TCP 83 49852 → 8086 [PSH, ACK] Seq=2802 Ack=1514 Win=507 Len=17 TSval=3704108727 TSecr=2807842476
  172  13.842712 192.168.14.13 → 192.168.206.155 TCP 96 49852 → 8086 [PSH, ACK] Seq=2819 Ack=1514 Win=507 Len=30 TSval=3704108727 TSecr=2807842476
  173  13.842775 192.168.206.155 → 192.168.14.13 TCP 66 8086 → 49852 [ACK] Seq=1514 Ack=2849 Win=501 Len=0 TSval=2807842477 TSecr=3704108727
  174  13.842905 192.168.206.155 → 192.168.14.13 TCP 83 8086 → 49852 [PSH, ACK] Seq=1514 Ack=2849 Win=501 Len=17 TSval=2807842477 TSecr=3704108727
  175  13.843067 192.168.14.13 → 192.168.206.155 TCP 66 49852 → 8086 [ACK] Seq=2849 Ack=1531 Win=507 Len=0 TSval=3704108728 TSecr=2807842477
  176  13.846378 192.168.14.13 → 192.168.206.155 TCP 181 49852 → 8086 [PSH, ACK] Seq=2849 Ack=1531 Win=507 Len=115 TSval=3704108731 TSecr=2807842477
  177  13.846517 192.168.206.155 → 192.168.14.13 TCP 96 8086 → 49852 [PSH, ACK] Seq=1531 Ack=2964 Win=501 Len=30 TSval=2807842480 TSecr=3704108731
  178  13.846692 192.168.14.13 → 192.168.206.155 TCP 66 49852 → 8086 [ACK] Seq=2964 Ack=1561 Win=507 Len=0 TSval=3704108731 TSecr=2807842480
  179  13.846756 192.168.14.13 → 192.168.206.155 TCP 83 49852 → 8086 [PSH, ACK] Seq=2964 Ack=1561 Win=507 Len=17 TSval=3704108732 TSecr=2807842480
  180  13.847003 192.168.206.155 → 192.168.14.13 TCP 104 8086 → 49852 [PSH, ACK] Seq=1561 Ack=2981 Win=501 Len=38 TSval=2807842481 TSecr=3704108732
  181  13.847200 192.168.14.13 → 192.168.206.155 TCP 66 49852 → 8086 [ACK] Seq=2981 Ack=1599 Win=507 Len=0 TSval=3704108732 TSecr=2807842481
  182  13.847312 192.168.14.13 → 192.168.206.155 TCP 96 49852 → 8086 [PSH, ACK] Seq=2981 Ack=1599 Win=507 Len=30 TSval=3704108732 TSecr=2807842481
  183  13.847387 192.168.206.155 → 192.168.14.13 TCP 83 8086 → 49852 [PSH, ACK] Seq=1599 Ack=3011 Win=501 Len=17 TSval=2807842481 TSecr=3704108732
  184  13.847560 192.168.14.13 → 192.168.206.155 TCP 66 49852 → 8086 [ACK] Seq=3011 Ack=1616 Win=507 Len=0 TSval=3704108732 TSecr=2807842481
  185  14.597287 192.168.14.13 → 192.168.206.155 TCP 179 49852 → 8086 [PSH, ACK] Seq=3011 Ack=1616 Win=507 Len=113 TSval=3704109482 TSecr=2807842481
  186  14.597506 192.168.206.155 → 192.168.14.13 TCP 96 8086 → 49852 [PSH, ACK] Seq=1616 Ack=3124 Win=501 Len=30 TSval=2807843231 TSecr=3704109482
  187  14.597725 192.168.14.13 → 192.168.206.155 TCP 66 49852 → 8086 [ACK] Seq=3124 Ack=1646 Win=507 Len=0 TSval=3704109482 TSecr=2807843231
  188  14.597790 192.168.14.13 → 192.168.206.155 TCP 83 49852 → 8086 [PSH, ACK] Seq=3124 Ack=1646 Win=507 Len=17 TSval=3704109483 TSecr=2807843231
  189  14.598125 192.168.206.155 → 192.168.14.13 TCP 104 8086 → 49852 [PSH, ACK] Seq=1646 Ack=3141 Win=501 Len=38 TSval=2807843232 TSecr=3704109483
  190  14.598319 192.168.14.13 → 192.168.206.155 TCP 66 49852 → 8086 [ACK] Seq=3141 Ack=1684 Win=507 Len=0 TSval=3704109483 TSecr=2807843232
  191  14.598390 192.168.14.13 → 192.168.206.155 TCP 96 49852 → 8086 [PSH, ACK] Seq=3141 Ack=1684 Win=507 Len=30 TSval=3704109483 TSecr=2807843232
  192  14.598482 192.168.206.155 → 192.168.14.13 TCP 83 8086 → 49852 [PSH, ACK] Seq=1684 Ack=3171 Win=501 Len=17 TSval=2807843232 TSecr=3704109483
  193  14.598687 192.168.14.13 → 192.168.206.155 TCP 66 49852 → 8086 [ACK] Seq=3171 Ack=1701 Win=507 Len=0 TSval=3704109483 TSecr=2807843232
  194  15.672066 192.168.14.13 → 192.168.206.155 TCP 180 49852 → 8086 [PSH, ACK] Seq=3171 Ack=1701 Win=507 Len=114 TSval=3704110557 TSecr=2807843232
  195  15.672289 192.168.206.155 → 192.168.14.13 TCP 96 8086 → 49852 [PSH, ACK] Seq=1701 Ack=3285 Win=501 Len=30 TSval=2807844306 TSecr=3704110557
  196  15.672513 192.168.14.13 → 192.168.206.155 TCP 66 49852 → 8086 [ACK] Seq=3285 Ack=1731 Win=507 Len=0 TSval=3704110557 TSecr=2807844306
  197  15.672623 192.168.14.13 → 192.168.206.155 TCP 83 49852 → 8086 [PSH, ACK] Seq=3285 Ack=1731 Win=507 Len=17 TSval=3704110557 TSecr=2807844306
  198  15.672977 192.168.206.155 → 192.168.14.13 TCP 104 8086 → 49852 [PSH, ACK] Seq=1731 Ack=3302 Win=501 Len=38 TSval=2807844307 TSecr=3704110557
  199  15.673267 192.168.14.13 → 192.168.206.155 TCP 66 49852 → 8086 [ACK] Seq=3302 Ack=1769 Win=507 Len=0 TSval=3704110558 TSecr=2807844307
  200  15.673463 192.168.14.13 → 192.168.206.155 TCP 96 49852 → 8086 [PSH, ACK] Seq=3302 Ack=1769 Win=507 Len=30 TSval=3704110558 TSecr=2807844307
  201  15.673600 192.168.206.155 → 192.168.14.13 TCP 83 8086 → 49852 [PSH, ACK] Seq=1769 Ack=3332 Win=501 Len=17 TSval=2807844307 TSecr=3704110558
  202  15.673808 192.168.14.13 → 192.168.206.155 TCP 66 49852 → 8086 [ACK] Seq=3332 Ack=1786 Win=507 Len=0 TSval=3704110559 TSecr=2807844307
  203  17.582240 192.168.14.13 → 192.168.206.155 TCP 180 49852 → 8086 [PSH, ACK] Seq=3332 Ack=1786 Win=507 Len=114 TSval=3704112467 TSecr=2807844307
  204  17.582445 192.168.206.155 → 192.168.14.13 TCP 96 8086 → 49852 [PSH, ACK] Seq=1786 Ack=3446 Win=501 Len=30 TSval=2807846216 TSecr=3704112467
  205  17.582642 192.168.14.13 → 192.168.206.155 TCP 66 49852 → 8086 [ACK] Seq=3446 Ack=1816 Win=507 Len=0 TSval=3704112467 TSecr=2807846216
  206  17.582713 192.168.14.13 → 192.168.206.155 TCP 83 49852 → 8086 [PSH, ACK] Seq=3446 Ack=1816 Win=507 Len=17 TSval=3704112467 TSecr=2807846216
  207  17.583067 192.168.206.155 → 192.168.14.13 TCP 104 8086 → 49852 [PSH, ACK] Seq=1816 Ack=3463 Win=501 Len=38 TSval=2807846217 TSecr=3704112467
  208  17.583509 192.168.14.13 → 192.168.206.155 TCP 66 49852 → 8086 [ACK] Seq=3463 Ack=1854 Win=507 Len=0 TSval=3704112468 TSecr=2807846217
  209  17.583537 192.168.14.13 → 192.168.206.155 TCP 96 49852 → 8086 [PSH, ACK] Seq=3463 Ack=1854 Win=507 Len=30 TSval=3704112468 TSecr=2807846217
  210  17.583713 192.168.206.155 → 192.168.14.13 TCP 83 8086 → 49852 [PSH, ACK] Seq=1854 Ack=3493 Win=501 Len=17 TSval=2807846217 TSecr=3704112468
  211  17.583925 192.168.14.13 → 192.168.206.155 TCP 66 49852 → 8086 [ACK] Seq=3493 Ack=1871 Win=507 Len=0 TSval=3704112469 TSecr=2807846217
  212  17.995376 192.168.206.155 → 10.110.26.230 SSL 120 Continuation Data
  213  17.995981 10.110.26.230 → 192.168.206.155 SSL 119 Continuation Data
  214  17.996005 192.168.206.155 → 10.110.26.230 TCP 66 38220 → 27017 [ACK] Seq=167 Ack=426 Win=6146 Len=0 TSval=973435243 TSecr=3226855632
  215  19.335055 192.168.14.13 → 192.168.206.155 TCP 178 49852 → 8086 [PSH, ACK] Seq=3493 Ack=1871 Win=507 Len=112 TSval=3704114220 TSecr=2807846217
  216  19.335321 192.168.206.155 → 192.168.14.13 TCP 96 8086 → 49852 [PSH, ACK] Seq=1871 Ack=3605 Win=501 Len=30 TSval=2807847969 TSecr=3704114220
  217  19.335520 192.168.14.13 → 192.168.206.155 TCP 66 49852 → 8086 [ACK] Seq=3605 Ack=1901 Win=507 Len=0 TSval=3704114220 TSecr=2807847969
  218  19.335588 192.168.14.13 → 192.168.206.155 TCP 83 49852 → 8086 [PSH, ACK] Seq=3605 Ack=1901 Win=507 Len=17 TSval=3704114220 TSecr=2807847969
  219  19.335909 192.168.206.155 → 192.168.14.13 TCP 104 8086 → 49852 [PSH, ACK] Seq=1901 Ack=3622 Win=501 Len=38 TSval=2807847970 TSecr=3704114220
  220  19.336232 192.168.14.13 → 192.168.206.155 TCP 66 49852 → 8086 [ACK] Seq=3622 Ack=1939 Win=507 Len=0 TSval=3704114221 TSecr=2807847970
  221  19.336326 192.168.14.13 → 192.168.206.155 TCP 96 49852 → 8086 [PSH, ACK] Seq=3622 Ack=1939 Win=507 Len=30 TSval=3704114221 TSecr=2807847970
  222  19.336430 192.168.206.155 → 192.168.14.13 TCP 83 8086 → 49852 [PSH, ACK] Seq=1939 Ack=3652 Win=501 Len=17 TSval=2807847970 TSecr=3704114221
  223  19.383835 192.168.14.13 → 192.168.206.155 TCP 66 49852 → 8086 [ACK] Seq=3652 Ack=1956 Win=507 Len=0 TSval=3704114269 TSecr=2807847970
  224  19.814566 192.168.14.13 → 192.168.206.155 TCP 237 49852 → 8086 [PSH, ACK] Seq=3652 Ack=1956 Win=507 Len=171 TSval=3704114699 TSecr=2807847970
  225  19.814869 192.168.206.155 → 192.168.14.13 TCP 96 8086 → 49852 [PSH, ACK] Seq=1956 Ack=3823 Win=501 Len=30 TSval=2807848449 TSecr=3704114699
  226  19.815100 192.168.14.13 → 192.168.206.155 TCP 66 49852 → 8086 [ACK] Seq=3823 Ack=1986 Win=507 Len=0 TSval=3704114700 TSecr=2807848449
  227  19.815153 192.168.14.13 → 192.168.206.155 TCP 83 49852 → 8086 [PSH, ACK] Seq=3823 Ack=1986 Win=507 Len=17 TSval=3704114700 TSecr=2807848449
  228  19.815371 192.168.206.155 → 192.168.14.13 TCP 104 8086 → 49852 [PSH, ACK] Seq=1986 Ack=3840 Win=501 Len=38 TSval=2807848449 TSecr=3704114700
  229  19.815558 192.168.14.13 → 192.168.206.155 TCP 66 49852 → 8086 [ACK] Seq=3840 Ack=2024 Win=507 Len=0 TSval=3704114700 TSecr=2807848449
  230  19.815665 192.168.14.13 → 192.168.206.155 TCP 96 49852 → 8086 [PSH, ACK] Seq=3840 Ack=2024 Win=507 Len=30 TSval=3704114700 TSecr=2807848449
  231  19.815761 192.168.206.155 → 192.168.14.13 TCP 83 8086 → 49852 [PSH, ACK] Seq=2024 Ack=3870 Win=501 Len=17 TSval=2807848450 TSecr=3704114700
  232  19.815964 192.168.14.13 → 192.168.206.155 TCP 66 49852 → 8086 [ACK] Seq=3870 Ack=2041 Win=507 Len=0 TSval=3704114701 TSecr=2807848450
  233  20.472222 192.168.14.13 → 192.168.206.155 TCP 181 49852 → 8086 [PSH, ACK] Seq=3870 Ack=2041 Win=507 Len=115 TSval=3704115357 TSecr=2807848450
  234  20.472529 192.168.206.155 → 192.168.14.13 TCP 96 8086 → 49852 [PSH, ACK] Seq=2041 Ack=3985 Win=501 Len=30 TSval=2807849106 TSecr=3704115357
  235  20.472868 192.168.14.13 → 192.168.206.155 TCP 66 49852 → 8086 [ACK] Seq=3985 Ack=2071 Win=507 Len=0 TSval=3704115358 TSecr=2807849106
  236  20.473038 192.168.14.13 → 192.168.206.155 TCP 83 49852 → 8086 [PSH, ACK] Seq=3985 Ack=2071 Win=507 Len=17 TSval=3704115358 TSecr=2807849106
  237  20.473095 192.168.206.155 → 192.168.14.13 TCP 104 8086 → 49852 [PSH, ACK] Seq=2071 Ack=4002 Win=501 Len=38 TSval=2807849107 TSecr=3704115358
  238  20.473300 192.168.14.13 → 192.168.206.155 TCP 66 49852 → 8086 [ACK] Seq=4002 Ack=2109 Win=507 Len=0 TSval=3704115358 TSecr=2807849107
  239  20.473412 192.168.14.13 → 192.168.206.155 TCP 96 49852 → 8086 [PSH, ACK] Seq=4002 Ack=2109 Win=507 Len=30 TSval=3704115358 TSecr=2807849107
  240  20.473528 192.168.206.155 → 192.168.14.13 TCP 83 8086 → 49852 [PSH, ACK] Seq=2109 Ack=4032 Win=501 Len=17 TSval=2807849107 TSecr=3704115358
  241  20.473748 192.168.14.13 → 192.168.206.155 TCP 66 49852 → 8086 [ACK] Seq=4032 Ack=2126 Win=507 Len=0 TSval=3704115359 TSecr=2807849107
  242  20.772519 192.168.14.13 → 192.168.206.155 TCP 180 49852 → 8086 [PSH, ACK] Seq=4032 Ack=2126 Win=507 Len=114 TSval=3704115657 TSecr=2807849107
  243  20.772785 192.168.206.155 → 192.168.14.13 TCP 96 8086 → 49852 [PSH, ACK] Seq=2126 Ack=4146 Win=501 Len=30 TSval=2807849407 TSecr=3704115657
  244  20.773187 192.168.14.13 → 192.168.206.155 TCP 66 49852 → 8086 [ACK] Seq=4146 Ack=2156 Win=507 Len=0 TSval=3704115658 TSecr=2807849407
  245  20.773286 192.168.14.13 → 192.168.206.155 TCP 83 49852 → 8086 [PSH, ACK] Seq=4146 Ack=2156 Win=507 Len=17 TSval=3704115658 TSecr=2807849407
  246  20.773389 192.168.206.155 → 192.168.14.13 TCP 104 8086 → 49852 [PSH, ACK] Seq=2156 Ack=4163 Win=501 Len=38 TSval=2807849407 TSecr=3704115658
  247  20.773600 192.168.14.13 → 192.168.206.155 TCP 66 49852 → 8086 [ACK] Seq=4163 Ack=2194 Win=507 Len=0 TSval=3704115658 TSecr=2807849407
  248  20.773763 192.168.14.13 → 192.168.206.155 TCP 96 49852 → 8086 [PSH, ACK] Seq=4163 Ack=2194 Win=507 Len=30 TSval=3704115658 TSecr=2807849407
  249  20.773886 192.168.206.155 → 192.168.14.13 TCP 83 8086 → 49852 [PSH, ACK] Seq=2194 Ack=4193 Win=501 Len=17 TSval=2807849408 TSecr=3704115658
  250  20.774097 192.168.14.13 → 192.168.206.155 TCP 66 49852 → 8086 [ACK] Seq=4193 Ack=2211 Win=507 Len=0 TSval=3704115659 TSecr=2807849408
  251  21.152919 192.168.14.13 → 192.168.206.155 TCP 159 49852 → 8086 [PSH, ACK] Seq=4193 Ack=2211 Win=507 Len=93 TSval=3704116038 TSecr=2807849408
  252  21.153126 192.168.206.155 → 192.168.14.13 TCP 96 8086 → 49852 [PSH, ACK] Seq=2211 Ack=4286 Win=501 Len=30 TSval=2807849787 TSecr=3704116038
  253  21.153316 192.168.14.13 → 192.168.206.155 TCP 66 49852 → 8086 [ACK] Seq=4286 Ack=2241 Win=507 Len=0 TSval=3704116038 TSecr=2807849787
  254  21.153383 192.168.14.13 → 192.168.206.155 TCP 83 49852 → 8086 [PSH, ACK] Seq=4286 Ack=2241 Win=507 Len=17 TSval=3704116038 TSecr=2807849787
  255  21.153647 192.168.206.155 → 192.168.14.13 TCP 104 8086 → 49852 [PSH, ACK] Seq=2241 Ack=4303 Win=501 Len=38 TSval=2807849787 TSecr=3704116038
  256  21.153838 192.168.14.13 → 192.168.206.155 TCP 66 49852 → 8086 [ACK] Seq=4303 Ack=2279 Win=507 Len=0 TSval=3704116039 TSecr=2807849787
  257  21.154037 192.168.14.13 → 192.168.206.155 TCP 96 49852 → 8086 [PSH, ACK] Seq=4303 Ack=2279 Win=507 Len=30 TSval=3704116039 TSecr=2807849787
  258  21.154122 192.168.206.155 → 192.168.14.13 TCP 83 8086 → 49852 [PSH, ACK] Seq=2279 Ack=4333 Win=501 Len=17 TSval=2807849788 TSecr=3704116039
  259  21.154365 192.168.14.13 → 192.168.206.155 TCP 66 49852 → 8086 [ACK] Seq=4333 Ack=2296 Win=507 Len=0 TSval=3704116039 TSecr=2807849788
  260  21.351426 192.168.14.13 → 192.168.206.155 TCP 181 49852 → 8086 [PSH, ACK] Seq=4333 Ack=2296 Win=507 Len=115 TSval=3704116236 TSecr=2807849788
  261  21.351623 192.168.206.155 → 192.168.14.13 TCP 96 8086 → 49852 [PSH, ACK] Seq=2296 Ack=4448 Win=501 Len=30 TSval=2807849985 TSecr=3704116236
  262  21.351846 192.168.14.13 → 192.168.206.155 TCP 66 49852 → 8086 [ACK] Seq=4448 Ack=2326 Win=507 Len=0 TSval=3704116237 TSecr=2807849985
  263  21.351906 192.168.14.13 → 192.168.206.155 TCP 83 49852 → 8086 [PSH, ACK] Seq=4448 Ack=2326 Win=507 Len=17 TSval=3704116237 TSecr=2807849985
  264  21.352189 192.168.206.155 → 192.168.14.13 TCP 104 8086 → 49852 [PSH, ACK] Seq=2326 Ack=4465 Win=501 Len=38 TSval=2807849986 TSecr=3704116237
  265  21.352410 192.168.14.13 → 192.168.206.155 TCP 66 49852 → 8086 [ACK] Seq=4465 Ack=2364 Win=507 Len=0 TSval=3704116237 TSecr=2807849986
  266  21.352516 192.168.14.13 → 192.168.206.155 TCP 96 49852 → 8086 [PSH, ACK] Seq=4465 Ack=2364 Win=507 Len=30 TSval=3704116237 TSecr=2807849986
  267  21.352686 192.168.206.155 → 192.168.14.13 TCP 83 8086 → 49852 [PSH, ACK] Seq=2364 Ack=4495 Win=501 Len=17 TSval=2807849986 TSecr=3704116237
  268  21.352880 192.168.14.13 → 192.168.206.155 TCP 66 49852 → 8086 [ACK] Seq=4495 Ack=2381 Win=507 Len=0 TSval=3704116238 TSecr=2807849986
  269  21.488940 192.168.14.13 → 192.168.206.155 TCP 180 49852 → 8086 [PSH, ACK] Seq=4495 Ack=2381 Win=507 Len=114 TSval=3704116374 TSecr=2807849986
  270  21.489200 192.168.206.155 → 192.168.14.13 TCP 96 8086 → 49852 [PSH, ACK] Seq=2381 Ack=4609 Win=501 Len=30 TSval=2807850123 TSecr=3704116374
  271  21.489427 192.168.14.13 → 192.168.206.155 TCP 66 49852 → 8086 [ACK] Seq=4609 Ack=2411 Win=507 Len=0 TSval=3704116374 TSecr=2807850123
  272  21.489536 192.168.14.13 → 192.168.206.155 TCP 83 49852 → 8086 [PSH, ACK] Seq=4609 Ack=2411 Win=507 Len=17 TSval=3704116374 TSecr=2807850123
  273  21.489770 192.168.206.155 → 192.168.14.13 TCP 104 8086 → 49852 [PSH, ACK] Seq=2411 Ack=4626 Win=501 Len=38 TSval=2807850124 TSecr=3704116374
  274  21.489971 192.168.14.13 → 192.168.206.155 TCP 66 49852 → 8086 [ACK] Seq=4626 Ack=2449 Win=507 Len=0 TSval=3704116375 TSecr=2807850124
  275  21.490060 192.168.14.13 → 192.168.206.155 TCP 96 49852 → 8086 [PSH, ACK] Seq=4626 Ack=2449 Win=507 Len=30 TSval=3704116375 TSecr=2807850124
  276  21.490163 192.168.206.155 → 192.168.14.13 TCP 83 8086 → 49852 [PSH, ACK] Seq=2449 Ack=4656 Win=501 Len=17 TSval=2807850124 TSecr=3704116375
  277  21.490384 192.168.14.13 → 192.168.206.155 TCP 66 49852 → 8086 [ACK] Seq=4656 Ack=2466 Win=507 Len=0 TSval=3704116375 TSecr=2807850124
  278  21.497113 192.168.14.13 → 192.168.206.155 TCP 180 49852 → 8086 [PSH, ACK] Seq=4656 Ack=2466 Win=507 Len=114 TSval=3704116382 TSecr=2807850124
